word,spell,type,meaning
คุณจะสอบสวนยังไงก็ไม่ได้ความจริงหรอก เพราะสองคนนั้นเขาซูเอี๋ยกัน,khoonM jaL saawpL suaanR yangM ngaiM gaawF maiF daiF khwaamM jingM raawkL phrawH saawngR khohnM nanH khaoR suuM iiaR ganM,example sentence,"No matter how much you try to interrogate them, you will not obtain the truth because the two of them have formed a secret pact."
คุณจะหน้ามืดตามัวใช้กำลังกับเธอแบบนั้นหรือ ,khoonM jaL naaF meuutF dtaaM muaaM chaiH gamM langM gapL thuuhrM baaepL nanH reuuR,example sentence,How could you be so lost as to use force on her?!
คุณจะอยู่เชียงใหม่นานเท่าไร,khoonM jaL yuuL chiiangM maiL naanM thaoF raiM,example sentence,How long will you be in Chiang Mai?
คุณจะอยู่เชียงใหม่นานเท่าไรครับ,khoonM jaL yuuL chiiangM maiL naanM thaoF raiM khrapH,example sentence,How long will you stay in Chiang Mai?
คุณจะเอาหนังสือกี่เล่มคะ ,khoonM jaL aoM nangR seuuR geeL lemF khaH,example sentence,"[spoken by female] ""How many books will you take?"
คุณจ่ายเงินยังไม่ครบ,khoonM jaaiL ngernM yangM maiF khrohpH,example sentence,You haven't completed your payment yet.
คุณโจ้แต่งตัวอย่างนี้ หล่อจัง,khoonM jo:hF dtaengL dtuaaM yaangL neeH laawL jangM,example sentence,"If Joe dresses like this, he will look really good!"
คุณฉลวยละครับ แต่งตัวยังไม่เสร็จอีกหรือ ,khoonM chaL luayR laH khrapH dtaengL dtuaaM yangM maiF setL eekL reuuR,example sentence,How about Chaluay; isn't she dressed yet?
คุณช่วยเขยิบเก้าอี้ไปใกล้หน้าต่างอีกนิดได้ไหมครับ,khoonM chuayF khaL yeerpL gaoF eeF bpaiM glaiF naaF dtaangL eekL nitH daiF maiH khrapH,example sentence,Could you please move your chair a little closer to the window?
คุณช่วยจ่ายฉันก่อนล่วงหน้าได้ไหม,khoonM chuayF jaaiL chanR gaawnL luaangF naaF daiF maiH,example sentence,Could you pay me in advance?
คุณช่วยฉันสั่งอาหารได้ไหม ,khoonM chuayF chanR sangL aaM haanR daiF maiH,example sentence,Could you please help me order some food?
คุณช่วยทวนอีกครั้งได้ไหม,khoonM chuayF thuaanM eekL khrangH daiF maiH,example sentence,Can you please say that again?
คุณช่วยแนะนำฉันกับผู้หญิงคนนั้นไหม ,khoonM chuayF naeH namM chanR gapL phuuF yingR khohnM nanH maiH,example sentence,Could you please introduce me to that lady?
คุณช่วยอ่านป้ายนี้ให้ฉันหน่อยได้ไหม ,khoonM chuayF aanL bpaaiF neeH haiF chanR naawyL daiF maiH,example sentence,Could you please read this sign to me?
คุณชอบกินไอติมรสอะไร,khoonM chaawpF ginM aiM dtimM rohtH aL raiM,example sentence,What ice cream flavor do you like?
คุณชอบประเทศของเราอย่างไร ,khoonM chaawpF bpraL thaehtF khaawngR raoM yaangL raiM,example sentence,How do you like our country?
คุณชอบเป็นทหารหรือ,khoonM chaawpF bpenM thaH haanR reuuR,example sentence,‘Do you [actually] like being in the military? [Is this something you really like?].
คุณชอบเป็นทหารไหม,khoonM chaawpF bpenM thaH haanR maiR,example sentence,"Do you like [the whole idea of] being in the military? [Does it appeal to you?]."" ""Would you like to join the military?"
คุณชอบฟังเพลงอะไรมากที่สุด,khoonM chaawpF fangM phlaehngM aL raiM maakF theeF sootL,example sentence,What songs do you like to listen to most?
คุณชอบอยู่เมืองไทยไหม ,khoonM chaawpF yuuL meuuangM thaiM maiH,"example sentence, colloquial",Do you like living in Thailand?
คุณชอบอาหารญี่ปุ่นไหม ,khoonM chaawpF aaM haanR yeeF bpoonL maiH,example sentence,Do you like Japanese food?
คุณชาติเนี่ย... เขาเป็นผู้ชายพรรค์อย่างว่า ,khoonM chaatF niiaF khaoR bpenM phuuF chaaiM phanM yaangL waaF,"example sentence, colloquial",Mr. Chati is that kind of man (i.e. gay).
คุณชื่อไร,khoonM cheuuF raiM,example sentence,"[colloquial pronunciation] ""What's your name."
คุณชื่ออะไร ,khoonM cheuuF aL raiM,phrase,"What is your name?"" — ""What's your name?"
คุณใช้ไขหรือน้ำมันสัตว์ที่ทำกับข้าวหรือเปล่า,khoonM chaiH khaiR reuuR namH manM satL theeF thamM gapL khaaoF reuuR bplaaoL,example sentence,Do you use lard or animal fat in your cooking?
คุณใช้ตะเกียบเป็นไหม,khoonM chaiH dtaL giiapL bpenM maiR,example sentence,Can you use chopsticks?
คุณใช้บาร์เบลล์นี้อยู่หรือเปล่าครับ,khoonM chaiH baaM baehnM neeH yuuL reuuR bplaaoL khrapH,example sentence,Are you using this bar bell?
คุณใช้แผ่นน้ำหนักพวกนี้อยู่หรือเปล่าครับ,khoonM chaiH phaenL namH nakL phuaakF neeH yuuL reuuR bplaaoL khrapH,example sentence,Are you using these weights?
คุณซุ่มซ่ามแค่ไหน,khoonM soomF saamF khaaeF naiR,example sentence,How clumsy are you?
คุณดูเหมือนพ่อของลูกฉันเลยนะ,khoonM duuM meuuanR phaawF khaawngR luukF chanR leeuyM naH,example sentence,"You look like my husband-to-be."" ""You look like the father of my [unborn] children."
คุณแดงเข้าไปในห้อง,khoonM daaengM khaoF bpaiM naiM haawngF,example sentence,Dang went into the room.
คุณแดงเข้ามาในห้อง,khoonM daaengM khaoF maaM naiM haawngF,example sentence,Dang came into the room.
คุณได้รับเงินที่ผมส่งไปให้หรือเปล่า,khoonM daiF rapH ngernM theeF phohmR sohngL bpaiM haiF reuuR bplaaoL,example sentence,Did you get the money I sent you?
คุณต้องการซื้ออะไรครับ ,khoonM dtawngF gaanM seuuH aL raiM khrapH,example sentence,"[spoken by male] ""What do you want to buy."
,,,
คุณต้องการเท่าไรครับ ,khoonM dtawngF gaanM thaoF raiM khrapH,example sentence,"[spoken by male] ""How many do you want?"
คุณต้องการน้ำชาอีกไหมคะ ,khoonM dtawngF gaanM namH chaaM eekL maiH khaH,example sentence,Will you have some more tea?
คุณต้องการพบหมอใช่ไหมคะ ,khoonM dtawngF gaanM phohpH maawR chaiF maiH khaH,example sentence,"[spoken by a female] ""Do you want to see the doctor?"
คุณต้องการยังงี้หรือ,khoonM dtawngF gaanM yangM ngeeH reuuR,example sentence,Is this the way you want it?
คุณต้องการอะไรครับ ,khoonM dtawngF gaanM aL raiM khrapH,example sentence,"[spoken by male] ""What do you want?"
คุณต้องจริงจังหน่อย,khoonM dtawngF jingM jangM naawyL,example sentence,You need to get serious.
คุณต้องซื้ออาหารนกอีกห่อนึงค่ะ ,khoonM dtawngF seuuH aaM haanR nohkH eekL haawL neungM khaF,example sentence,"[spoken by a female] ""You must buy another packet of birdseed, sir."
คุณต้องเปิดใจ และส่องกระจกดูความผิดพลาดในการเดินหมากทางการเมืองของตัวเอง,khoonM dtawngF bpeertL jaiM laeH saawngL graL johkL duuM khwaamM phitL phlaatF naiM gaanM deernM maakL thaangM gaanM meuuangM khaawngR dtuaaM aehngM,example sentence,You need to be honest and look in the mirror to see any mistakes you have made in your own political life.
คุณต้องมาอีกครั้งนะ ,khoonM dtawngF maaM eekL khrangH naH,example sentence,You must come again.
คุณต้องไม่ไปที่นั่น ,khoonM dtawngF maiF bpaiM theeF nanF,example sentence,You must not go there.
คุณต้องระวัง,khoonM dtawngF raH wangM,example sentence,You must be careful.
คุณต้องใส่เอี๊ยมให้ลูกก่อนป้อนข้าว,khoonM dtawngF saiL iiamH haiF luukF gaawnL bpaawnF khaaoF,example sentence,You need to put the baby's bib on before you feed him.
คุณตัดสินใจขับรถมอเตอร์ไซค์ออกไป คุณจำเป็นต้องใช้รองเท้า,khoonM dtatL sinR jaiM khapL rohtH maawM dtuuhrM saiM aawkL bpaiM khoonM jamM bpenM dtawngF chaiH raawngM thaaoH,example sentence,"Once you decide to drive out with the motorcycle, you must wear shoes."
คุณตา ,khoonM dtaaM,noun,maternal grandfather
"คุณตาครับ ถึงสถานีแล้ว"" เด็กหนุ่มปลุกอีกครั้ง ",khoonM dtaaM khrapH theungR saL thaaR neeM laaeoH dekL noomL bplookL eekL khrangH,example sentence,"“Grandfather, we reached the station already,” the young man yelled to wake him up."
"คุณตา- ""เค้าเรียกว่านิ้วมือ",khoonM dtaaM khaaoH riiakF waaF niuH meuuM,example sentence,"Grandfather: ""They called them 'fingers'."
คุณตาชอบเสาะหาพันธุ์ไม้แปลก ๆ ที่หายาก ๆ มาปลูกที่บ้าน,khoonM dtaaM chaawpF sawL haaR phanM maaiH bplaaekL theeF haaR yaakF maaM bpluukL theeF baanF,example sentence,My grandfather enjoys searching for unusual and hard-to-find seedlings and planting them at his home.
"คุณตา- ""มีซิหลาน แต่เค้าไม่เรียกเครื่องคิดเลขหรอก",khoonM dtaaM meeM siH laanR dtaaeL khaaoH maiF riiakF khreuuangF khitH laehkF raawkL,example sentence,"Grandfather: ""Yes, they did. But, they didn't call them calculators."
คุณตำรวจคะ คุณตำรวจคะ ชายคนนั้นต่างหากที่บุกรุก แต่ผู้หญิงคนนั้นเป็นเพื่อนของฉันเอง ,khoonM dtamM ruaatL khaH khoonM dtamM ruaatL khaH chaaiM khohnM nanH dtaangL haakL theeF bookL rookH dtaaeL phuuF yingR khohnM nanH bpenM pheuuanF khaawngR chanR aehngM,example sentence,"[a woman addressing a policeman] ""Officer, officer, it's that man who trespassed; that woman is my friend."
คุณตื่นจากฝันร้ายเพื่อมาพบกับความจริงที่อยู่ตรงหน้า,khoonM dteuunL jaakL fanR raaiH pheuuaF maaM phohpH gapL khwaamM jingM theeF yuuL dtrohngM naaF,example sentence,You wake from the nightmare to face reality.
คุณทราบไหมครับว่า เขามีบ้านกี่หลัง? ,khoonM saapF maiH khrapH waaF khaoR meeM baanF geeL langR,example sentence,"[spoken by a male] ""Do you know how many houses he has?"
คุณทราบไหมว่า... ,khoonM saapF maiR waaF,phrase,Do you know that...?
คุณทราบไหมว่าทำไมเขาจึงถูกจับ ,khoonM saapF maiH waaF thamM maiM khaoR jeungM thuukL japL,example sentence,Do you know why he was arrested?
คุณทำงานที่ไหน,khoonM thamM ngaanM theeF naiR,example sentence,Where do you work?
คุณทำอะไรเพื่อความสนุก ,khoonM thamM aL raiM pheuuaF khwaamM saL nookL,example sentence,What do you do for fun?
คุณแทนไทยเป็นกระบอกเสียงแถลงนโยบายทางเศรษฐกิจของนายกฯ ,khoonM thaaenM thaiM bpenM graL baawkL siiangR thaL laaengR naH yo:hM baaiM thaangM saehtL thaL gitL khaawngR naaM yohkH,example sentence,Mr. Tanthai is the mouthpiece for the the prime minister's economic policy.
คุณธรรม,khoonM naH thamM,noun,good; moral goodness; virtue; merit
คุณธรรมจริยธรรมและความโปร่งใส,khoonM naH thamM jaL riH yaH thamM laeH khwaamM bpro:hngL saiR,"noun, phrase","morality, ethics, and transparency"
คุณนรินทร์ศักดิ์พัวตระกูล อายุ 35 ปี จบปริญญาตรีจากสถาบันเทคโนโลยีราชมงคล วิทยาเขตพระนครศรีอยุธยาหันตรา วท.บ. (ประมง)ปริญญาโทจากมหาวิทยาลัยเกษตรศาสตร์เขตบางเขน วท.ม. (วิทยาศาสตร์การประมง),khoonM naH rinM sakL phuaaM dtraL guunM aaM yooH bpeeM johpL bpaL rinM yaaM dtreeM jaakL saL thaaR banM thaehkF no:hM lo:hM yeeM raatF chaH mohngM khohnM witH thaH yaaM khaehtL phraH naH khaawnM seeR aL yootH thaH yaaM hanR dtraaM witH thaH yaaM saatL saL dtraL banM ditL bpraL mohngM bpaL rinM yaaM tho:hM jaakL maH haaR witH thaH yaaM laiM gaL saehtL saatL khaehtL baangM khaehnR waawM thaawM maawM witH thaH yaaM saatL gaanM bpraL mohngM,example sentence,Mr Narinsak Phuatradul is 35 years old; he completed his Bachelor of Science (Fishing) degree at the Ayuthiya campus of Ratchamonkol Institute of Technology and his Master of Science (Fishing Husbandry) degree at the Bang Kaen campus of Kasetsart University.
คุณนรินทร์ศักดิ์ เล่าว่าตนได้นำความรู้และประสบการณ์ในทุก ๆ ด้านที่มีมาคิดค้น ทดลองเพาะพันธุ์ปลาสวายเนื้อขาวนอกฤดูกาล ที่ฟาร์มบ่อปลาณรงค์,khoonM naH rinM sakL laoF waaF dtohnM daiF namM khwaamM ruuH laeH bpraL sohpL gaanM naiM thookH thookH daanF theeF meeM maaM khitH khohnH thohtH laawngM phawH phanM bplaaM saL waaiR neuuaH khaaoR naawkF reuH duuM gaanM theeF faamM baawL bplaaM naH rohngM,example sentence,Mr. Narinsak told [us] that he brought all his knowledge and experience to bear to investigate and experiment with raising white meat catfish outside its normal season at the Narong fish farm.
คุณน่ะแหละ ชอบทำเสียงดังนัก,khoonM naF laeL chaawpF thamM siiangR dangM nakH,example sentence,You really like to make a lot of noise. [I see that you’re the one who does it].
คุณนั้น,khoonM nanH,"pronoun, vulgar",[very insulting 2nd person pronoun] you
คุณนั้นแย่,khoonM nanH yaaeF,"phrase, colloquial, vulgar",You asshole!
คุณนาย ,khoonM naaiM,,[honorific] Mrs.; Mr.
คุณนายบ้านนั้นโขกสับลูกจ้างอย่างไร้ความปรานี,khoonM naaiM baanF nanH kho:hkL sapL luukF jaangF yaangL raiH khwaamM bpraaM neeM,example sentence,The owner of that house mercilessly scolds her house-workers.
คุณนิ่แหละค่ะ ชอบทำเสียงดังนัก,khoonM niF laeL khaF chaawpF thamM siiangR dangM nakH,example sentence,You’re the one who loves making all that noise. [You need to realize that you are the one.]
คุณนึกดูแล้วกัน ผมเจ็บทรมาน,khoonM neukH duuM laaeoH ganM phohmR jepL thaawM raH maanM,example sentence,Think about it; I was hurt and was suffering.
คุณบอกว่าเขาเป็นคนเริ่มหาเรื่องและต่อยคุณก่อน แต่เขาเป็นคนที่สุภาพเรียบร้อยไม่ใช่พวกชอบสร้างปัญหา เรื่องของคุณฟังแล้วไม่สมเหตุสมผลเลย,khoonM baawkL waaF khaoR bpenM khohnM reermF haaR reuuangF laeH dtaawyL khoonM gaawnL dtaaeL khaoR bpenM khohnM theeF sooL phaapF riiapF raawyH maiF chaiF phuaakF chaawpF saangF bpanM haaR reuuangF khaawngR khoonM fangM laaeoH maiF sohmR haehtL sohmR phohnR leeuyM,example sentence,You said that he was the one who started it and hit you first. But he is a very polite and well-mannered person. He is not someone who likes to make trouble. I have listened to what you said and it doesn’t make any sense at all.
คุณแบ่งให้ผมถือมั่งเถอะ,khoonM baengL haiF phohmR theuuR mangF thuhL,example sentence,Why don’t you let me carry some of them?
คุณประพันธ์ได้เอื้อเฟื้ออาสาเป็นมัคคุเทศก์มือสมัครเล่นให้กับพวกเรา,khoonM bpraL phanM daiF euuaF feuuaH aaM saaR bpenM makH khooH thaehtF meuuM saL makL lenF haiF gapL phuaakF raoM,example sentence,Mr. Praphan has generously volunteered to act as an amateur tour guide for our group.
คุณประโยชน์,khoonM naH bpraL yo:htL,ancient,benefit; advantage; usefulness; utility; profit
คุณปล่อยเขาไปดีกว่า,khoonM bplaawyL khaoR bpaiM deeM gwaaL,example sentence,Letting him go is a better [idea].
คุณป้า,khoonM bpaaF,noun,[politely addressing an aunt] auntie
คุณป้าแต่งตัวกระชากวัยอย่างกับสาววัยรุ่น,khoonM bpaaF dtaengL dtuaaM graL chaakF waiM yaangL gapL saaoR waiM roonF,example sentence,"My aunt dresses young, like a teenager."
คุณป้าทอตาดด้วยฝีมือที่หาใครเทียบได้ยาก,khoonM bpaaF thaawM dtaatL duayF feeR meuuM theeF haaR khraiM thiiapF daiF yaakF,example sentence,My aunt weaves brocade fabric with unmatched skill.
คุณปู่ ,khoonM bpuuL,noun,paternal grandfather
คุณเป็นคนถนัดซ้ายหรือถนัดขวา,khoonM bpenM khohnM thaL natL saaiH reuuR thaL natL khwaaR,example sentence,Are you left-handed or right-handed?
คุณเป็นคนที่ไหน,khoonM bpenM khohnM theeF naiR,example sentence,Where are you from?
คุณเป็นคนอเมริกันใช่ไหม ,khoonM bpenM khohnM aL maehM riH ganM chaiF maiH,example sentence,"Are you American?"" ""You're an American, aren't you?"
คุณเป็นใคร ,khoonM bpenM khraiM,example sentence,Who are you?
,,,
คุณเป็นผู้ชายหรือผู้หญิง ,khoonM bpenM phuuF chaaiM reuuR phuuF yingR,"example sentence, vulgar",Are you a man or a woman?
คุณเป็นหนี้ผมมื้อหนึ่ง,khoonM bpenM neeF phohmR meuuH neungL,example sentence,You still owe me a meal.
คุณเป็นห่วงเกี่ยวกับอะไร ,khoonM bpenM huaangL giaaoL gapL aL raiM,example sentence,"What are you worrying about?"" — ""What are you worried about?"
คุณแปลไทยเป็นอังกฤษได้ไหม,khoonM bplaaeM thaiM bpenM angM gritL daiF maiH,example sentence,Can you translate Thai to English?
คุณไปหาหมอแล้วหรือยังแน่ใจนะว่าไม่เป็นอะไร ๆ,khoonM bpaiM haaR maawR laaeoH reuuR yangM naaeF jaiM naH waaF maiF bpenM aL raiM aL raiM,example sentence,Have you been to the doctor yet? Are you sure you're o.k.?
คุณผู้ชาย ,khoonM phuuF chaaiM,"pronoun, phrase, formal",[3rd person pronoun used by a servant to call his or her master] master
คุณผู้ชายกำลังทานอาหารเช้าอยู่ค่ะ ,khoonM phuuF chaaiM gamM langM thaanM aaM haanR chaaoH yuuL khaF,example sentence,"[spoken very politely and formally by a female servant] ""The master is having his breakfast."
คุณผู้ชายเข้าหาสาวใช้คนใหม่โดยที่คุณผู้หญิงไม่รู้,khoonM phuuF chaaiM khaoF haaR saaoR chaiH khohnM maiL dooyM theeF khoonM phuuF yingR maiF ruuH,example sentence,The master of the house had a tryst with the new maid without his wife’s knowledge.
คุณผู้หญิง ,khoonM phuuF yingR,"pronoun, phrase, formal",[3rd person pronoun used by a servant to call his or her master' wive] the master's wife
คุณพนิตคอยนายอยู่ถึงชั่วโมงครึ่ง ตอนนี้ เขาไปแล้ว ,khoonM phaH nitH khaawyM naaiM yuuL theungR chuaaF mo:hngM khreungF dtaawnM neeH khaoR bpaiM laaeoH,example sentence,Koon Panit waited an hour and a half for you; now he has gone.
คุณพระช่วย! ,khoonM phraH chuayF,"interjection, example sentence, colloquial","Oh, my goodness!; Oh, my god! Ohmigosh!; God!; Oh, my!"
คุณพระรัตนตรัย,khoonM phraH ratH dtaL naH dtraiM,proper noun,[คุณพระรัตนตรัย] The Triple Gem
คุณพอมีเวลาพาฉันไปไหม ,khoonM phaawM meeM waehM laaM phaaM chanR bpaiM maiH,example sentence,Do you have time to show me the way?
คุณพ่อ ,khoonM phaawF,noun,[respectful way to call one's father]
คุณพ่อของเขาเพิ่งเสียไปเมื่อปีกลาย,khoonM phaawF khaawngR khaoR pheerngF siiaR bpaiM meuuaF bpeeM glaaiM,example sentence,His father passed away just last year.
คุณพ่อชี้นำให้ลูกรู้จักค่าของเงิน,khoonM phaawF cheeH namM haiF luukF ruuH jakL khaaF khaawngR ngernM,example sentence,[My] father taught his children the value of money.
คุณพ่อตั้งใจจะไปต่อคิวซื้อตั๋วด้วยตัวเองเลยนะครับ แต่ปรากฏว่ายังไม่ถึงวันเตะตั๋วเต็มไปเรียบร้อยแล้วครับ,khoonM phaawF dtangF jaiM jaL bpaiM dtaawL khiuM seuuH dtuaaR duayF dtuaaM aehngM leeuyM naH khrapH dtaaeL bpraaM gohtL waaF yangM maiF theungR wanM dtehL dtuaaR dtemM bpaiM riiapF raawyH laaeoH khrapH,example sentence,"My father really wanted to get in line himself to buy the tickets, but it turned out that all the tickets were sold out even before the day of the match."
คุณพ่อทำอะไรอยู่ครับ,khoonM phaawF thamM aL raiM yuuL khrapH,example sentence,"What are you doing, Dad?"
คุณพ่อมาไม่ได้ เผอิญท่านไม่สบาย ,khoonM phaawF maaM maiF daiF phaL eernM thanF maiF saL baaiM,example sentence,My father cannot come; he is not well.
คุณพ่อรับเป็นเจ้าภาพงานแต่งงานให้ลูกน้องของท่าน,khoonM phaawF rapH bpenM jaoF phaapF ngaanM dtaengL ngaanM haiF luukF naawngH khaawngR thanF,example sentence,Father agreed to be the host for the wedding of his employees.
คุณพ่อรายนี้ค่อนข้างหวงลูกสาว,khoonM phaawF raaiM neeH khaawnF khaangF huaangR luukF saaoR,example sentence,The father in this case is very possessive of his daughter.
คุณพ่ออายุ ๖๐,khoonM phaawF aaM yooH hohkL sipL,example sentence,My father is 60 years old.
คุณพูดคร่าว ๆ ก็พอไม่ต้องบรรยายยืดยาว,khoonM phuutF khraaoF khraaoF gaawF phaawM maiF dtawngF banM yaaiM yeuutF yaaoM,example sentence,You can give me the brief version; you do not need to explain at length.
คุณพูดภาษาไทยชัดและคล่องมาก ๆ เลยคะ วันนั้นที่เราคุยกันรู้สึกประทับใจ แต่ไม่มีโอกาสได้เอ่ยปากชม,khoonM phuutF phaaM saaR thaiM chatH laeH khlaawngF maakF maakF leeuyM khaH wanM nanH theeF raoM khuyM ganM ruuH seukL bpraL thapH jaiM dtaaeL maiF meeM o:hM gaatL daiF eeuyL bpaakL chohmM,example sentence,You speak Thai very clearly and fluently. I was very impressed that day we spoke but I didn't have a chance to tell you.
คุณพูดภาษาอังกฤษได้ไหม ,khoonM phuutF phaaM saaR angM gritL daiF maiH,example sentence,Can you speak English?
คุณพูดภาษาอังกฤษได้ไหม,khoonM phuutF phaaM saaR angM gritL daiF maiH,example sentence,Can you speak English (i.e. in this conversation)?
คุณพูดภาษาอังกฤษเป็นไหม,khoonM phuutF phaaM saaR angM gritL bpenM maiH,example sentence,"Can you speak English?"" (i.e., are you familiar with the language.)"
