word,spell,type,meaning
ความเห็นชอบ,khwaamM henR chaawpF,noun,[ความเห็นชอบ] approval
ความเห็นเป็นเอกฉันท์,khwaamM henR bpenM aehkL gaL chanR,"noun, phrase",a unanimous opinion
ความเห็นพ้อง,khwaamM henR phaawngH,noun,[ความเห็นพ้อง] agreement
ความเห็นพ้องต้องการในเรื่องการใช้โทษประหารจึงกระหึ่มไปทั่ว ๆ,khwaamM henR phaawngH dtawngF gaanM naiM reuuangF gaanM chaiH tho:htF bpraL haanR jeungM graL heumL bpaiM thuaaF thuaaF,example sentence,The public consensus that this [crime] should result in the death penalty has reached a resounding crescendo.
ความเห็นร่วม,khwaamM henR ruaamF,noun,[ความเห็นร่วม] consensus
ความเห็นอกเห็นใจ,khwaamM henR ohkL henR jaiM,"noun, phrase, colloquial",sympathy; compassion; condolence; empathy
ความเหนื่อย,khwaamM neuuayL,noun,[ความเหนื่อย] fatigue
ความเหมาะ,khwaamM mawL,noun,[ความเหมาะ] appropriateness
ความเหมาะสม,khwaamM mawL sohmR,noun,[ความเหมาะสม] suitability
ความเหลวไหล,khwaamM laayoR laiR,noun,[ความเหลวไหล] nonsense
ความเหลื่อมล้ำ,khwaamM leuuamL lamH,noun,[ความเหลื่อมล้ำ] inequality; inconsistency; incongruity; disagreement
ความเหลื่อมล้ำต่ำสูง,khwaamM leuuamL lamH dtamL suungR,noun,[ความเหลื่อมล้ำต่ำสูง] inequality
ความเหี่ยวย่น,khwaamM hiaaoL yohnF,noun,[ความเหี่ยวย่น] wrinkling; becoming wrinkled
ความแหลมคมของสถานการณ์ทำให้เกิดการเลือกข้าง,khwaamM laaemR khohmM khaawngR saL thaanR naH gaanM thamM haiF geertL gaanM leuuakF khaangF,example sentence,The critical nature of the situation caused (the public) to chose sides.
ความแห้ว,khwaamM haaeoF,,[ความแห้ว] disappointment; frustration
ความโหด,khwaamM ho:htL,noun,[ความโหด] difficulty; trouble; hardness
ความโหด,khwaamM ho:htL,noun,[ความโหด] ruthlessness; savage; brutality; cruelness
,,,
ความโหดเหี้ยม,khwaamM ho:htL hiiamF,noun,[ความโหดเหี้ยม] ruthlessness; mercilessness; cruelty; brutality
ความอยุติธรรม,khwaamM aL yootH dtiL thamM,noun,[ความอยุติธรรม] injustice; unfairness
ความอยุติธรรม,khwaamM aL yootH dtiL thamM,noun,injustice
ความองอาจกล้าหาญ,khwaamM ohngM aatL glaaF haanR,noun,pride and courage
ความอดกลั้น,khwaamM ohtL glanF,,[ความอดกลั้น] tolerance; toleration
ความอดทน ,khwaamM ohtL thohnM,noun,[ความอดทน] patience
ความอดอยากหิวโหย,khwaamM ohtL yaakL hiuR hooyR,"noun, phrase",hunger; starvation
ความอนุเคราะห์,khwaamM aL nooH khrawH,noun,[ความอนุเคราะห์] kindness; generosity; helpfulness
ความอบอุ่น,khwaamM ohpL oonL,noun,[ความอบอุ่น] warmth
ความอบอุ่นใจ,khwaamM ohpL oonL jaiM,"noun, phrase",heat; warmth
ความอปมงคล,khwaamM aL bpaL mohngM khohnM,,[ความอปมงคล] evil
ความอยาก,khwaamM yaakL,noun,[ความอยาก] desire; wanting
ความอยากได้,khwaamM yaakL daiF,noun,greed; avarvice; cupidity
ความอยากรู้อยากเห็น ,khwaamM yaakL ruuH yaakL henR,noun,[ความอยากรู้อยากเห็น] curiosity
ความอร่อย,khwaamM aL raawyL,,[ความอร่อย] delicious flavor; that which makes (it) delicious
ความอลเวง,khwaamM ohnM laH waehngM,noun,[ความอลเวง] tumult; chaos
ความอหังการ,khwaamM aL hangR gaanM,noun,[ความอหังการ] pride; conceit; arrogance; egoism
ความอ่อนไหว,khwaamM aawnL waiR,noun,[ความอ่อนไหว] sensitivity
ความอ่อนแอ,khwaamM aawnL aaeM,noun,[ความอ่อนแอ] weakness; failure; defect; debility; frailty; infirmity
ความอับอายขายหน้า,khwaamM apL aaiM khaaiR naaF,noun,[ความอับอายขายหน้า] shamefulness; discredit; dishonour; disgrace; infamy; ignominy
ความอับอายนี้จะไม่มีใครมาร่วมแบ่งปัน,khwaamM apL aaiM neeH jaL maiF meeM khraiM maaM ruaamF baengL bpanM,example sentence,No one would join with him in this disgraceful endeavor.
ความอัปลักษณ์ ,khwaamM apL bpaL lakH,noun,[ความอัปลักษณ์] ugliness; bad characteristic; wickedness; disgrace
ความอาฆาต,khwaamM aaM khaatF,"noun, formal, loanword, Pali",[ความอาฆาต] vengeange; revenge
ความอาฆาตมาดร้าย,khwaamM aaM khaatF maatF raaiH,noun,[ความอาฆาตมาดร้าย] malicious intent
ความอ่าน,khwaamM aanL,noun,"[ความอ่าน] [general] (amassed, accumulated) reading"
ความอำมหิต,khwaamM amM maH hitL,noun,[ความอำมหิต] cruelty; ruthlessness; mercilessness; savage; brutality; inhumanity; callousness
ความอิสระหอมหวาน,khwaamM itL saL raL haawmR waanR,"noun, phrase",sweet freedom; the sweet taste of freedom
ความอึด,khwaamM eutL,,[ความอึด] endurance; tolerance
ความอึดอัด,khwaamM eutL atL,noun,[ความอึดอัด] discomfort; unease
ความอุดมสมบูรณ์,khwaamM ooL dohmM sohmR buunM,noun,[ความอุดมสมบูรณ์] fertility; abundancy; plentifulness
ความอุ่น,khwaamM oonL,noun,[ความอุ่น] [relief] comfort; relief; contentment
ความเอนเอียง,khwaamM aehnM iiangM,noun,[ความเอนเอียง] propensity; inclination
ความเอื้ออาทร,khwaamM euuaF aaM thaawnM,noun,[ความเอื้ออาทร] generosity; helpfulness
ความเอื้อเฟื้อ,khwaamM euuaF feuuaH,noun,[ความเอื้อเฟื้อ] generosity
ความเอื้อเฟื้อเผื่อแผ่,khwaamM euuaF feuuaH pheuuaL phaaeL,noun,[ความเอื้อเฟื้อเผื่อแผ่] compassion; consideration; helpfulness; generosity
ความเอื้ออารี,khwaamM euuaF aaM reeM,noun,[ความเอื้ออารี] aid; assistance; generosity
ความแออัด,khwaamM aaeM atL,noun,[ความแออัด] congestion
ความโอนเอียง,khwaamM o:hnM iiangM,noun,[ความโอนเอียง] propensity; inclination
ความโอ่อ่า,khwaamM o:hL aaL,noun,[ความโอ่อ่า] luxury; lavishness; magnificence
ความกระหาย,khwaamM graL haaiR,noun,craving; zeal
ความชอบ,khwaamM chaawpF,noun,goodness
ความเป็น,khwaamM bpenM,noun,the fact of; being
ความเป็นช่างศิลป์ของชาวล้านนายังคงสืบสานมาสู่ชาวล้านนาในปัจจุบันนี้อย่างไม่ขาดสาย,khwaamM bpenM changF sinR khaawngR chaaoM laanH naaM yangM khohngM seuupL saanR maaM suuL chaaoM laanH naaM naiM bpatL jooL banM neeH yaangL maiF khaatL saaiR,example sentence,The artistry of the Lanna period has been passed down to the Lanna people of the present day without interruption.
ความเป็นพระมหากษัตริย์,khwaamM bpenM phraH maH haaR gaL satL,noun,reigning as king
ความเป็นพลเมืองสหภาพยุโรป,khwaamM bpenM phohnM laH meuuangM saL haL phaapF yooH ro:hpL,noun,European citizenship
ความผาสุก,khwaamM phaaR sookL,noun,happiness; contentment
ความยากไร้,khwaamM yaakF raiH,noun,poverty
ควาย ,khwaaiM,noun,[general] water buffalo
noun,[เนื้อควาย] buffalo meat,,
"noun, colloquial, vulgar",[slang] bufoon; ignoramus,,
ควายก็ไม่ได้กลัวแดดอย่างเมียของเขา,khwaaiM gaawF maiF daiF gluaaM daaetL yaangL miiaM khaawngR khaoR,example sentence,"Unlike his wife, the buffalo was not afraid of the bright sun."
ควายจะต้องออกแรงให้มากกว่าหากจะยังคงจังหวะสาวเท้าเท่าเดิม,khwaaiM jaL dtawngF aawkL raaengM haiF maakF gwaaL haakL jaL yangM khohngM jangM waL saaoR thaaoH thaoF deermM,example sentence,The buffalo had to work even harder to maintain its normal pace.
,,,
ควายโจกฝูง,khwaaiM jo:hkL fuungR,noun,the lead water buffalo in a herd
ควายยังไม่ออกอาการ,khwaaiM yangM maiF aawkL aaM gaanM,example sentence,The buffalo had not yet begun to act up.
ควายเริ่มขยับตัวอย่างรู้งาน มันยืนห่างจากคันไถในระยะคุ้นชิน,khwaaiM reermF khaL yapL dtuaaM yaangL ruuH ngaanM manM yeuunM haangL jaakL khanM thaiR naiM raH yaH khoonH chinM,example sentence,The buffalo started to move as it had been trained to do; it stood away from the plow at its accustomed distance.
คว่ำ ,khwamF,adjective,upside down
"verb, transitive, intransitive",to overturn; turn over; turn upside down; (boat)capsize; be face down in a prone position,,
คว่ำข้าวเม่า,khwamF khaaoF maoF,"verb, phrase","to fall down rolling (from a veranda, e.g.)"
คว่ำบาตร ,khwamF baatL,"verb, transitive, colloquial",[Journalism] to ostracize; to boycott; to protest
คว่ำกระดาน,khwamF graL daanM,verb,"to overturn, elimnate"
ควิก,khwikH,"adjective, loanword, English",[Thai transcription of the foreign loanword] quick
ควิโต,khwiH dto:hM,,[alternate spelling of กีโต ]
ควินซ์,khwinM,"noun, loanword, English",[Thai transcription of the foreign loanword] quince
noun,[ต้นควินซ์] quince tree,,
noun,[ผลควินซ์] quince fruit,,
ควินซี,khwinM seeM,"proper noun, person",Quincy [an English given name]
ควินซี่,khwinM seeF,"proper noun, loanword, English",Quincy [an English given name]
ควินิน ,khwiH ninM,"noun, loanword, English",[Thai transcription of the foreign loanword] quinine
noun,[ต้นควินิน] Cinchona; Cinchona officinalis,,
ควีน,khweenM,noun,"[Thai transcription of foreign loanword] Queen (in a deck of cards, e.g.)"
คสช.,khaawM saawR chaawM,"proper noun, abbreviation",[abbreviation for คณะรักษาความสงบแห่งชาติ] NCPO
คสช. ยืนยันผู้ที่มารายงานตัวมิใช่เพราะมีความผิด แต่เป็นการเชิญมาเพื่อทำความเข้าใจ ปรับทัศนคติ และหารือการหาทางออกของประเทศชาติร่วมกันต่อไป,khaawM saawR chaawM yeuunM yanM phuuF theeF maaM raaiM ngaanM dtuaaM miH chaiF phrawH meeM khwaamM phitL dtaaeL bpenM gaanM cheernM maaM pheuuaF thamM khwaamM khaoF jaiM bprapL thatH saL naH khaH dtiL laeH haaR reuuM gaanM haaR thaangM aawkL khaawngR bpraL thaehtF chaatF ruaamF ganM dtaawL bpaiM,example sentence,"The NCPO [National Council for Peace and Order] is giving its assurance that those who are being asked to report are not being accused of committing a crime, but are being invited to come in to create a [mutual] understanding, to adjust their attitudes, and to consult with them to find a way to work together to find solutions for the country and the nation."
คหกรรมศาสตร์,khaH haL gamM maH saatL,noun,Domestic science; home economics
คหบดี,khaH haL baL deeM,noun,rich man; wealthy person; head of household
คอ ,khaawM,noun,neck; throat
noun,popularity; fondness; liking; tastes,,
,[pronunciation of the 4th letter of the Thai alphabet],,
คอขวด ,khaawM khuaatL,noun,bottleneck
คอขาด,khaawM khaatL,adjective,[is] serious; critcal
คอขาดบาดตาย,khaawM khaatL baatL dtaaiM,adjective,[is] serious; fatal; critical; in grave danger; a matter of life and death
คอเดียวกัน ,khaawM diaaoM ganM,"phrase, idiom",having similar tastes
คอเบียร์ ,khaawM biiaM,noun,a beer connoisseur
คอปก,khaawM bpohkL,noun,collar (of a shirt tuned down)
คอปกเสื้อ ,khaawM bpohkL seuuaF,noun,collar
คอผู้หญิง,khaawM phuuF yingR,noun,a connoisseur of women
คอวี,khaawM weeM,noun,V-shaped collar
คอสูง ,khaawM suungR,adjective,[is] refined; appreciative of luxury; has exquisite taste
คอเสื้อ,khaawM seuuaF,noun,"collar (of a shirt, e.g.)"
คอเสื้อเชิ้ตของเขาขาดพลุ่ยหมดแล้ว,khaawM seuuaF cheertH khaawngR khaoR khaatL phluyF mohtL laaeoH,example sentence,His shirt collar is torn and is hanging loose.
คอหนัง,khaawM nangR,noun,leatherneck
คอหม้อ ,khaawM maawF,noun,the mouth of an earthen pot
คอหอย ,khaawM haawyR,noun,throat
คอแห้ง ,khaawM haaengF,adjective,"[is] thirsty, has a dry throat"
ค่อ,khaawF,noun,[Isaan dialect] ปลาช่อน
คอก ,khaawkF,noun,pen; stall; coop; prison; enclosure; sty; fence
adjective,deformed; bent out of shape,,
,[คอกหมู] pigsty; pigpen,,
noun,[คอกพยาน] witness-stand (in court),,
noun,"prison, jail, penitentiary",,
คอกทำงาน,khaawkF thamM ngaanM,noun,cubicle (workspace)
คอกพยาน,khaawkF phaH yaanM,noun,[คอกพยาน] witness-stand (in court)
คอกม้า ,khaawkF maaH,noun,a horse stable
คอกหมู,khaawkF muuR,,[คอกหมู] pigsty; pigpen
คอกให้เด็กนอนเล่น ,khaawkF haiF dekL naawnM lenF,noun,baby's playpen
ค็อกเทล ,khawkH thaehnM,"noun, loanword, English",[Thai transcription of the foreign loanword] cocktail
ค็อกเทลกุ้ง ,khawkH thaehnM goongF,,shrimp cocktail
ค็อกเทลผลไม้ ,khawkH thaehnM phohnR laH maaiH,,fruit cup; fruit cocktail
ค็อกเทลเล้านจ์ ,khawkH thaehnM laaoH,"noun, loanword","[Thai transcription of the foreign loanword, ""cocktail lounge""]"
ค๊อกเทล,khaawkH thaehnM,,[alternate spelling of ค็อกเทล ]
คอคอด,khaawM khaawtF,noun,isthmus
คอคอดกระ,khaawM khaawtF graL,proper noun,Kra Isthmus; Isthmus of Kra
คองเกรส,khaawngM graehtL,"noun, loanword, English",[Thai transcription of the foreign loanword] congress
,,,
คองเกรสส์,khaawngM graehtL,,[alternate spelling of คองเกรส]
คองโก ,khaawngM go:hM,"proper noun, geographical","[ประเทศคองโก] Congo, a country in Africa"
คองคอร์ด ,khaawngM khaawdF,"proper noun, geographical","Concord, the capital city of นิวแฮมป์เชียร์ (New Hampshire)"
คอด,khaawtF,adjective,[is] narrowed; constricted
คอน,khaawnM,"verb, transitive, intransitive",to carry a single load at the end of a pole held across the shoulder
adjective,[is] askew; lopsided,,
noun,roost; perch; landing,,
verb,to paddle; to row,,
ค่อน ,khaawnF,"adjective, adverb",[is] almost; nearly; somewhat; rather; inclined towards; tending towards; leaning towards
"verb, transitive, intransitive",to carp or cavil at,,
adjective,[is] more than half; almost full,,
ค่อนขอด,khaawnF khaawtL,"verb, transitive, intransitive, phrase","to use vulgar or degrading language of comparison, carp at, cavil, find fault, complain, criticize, pick holes, quibble, reproach"
ค่อนข้าง ,khaawnF khaangF,adjective,fairly; rather; somewhat
ค่อนข้างจะ ,khaawnF khaangF jaL,adverb,somewhat; rather (will)
ค่อนวัน,khaawnF wanM,adverb,almost the entire day
ค่อนว่า,khaawnF waaF,,to reproach intentionally; taunt; upbraid
ค้อน ,khaawnH,"noun, adjective",hammer; mallet; gavel
"verb, intransitive, colloquial",to glance sideways; to look askance at; to glance coquettishly,,
noun,[ค้อนหอย] ibis,,
ค้อนขนาดใหญ่  ,khaawnH khaL naatL yaiL,noun,sledge hammer
ค้อนขวับ,khaawnH khwapL,verb,to glance sideways; give a cold; look askance
ค้อนควัก,khaawnH khwakH,verb,to glance sideways; give a cold look; look askance; glare
ค้อนตะลุมพุก,khaawnH dtaL loomM phookH,noun,mallet
ค้อนหอย,khaawnH haawyR,noun,[ค้อนหอย] ibis
คอนกรีต ,khaawnM greetL,"noun, loanword, English",[Thai transcription of the foreign loanword] concrete
คอนกรีตที่ผสมด้วยกรวดแทนหิน,khaawnM greetL theeF phaL sohmR duayF gruaatL thaaenM hinR,noun,[Thai description of] gravel concrete
คอนกรีตเสริมเหล็ก ,khaawnM greetL seermR lekL,noun,reinforced concrete
คอนกรีตเสริมเหล็กกล้า,khaawnM greetL seermR lekL glaaF,"noun, phrase",steel reinforced concrete
ค่อนแคะ ,khaawnF khaeH,verb,nag
คอนเซ็ปต์,khaawnM sepH,"noun, loanword, English",[Thai transcription of foreign loanword] concept
คอนโซล,khaawnM so:hnM,"noun, loanword, English",[Thai transcription of foreign loan word] console
คอนญัก,khaawnM yakH,"noun, loanword, French",cognac
คอนด้อม,khaawnM daawmF,"noun, loanword, English",[Thai transcription of the foreign loanword] condom
คอนโด ,khaawnM do:hM,"noun, loanword, English",[Thai transcription of the foreign loanword] condo; condominium
คอนโด,khaawnM do:hM,,[alternate spelling of คอนโดมิเนียม]
คอนโดมือสอง,khaawnM do:hM meuuM saawngR,noun,pre-owned condominium unit
คอนโดมิเนียม,khaawnM do:hM miH niiamM,"noun, loanword, English",[Thai transcription of the foreign loanword] condominium
คอนโดฯ,khaawnM do:hM,,[alternate spelling of คอนโดมิเนียม]
คอนเทนเนอร์,khaawnM thaehnM nuuhrM,"noun, loanword, English","container, e.g.,"
คอนแทค,khaawnM thaaekF,"loanword, English",[Thai transcription of the foreign loanword] contact
คอนแทคเลนส์ ,khaawnM thaaekF laehnM,"noun, loanword, English","[Thai transcription of the foreign loanword, ""contact lens""]"
คอนโทรล,khaawnM thro:hnM,"noun, loanword, English",[Thai transcription of the foreign loanword] control
คอนนี่,khaawnM neeF,"proper noun, loanword, English",Connie [an English given name]
คอนเน็กติคัต,khaawnM nekH dtiL khatH,"proper noun, geographical, loanword, English",Connecticut [state of the United States]
คอนเฟิม,khaawnM feermM,verb,[Thai transcription of foreign loanword] to confirm (as in an airline ticket or hotel room)
คอนราด,khaawnM raatF,"proper noun, loanword, English",Conrad [an English given name]
คอนเสิร์ต ,khaawnM seertL,"noun, loanword, English",[Thai transcription of the foreign loanword] concert
คอป.,khaawM aawM bpaawM,abbreviation,[abbreviation for คณะกรรมการอิสระตรวจสอบและค้นหาความจริงเพื่อการปรองดองแห่งชาติ] ITRC
คอปเปอร์ซัลเฟต,khaawpF bpuuhrM sanM faehtF,noun,[Thai transcription of foreign loanword' copper sulfate
คอปเปอร์ฟีลด์,khaawpF bpuuhrM feenM,"noun, proper noun, person, loanword, English","[Thai transcription of the foreign loanword] Copperfield; [i.e.] the magician, David Copperfield"
คอฟฟี่,khaawfF feeF,"noun, loanword, English",[Thai transcription of the foreign loanword] coffee
คอฟฟี่ช็อป,khaawfF feeF chawpH,"noun, phrase, loanword, English","[Thai transcription of the foreign loanword, ""coffee shop""]"
คอฟฟี่เมท,khaawM feeM maehtL,proper noun,[Thai transcription of foreign loanword] Coffeemate
คอม,khaawmM,"loanword, English",[Thai transcription of the foreign loanword] com
คอม,khaawmM,,[alternate spelling of คอมฯ]
คอมยังเปิดอยู่ เลยเดินไปล็อกอินเข้าระบบในเว็บไซต์เดิม มีคนออนเต็มเลย แต่เพื่อนฉันไม่เห็นออนซักคน,khaawmM yangM bpeertL yuuL leeuyM deernM bpaiM lawkH inM khaoF raH bohpL naiM wepH saiM deermM meeM khohnM aawnM dtemM leeuyM dtaaeL pheuuanF chanR maiF henR aawnM sakH khohnM,example sentence,"My computer was still on, so I walked over and logged in to my usual website. The site was full of people online, but I didn’t see any of my friends were on [the site]."
ค่อม ,khaawmF,adjective,hunchbacked; humpbacked
,,,
ค้อม,khaawmH,verb,to stoop; bend over
ค้อมตัว,khaawmH dtuaaM,verb,to bend over (at thee waist)
ค้อมหัว,khaawmH huaaR,"verb, phrase",to bow one's head; acceed to; succumb to; give in
คอมพ์,khaawmM,,[alternate spelling of คอมฯ]
คอมพิวเตอร์ ,khaawmM phiuM dtuuhrM,"noun, loanword, English",[Thai transcription of the foreign loanword] computer
คอมพิวเตอร์ตั้งโต๊ะ,khaawmM phiuM dtuuhrM dtangF dtoH,"noun, phrase",desktop computer
คอมพิวเตอร์ตั้งโต๊ะจะมีสองส่วนด้วยกัน ก็คือจะมีจอ แล้วก็มีตัวเครื่องนะครับ,khaawmM phiuM dtuuhrM dtangF dtoH jaL meeM saawngR suaanL duayF ganM gaawF kheuuM jaL meeM jaawM laaeoH gaawF meeM dtuaaM khreuuangF naH khrapH,example sentence,Desktop computers are composed of two parts: there is a computer screen and the machine itself.
คอมพิวเตอร์เป็นอุปกรณ์ที่ทำอะไรได้หลายๆอย่างนะครับ,khaawmM phiuM dtuuhrM bpenM ooL bpaL gaawnM theeF thamM aL raiM daiF laaiR laaiR yaangL naH khrapH,example sentence,Computers are devices which can do many things.
คอมพิวเตอร์แม่ข่าย ,khaawmM phiuM dtuuhrM maaeF khaaiL,"noun, phrase, formal",a host computer
คอมพิวเตอร์ส่วนบุคคล,khaawmM phiuM dtuuhrM suaanL bookL khohnM,noun,personal computer
คอมแพ็กฟลอเรสเซนต์,khaawmM phaekH flaawM raehtF saehnM,noun,[Thai transcription of foreign loanword] compact fluorescent
คอมแพค,khaawmM phaaekF,"adjective, loanword, English",[Thai transcription of the foreign loanword] compact
คอมมิชชั่น,khaawmM mitH chanF,"noun, loanword, English",[Thai transcription of the foreign loanword] commission
คอมมิวนิสต์ ,khaawmM miuM nitH,"noun, adjective, loanword, English",[Thai transcription of the foreign loanword] communist
คอมมูนิสต์,khaawmM muuM nitH,,[alternate spelling of คอมมิวนิสต์ ]
คอมเมนท์,khaawmM maehnM,"noun, verb, loanword, English",[Thai transcription of foreign loan word] comment
คอมเม้นท์,khaawmM menH,"verb, loanword, English",to comment
"noun, loanword, English",comment,,
คอมฯ,khaawmM,noun,short for computer
คอโมโรส ,khaawM mo:hM ro:htF,"proper noun, geographical","[ประเทศคอโมโรส] Comoros, a country in Africa"
คอย ,khaawyM,verb,to wait or wait for
verb,to continue (doing something); to keep at it; to keep on (going),,
verb,[ต้องคอย] must wait,,
verb,[กำลังคอย] is waiting; am waiting for,,
คอยกำกับ,khaawyM gamM gapL,verb,to regulate; govern; supervise
คอยกำกับดูแล,khaawyM gamM gapL duuM laaeM,verb,to regulate; govern; supervise
คอยอยู่ที่นี่นะ อีกสิบห้านาที ผมจะกลับมา ,khaawyM yuuL theeF neeF naH eekL sipL haaF naaM theeM phohmR jaL glapL maaM,example sentence,"[spoken by a male] ""Wait here, I will be back in fifteen minutes."
ค่อย ,khaawyF,adverb,gently; softly; little by little; gradually; cautiously
adverb,[ค่อย ๆ] gradually; little by little,,
adverb,then,,
adverb,[ไม่ค่อย] rarely; barely; scarcely; hardly ever; not very much; not quite,,
