word,spell,type,meaning
คราบสกปรกจะสลายตัวหลุดออกจากเนื้อผ้าภายในสิบห้านาทีหลังการแช่,khraapF sohkL gaL bprohkL jaL saL laaiR dtuaaM lootL aawkL jaakL neuuaH phaaF phaaiM naiM sipL haaF naaM theeM langR gaanM chaaeF,example sentence,The dirt will wash out of the cloth within 15 minutes after it is immersed [in the solution].
คราบเหงื่อ,khraapF ngeuuaL,noun,sweat stain
คร้าบ,khraapH,"interjection, sarcastic-humorous",[alternative sometimes sarcastic spelling of ครับ ]
คร้าบ,khraapH,,[alternate spelling of ครับ ]
คราบบบ,khrapH,"interjection, sarcastic-humorous",[alternative sometimes sarcastic spelling of ครับ ]
คราบบบ,khraapF,,[alternate spelling of ครับ ]
คราม ,khraamM,adjective,indigo; blue
noun,[สีคราม] the color indigo    ,,
คร้าม,khraamH,adjective,[is] afraid of; scared; afeared; dread
ครามครัน,khraamM khranM,,quite; fairly; utterly; somewhat; rather
คราว ,khraaoM,noun,occasion; time; episode
noun,[แมวคราว] a large cat,,
adverb,[คราวที่แล้ว] last time; previously,,
คราวก่อนก็เคยพูดคุย,khraaoM gaawnL gaawF kheeuyM phuutF khuyM,example sentence,Last time we talked about this...
คราวก่อนก็เคยพูดคุย,khraaoM gaawnL gaawF kheeuyM phuutF khuyM,example sentence,We spoke about this before.
คราวเคราะห์,khraaoM khrawH,noun,misfortune; bad luck; adversity; hard luck
คราวซวย,khraaoM suayM,noun,misfortune; bad luck; adversity
คราวที่แล้ว,khraaoM theeF laaeoH,adverb,[คราวที่แล้ว] last time; previously
คราวนี้ ,khraaoM neeH,adverb,this time
คราวนี้ก็ได้เวลาเสียเงินแล้ว,khraaoM neeH gaawF daiF waehM laaM siiaR ngeernM laaeoH,example sentence,This time I had the time to spend some money [to see the movie].
คราวนี้เขามีปืนแล้ว ขืนแกยังกล้าไปอีก แกถูกยิงแน่,khraaoM neeH khaoR meeM bpeuunM laaeoH kheuunR gaaeM yangM glaaF bpaiM eekL gaaeM thuukL yingM naaeF,example sentence,"This time, he is carrying a gun. If you still dare to go, you'd definitely get killed."
คราวนี้ เขาหยิบน้ำอัดลมกระป๋อง ออกมาจากใต้โต๊ะ แล้วเทใส่เหยือกโดยไม่รีรอ,khraaoM neeH khaoR yipL namH atL lohmM graL bpaawngR aawkL maaM jaakL dtaiF dtoH laaeoH thaehM saiL yeuuakL dooyM maiF reeM raawM,example sentence,This time he took from under the table two cans of soda and poured them into the pitcher without hesitation.
คราวนี้ผมกับเพื่อนคงไม่ต้องมองหน้ากันอีกต่อไป,khraaoM neeH phohmR gapL pheuuanF khohngM maiF dtawngF maawngM naaF ganM eekL dtaawL bpaiM,example sentence,"This time, I would never be able to look my friend in the eye again."
,,,
คราวนี้ผมเอาชนะคู่แข่งทุกคนอย่างขาดลอย,khraaoM neeH phohmR aoM chaH naH khuuF khaengL thookH khohnM yaangL khaatL laawyM,example sentence,This time I have overwhelmingly defeated all my competitors.
คราวนี้ไม่เจ็บปวดแล้ว ขำเลย,khraaoM neeH maiF jepL bpuaatL laaeoH khamR leeuyM,example sentence,"This time, I was not disturbed; I found it funny."
คราวนี้ล่ะ เราจะได้รู้แจ้งเห็นจริงกันว่าใครเป็นอย่างไร,khraaoM neeH laF raoM jaL daiF ruuH jaaengF henR jingM ganM waaF khraiM bpenM yaangL raiM,example sentence,This time we will know for sure who is doing what.
คราวนี้อย่าทำให้ฉันผิดหวังนะ,khraaoM neeH yaaL thamM haiF chanR phitL wangR naH,example sentence,Don’t let me down this time.
คราวร้าย,khraaoM raaiH,noun,misfortune; bad luck; adversity; hard luck; ill luck; infelicity
คราวหน้า ,khraaoM naaF,adverb,next time
คราวหน้าคราวหลัง ,khraaoM naaF khraaoM langR,"adverb, phrase, colloquial",[colloquial idiom meaning] in the future; next time
คราวหน้าต้องเพิ่มใบชาอีกหน่อยนะ ,khraaoM naaF dtawngF pheermF baiM chaaM eekL naawyL naH,example sentence,Next time you must put in a little more tea leaves.
คราวหน้าเราจะไปบางแสน ,khraaoM naaF raoM jaL bpaiM baangM saaenR,example sentence,Next time we will go to Bangsaen.
คราวหลัง ,khraaoM langR,"noun, phrase, colloquial",next time
คร่าว,khraaoF,adverb,approximately; tentatively; sketchily; roughly; briefly; not exactly; about
adverb,[คร่าว ๆ] approximately; tentatively; sketchily; roughly; briefly; not exactly; about,,
คร่าว ๆ,khraaoF khraaoF,adverb,[คร่าว ๆ] approximately; tentatively; sketchily; roughly; briefly; not exactly; about
คราส,khraatF,noun,eclipse
คร่ำ,khramF,verb,to inlay with silver or gold
verb,to moan,,
adjective,[is] blackened; lacquered; inlaid with gold or silver,,
คร่ำครวญ,khramF khruaanM,verb,to lament; moan and groan; grieve
คร่ำครวญหา,khramF khruaanM haaR,verb,to yearn for; long after
คร่ำคร่า,khramF khraaF,adjective,[is] ancient; antique
คร่ำครึ,khramF khreuH,adjective,[is] old-fashioned; out-of-date; antiquated; outmoded
คร่ำเคร่ง,khramF khrengF,adjective,[is] engrossed in; to immerse oneself; [is] absorbed in; be concentrated in; be up to the eyes in; work hard
คริกเก็ต,khrikH getL,"noun, loanword, English",[กีฬาคริกเก็ต] [Thai transcription of the foreign loanword] cricket; the game of cricket
คริคริ,khrikH riH,interjection,"[sound of laughter; similar to อิอิ and หุหุ, indicating slightly more funny]"
คริส ,khritH,"proper noun, person, loanword, English",Chris; Kris; Cris [an English given name]
คริสต์,khritH,"proper noun, person, adjective, loanword, Greek",Christ
"proper noun, formal, loanword, Greek",[พระคริสต์] the Lord (Jesus) Christ,,
คริสต์ธรรม ,khritH thamM maH,noun,the bible; Christian teachings
คริสต์ศตวรรษ,khritH saL dtaL watH,noun,century (of the Christian era)
คริสต์ศักราช,khritH sakL gaL raatL,"proper noun, formal, loanword, Pali","ANNO DOMINI [meaning] ""in the year of the Lord"
คริสตจักร,khritH dtaL jakL,proper noun,Christendom; the Church
คริสตธรรม,khriH sohtL thamM,proper noun,Christianity
คริสต์มาส ,khritH maatF,"loanword, English",[Thai transcription of the foreign loanword] Christmas
noun,[ต้นคริสต์มาส] Christmas tree,,
คริสต์มาสเรอะ? เฮอะ! ไร้สาระ! ,khritH maatF ruhH huhH raiH saaR raH,"example sentence, colloquial",Christmas? Bah! Humbug!
คริสตัล,khritH dtanM,"proper noun, loanword, English",Crystal [an English given name]
คริสติน,khritH dtinM,"proper noun, loanword, English",Christine [an English given name]
คริสติน่า,khritH dtiL naaF,"proper noun, loanword, English",Christina; Kristina; Cristina [an English given name]
คริสตี้,khritH dteeF,"proper noun, loanword, English",Christy [an English given name]
คริสตีน,khritH dteenM,proper noun,Christine [an English female given name]
คริสเต็น,khritH dtenM,"proper noun, loanword, English",Kristen [an English given name]
คริสเตียน ,khritH saL dtiianM,"noun, adjective, loanword, English",[Thai transcription of the foreign loanword] [is]Christian
,Christian [an English given name],,
คริสเตียน่า,khritH dtiiaM naaF,"proper noun, loanword, English",Christiana [an English given name]
คริสโตเฟอร์,khritH dto:hM fuuhrM,"proper noun, loanword, English",Christopher [an English given name]
คริสปี้,khritH bpeeF,noun,[Thai transcription of foreign name] Krispy; a Krispy Kreme donut
ครีบ ,khreepF,noun,fin; fins
noun,"[animal part, especially fish] webbing or flank below the abdomen and spine",,
noun,[any] serrated fin-like or saw-tooth flanks as in a palm leaf,,
ครีบว่ายน้ำ ,khreepF waaiF naamH,noun,flipper
ครีพท็อน,khreepF thawnM,noun,"[chemistry] Krypton, Kr, atomic number 36"
ครีม ,khreemM,"adjective, loanword, English",[Thai transcription of the foreign loanword] cream; the fatty part of milk or various skin and body products
noun,[สีครีม] the color 'cream'    ,,
ครีมกันแดด,khreemM ganM daaetL,noun,suncream
ครีมกันยุง ,khreemM ganM yoongM,noun,mosquito repellent (cream)
ครีมโกนหนวด ,khreemM go:hnM nuaatL,noun,shaving cream (can)
ครีมทาผิว,khreemM thaaM phiuR,noun,body lotion; body cream
ครีมทาหนังตา ,khreemM thaaM nangR dtaaM,noun,eye shadow
ครีมทาหน้า,khreemM thaaM naaF,noun,face lotion; face cream
,,,
ครีมทาอาบแดด ,khreemM thaaM aapL daaetL,noun,suntan lotion
ครีมเทียม ,khreemM thiiamM,noun,creamer; nondairy creamer
ครีมนวดผม ,khreemM nuaatF phohmR,noun,conditioner; hair conditioner
ครีมบำรุงผิว ,khreemM bamM roongM phiuR,noun,moisturizer
ครีมรองพื้น ,khreemM raawngM pheuunH,noun,makeup base or foundation
ครีมล้างหน้า,khreemM laangH naaF,noun,cold cream
ครีมใส่ผม ,khreemM saiL phohmR,noun,hair gel
ครีมหล่อลื่น,khreemM laawL leuunF,,personal lubricant cream
ครีมหล่อลื่น เค.วาย.,khreemM laawL leuunF khaehM waaiM,noun,KY personal lubricant
ครีมอาบน้ำ ,khreemM aapL naamH,noun,shower gel
ครีษมายัน,khreetF maaM yanM,noun,summer solstice
ครึก,khreukH,"verb, intransitive, colloquial",to do; to make; to perform
ครึกโครม ,khreukH khro:hmM,"adjective, phrase, colloquial",[usually preceded by อึกทึก ] boisterous; uproarious; noisy; turbulent
ครึกโครม,khreukH khro:hmM,adjective,[is] sensational
ครึกครื้น,khreukH khreuunH,adjective,[is] merry; jolly; cheerful; jovial
ครึ่ง ,khreungF,adjective,half; midway; mid; ½
adverb,[ครึ่ง ๆ] partially,,
ครึ่งชั่วโมง ,khreungF chuaaF mo:hngM,noun,one half-hour; half hour
ครึ่งเดียว,khreungF diaaoM,noun,one-half
ครึ่งต่อครึ่ง ,khreungF dtaawL khreungF,adverb,in equal parts; fifty-fifty; equally
ครึ่งท่อน ,khreungF thaawnF,noun,half of a piece or set
ครึ่งบกครึ่งน้ำ ,khreungF bohkL khreungF naamH,"adjective, phrase, colloquial",amphibian; amphibious
ครึ่งราคา,khreungF raaM khaaM,adjective,[is] half-price
ครึ่งแรกของคริสต์ศตวรรษที่ ๒๐,khreungF raaekF khaawngR khritH saL dtaL watH theeF yeeF sipL,"noun, phrase",the first half of the twentieth century
ครึ่งวงกลม ,khreungF wohngM glohmM,noun,semicircle
ครึ่งเสา ,khreungF saoR,adjective,[is] half-mast
ครึ่งเสียง,khreungF siiangR,noun,[music] semi-tone
ครึ่งหนึ่ง ,khreungF neungL,noun,half; one-half; ½
ครึ่งหลังของคริสต์ศตวรรษที่ ๒๐,khreungF langR khaawngR khritH saL dtaL watH theeF yeeF sipL,"noun, phrase",the latter half of the twentieth century
ครึ่งหลับครึ่งตื่น,khreungF lapL khreungF dteuunL,"adjective, phrase","[is] half asleep, half awake"
ครึ่งเหรียญ ,khreungF riianR,noun,coin with a face value of ½ a unit of currency
ครึ่งโหล ,khreungF lo:hR,"noun, phrase, colloquial",half-dozen; half a dozen
ครึ่ง ๆ,khreungF khreungF,adverb,[ครึ่ง ๆ] partially
ครึ่ง ๆ กลาง ๆ,khreungF khreungF glaangM glaangM,adverb,partially; unfinished; incompletely
ครึ้ม ,khreumH,adjective,[is] shady; cloudy; overcast; dark; cool; gloomy
ครึ้มฟ้า ,khreumH faaH,adjective,[is] cloudy; overcast
ครึ้มฟ้าครึ้มฝน ,khreumH faaH khreumH fohnR,"adjective, phrase",[is] looking like rain; overcast; very cloudy
ครืดคราด,khreuutF khraatF,adverb,"[onomatopoeia] the sound of dragging heavy things, snorting, rumbling"
ครืน,khreuunM,noun,snare; trap
adverb,thunderingly; noisily,,
ครื้นเครง,khreuunH khraehngM,adjective,[is] boisterious; rowdy; jolly
ครือ,khreuuM,adjective,[is] snug; well-fitting; perfectly (sized)
ครือกัน,khreuuM ganM,adjective,[is] about the same as; about equal with
ครุ,khrooH,"noun, loanword, Pali",teacher
noun,person of strong will,,
"noun, Pali",a stressed syllable in linguistics or Thai prosody [see notes],,
"adjective, loanword, Pali",hard; serious; great,,
noun,woven bamboo bucket,,
ครุ,khaH rooH,,[alternate pronunciation of ครุ]
ครุภัณฑ์,khaH rooH phanM,noun,teaching aids
ครุฑ,khrootH,"noun, loanword, Sanskrit","Garuda, a mythical bird-like creature described in the Mahabharata"
"noun, loanword, Sanskrit","[พญาครุฑ] Lord Garuda, the state symbol of Thailand",,
ครุฑอีแปะ,khrootH eeM bpaeL,noun,Balfour aralia
ครุ่น,khroonF,adjective,[is] intent; focused
ครุ่นคิด,khroonF khitH,verb,to ponder; to muse; to be immersed in thought; be engrossed or absorbed in thought; be deep in thought
ครุย,khruyM,noun,academic gown; judicial robe
ครุศาสตร์,khrooH saatL,noun,"pedagogy; methodology, study or science of education"
,,,
ครู ,khruuM,noun,teacher; instructor
ครูคนนั้นสอนดีแต่ชอบกัดเด็กอยู่เรื่อย,khruuM khohnM nanH saawnR deeM dtaaeL chaawpF gatL dekL yuuL reuuayF,example sentence,That teacher is good but she is sarcastic to her students all the time.
"ครู- ""ความรู้มากมายอย่างนั้น ใครจะไปจำหมดคะ",khruuM khwaamM ruuH maakF maaiM yaangL nanH khraiM jaL bpaiM jamM mohtL khaH,example sentence,"Teacher: “There’s so much to know, who can possibly remember everything?”."
ครูคอยสอดส่องนักเรียนที่มีพฤติกรรมไม่ดี,khruuM khaawyM saawtL saawngL nakH riianM theeF meeM phreuH dtiL gamM maiF deeM,example sentence,Teachers need to pay close attention to students who exhibit bad behavior.
ครูตอนนั้นยังเป็นนักเรียนอีก,khruuM dtaawnM nanH yangM bpenM nakH riianM eekL,example sentence,The teacher at that time was still a student.
ครูที่ดีไม่ใช่สอนดี สอนเก่ง หรือสอนให้ลูกศิษย์เข้าใจ แต่เป็นครูผู้ให้และชี้แนะให้ลูกศิษย์ได้เติบโตเป็นคนดีของสังคม,khruuM theeF deeM maiF chaiF saawnR deeM saawnR gengL reuuR saawnR haiF luukF sitL khaoF jaiM dtaaeL bpenM khruuM phuuF haiF laeH cheeH naeH haiF luukF sitL daiF dteerpL dto:hM bpenM khohnM deeM khaawngR sangR khohmM,example sentence,"A good teacher is not one who teaches well or is a skilled teacher or teaches her students to understand [things], but a good teacher is someone who leads her students to grow up to become good people within their social environment."
ครูประจำชั้น ,khruuM bpraL jamM chanH,noun,homeroom teacher
ครูประจำชั้นชมเชยนักเรียนด้วยถ้อยคำไพเราะ,khruuM bpraL jamM chanH chohmM cheeuyM nakH riianM duayF thaawyF khamM phaiM rawH,example sentence,The teacher praised the student with sweet words.
ครูเป็นคนจุดประกายให้เขาทำตามฝันที่เขาตั้งใจไว้,khruuM bpenM khohnM jootL bpraL gaaiM haiF khaoR thamM dtaamM fanR theeF khaoR dtangF jaiM waiH,example sentence,His teacher is the one who stimulated him to follow his dream.
ครูเป็นนักร้องเพลงอยู่ด้วย,khruuM bpenM nakH raawngH phlaehngM yuuL duayF,example sentence,The teacher is also a singer (in addition to being an instructor).
ครูเป็นนักเรียนอยู่เหมือนกัน,khruuM bpenM nakH riianM yuuL meuuanR ganM,example sentence,"The teacher is a student, too (like the rest of us)."
ครูฝึก ,khruuM feukL,noun,coach
ครูพิเศษ ,khruuM phiH saehtL,noun,private tutor
ครูฟุตบอล ,khruuM footH baawnM,noun,a football coach
ครูภาษาไทยจะพิถีพิถันและระมัดระวังกับการใช้ภาษาค่อนข้างมาก,khruuM phaaM saaR thaiM jaL phiH theeR phiH thanR laeH raH matH raH wangM gapL gaanM chaiH phaaM saaR khaawnF khaangF maakF,example sentence,Thai language teachers are fairly meticulous and careful in their use of language.
ครูยังไม่ได้สอนนักเรียนยังไม่ได้เรียน เพราะต้องช่วยกันทำความสะอาดห้องเรียน,khruuM yangM maiF daiF saawnR nakH riianM yangM maiF daiF riianM phrawH dtawngF chuayF ganM thamM khwaamM saL aatL haawngF riianM,example sentence,Teachers can not teach [and] students can not learn because they need to help clean the classrooms.
ครูละสายตาจากหนังสือ แล้วหันไปจ้องนักเรียน ๒ คนที่คุยกันอยู่หลังห้อง,khruuM laH saaiR dtaaM jaakL nangR seuuR laaeoH hanR bpaiM jaawngF nakH riianM saawngR khohnM theeF khuyM ganM yuuL langR haawngF,example sentence,The teacher took her eyes off the book and turned to look at two students who were chatting with each other at the back of the room.
ครูศรีษะเกษเครียดซดยาฆ่าแมลงฆ่าตัวตายในรถยนต์คาชุดเครื่องแบบ คาดผู้ตายคงมีอาการเครียดจากเรื่องส่วนตัวไม่สามารถตัดสินใจแก้ปัญหาชีวิตได้,khruuM seeR saL gaehtL khriiatF sohtH yaaM khaaF maH laaengM khaaF dtuaaM dtaaiM naiM rohtH yohnM khaaM chootH khreuuangF baaepL khaatF phuuF dtaaiM khohngM meeM aaM gaanM khriiatF jaakL reuuangF suaanL dtuaaM maiF saaR maatF dtatL sinR jaiM gaaeF bpanM haaR cheeM witH daiF,example sentence,"A distraught teacher from Srisakate killed himself by drinking insecticide in his car, still wearing his uniform. It is suspected he was troubled by personal matters and was unable to decide how to solve the problems in his life."
ครูสมัยก่อนนั้นไม่ว่าท่านจะสอนวิชาอะไรก็ตามการใช้ภาษาไทยของท่านถูกต้องทั้งไวยากรณ์และการออกเสียง,khruuM saL maiR gaawnL nanH maiF waaF thanF jaL saawnR wiH chaaM aL raiM gaawF dtaamM gaanM chaiH phaaM saaR thaiM khaawngR thanF thuukL dtawngF thangH waiM yaaM gaawnM laeH gaanM aawkL siiangR,example sentence,"Teachers in former times, irrespective of what subject they taught, pronounced Thai correctly and used correct grammar."
ครูสมัยนี้อ่อนภาษาไทยครับ,khruuM saL maiR neeH aawnL phaaM saaR thaiM khrapH,example sentence,Nowadays teachers have weak Thai language skills.
ครูสวมบทบาทแทนพ่อแม่ ดูแลเด็กทุกคนเมื่อมาโรงเรียน,khruuM suaamR bohtL baatL thaaenM phaawF maaeF duuM laaeM dekL thookH khohnM meuuaF maaM ro:hngM riianM,example sentence,"A teacher assumes the role of a parent, taking care of children when they come to school."
ครูสอนเต้นรำ ,khruuM saawnR dtenF ramM,noun,dance instructor
ครูสอนพิเศษ,khruuM saawnR phiH saehtL,noun,tutor; non-classroom teacher
ครูใหญ่ ,khruuM yaiL,"noun, formal",headmaster; principal at a school
ครูใหญ่ที่เป็นที่ชื่นชอบของนักเรียนมักเป็นครูใหญ่สุดเฮี้ยบที่จัดการกับพวกเด็กเราได้เด็ดขาด,khruuM yaiL theeF bpenM theeF cheuunF chaawpF khaawngR nakH riianM makH bpenM khruuM yaiL sootL hiiapH theeF jatL gaanM gapL phuaakF dekL raoM daiF detL khaatL,example sentence,The school principal who is most favored by students is usually the one who is strict and who is the strongest disciplinarian...
ครู่,khruuF,noun,a short moment
ครู่เดียว ,khruuF diaaoM,phrase,please wait a moment
ครู่นี้ ,khruuF neeH,adverb,a few minutes ago
ครู่ใหญ่,khruuF yaiL,adverb,after a while
ครู่ใหญ่จึงมีเสียงสะอื้นของแม่ดังเบา ๆ มาจากห้องข้าง ๆ ,khruuF yaiL jeungM meeM siiangR saL euunF khaawngR maaeF dangM baoM baoM maaM jaakL haawngF khaangF khaangF,example sentence,"After a while the sound of him mother sobbing, sometimes softly, sometimes loudly, wafted to him from the room next door."
ครูด ,khruutF,verb,to scrape; scratch off
ครูบา,khruuM baaM,noun,"teacher, instructor, school master, school teacher"
ครูบาอาจารย์,khruuM baaM aaM jaanM,noun,teacher; instructor; school master; school teacher
ครูเสด,khruuM saehtL,"noun, verb",[Thai transcription of the foreign loanword] crusade
คฤหบดี,khriH hohpL deeM,noun,wealthy person; the rich; millionaire
คฤหัสถ์,khaH reuH hatL,noun,householder; layman; laity
คฤหาสน์,khaH reuH haatL,noun,mansion; residence; villa; home; fine house; chateau
คลอ,khlaawM,"verb, intransitive",to accompany together; to be side by side
"verb, intransitive",[often used with tears] to moisten; to well up; to be filled with,,
คลอเคลีย,khlaawM khliiaM,verb,to snuggle; embrace; fondle
คลอไปกับ,khlaawM bpaiM gapL,"adverb, preposition",together with; accompanied by
คลอง ,khlaawngM,noun,[of water] a canal
คลองถม,khlaawngM thohmR,proper noun,"[คลองถม] Khlong Thom, Bangkok’s well-known and long-established flea market featuring second-hand, dirt-cheap bargains"
คลองแสนแสบ,khlaawngM saaenR saaepL,proper noun,[คลองแสนแสบ] Saensab Canal
คล่อง,khlaawngF,"adjective, adverb",[is] fluent; spontaneous; spontaneously
adverb,fluently,,
adjective,[คล่องใจ] [is] (feeling) relieved; at ease,,
คล่องคอ ,khlaawngF khaawM,"adjective, verb, intransitive",[is] easily swallowed
คล่องแคล่ว ,khlaawngF khlaaeoF,"adjective, adverb",[is] fluent; skillful; active
คล่องแคล่วว่องไว,khlaawngF khlaaeoF waawngF waiM,adjective,[is] intelligent; quick-witted; sharp; smart
คล่องใจ,khlaawngF jaiM,adjective,[คล่องใจ] [is] (feeling) relieved; at ease
คล่องตัว,khlaawngF dtuaaM,adjective,[is] flexible; elastic; smooth running; [traffic] easy flowing
คล่องตัว,khlaawngF dtuaaM,adjective,[is] dextrous
,,,
คล่องปาก ,khlaawngF bpaakL,"adjective, verb, figurative",[is] articulate; with words flowing easily
คล่องมือ,khlaawngF meuuM,adjective,[is] handy; available; convenient
คล่องมือ,khlaawngF meuuM,adverb,conveniently; easily
คล่องมือคล่องใจ,khlaawngF meuuM khlaawngF jaiM,adverb,conveniently; easily
คล่องมือคล่องตีน,khlaawngF meuuM khlaawngF dteenM,adverb,conveniently; easily
คล่องไม้คล่องมือ,khlaawngF maaiH khlaawngF meuuM,adverb,conveniently; easily
คล้อง,khlaawngH,"verb, transitive, intransitive",to rope; to lasso; to slip a noose over; to catch with a loop; to put around; to loop
"verb, transitive, intransitive",to rhyme,,
คล้องแขน,khlaawngH khaaenR,verb,to go arm in arm
คล้องจอง,khlaawngH jaawngM,adjective,[are] compatible; rhyming
คลองเตย,khlaawngM dteeuyM,proper noun,[เขตคลองเตย] [administrative district of Bangkok] Khlong Toei
คล่องปรื๊ด,khlaawngF bpreuutH,adjective,[is] highly skillful
