word,spell,type,meaning
ดูให้ดีว่า ใครนั่งอยู่ข้าง ๆ คุณ ในโรงหนังมืด ๆ เย็นเยียบ และเงียบงัน,duuM haiF deeM waaF khraiM nangF yuuL khaangF khaangF khoonM naiM ro:hngM nangR meuutF meuutF yenM yiiapF laeH ngiiapF nganM,"example sentence, colloquial","""Be careful who is sitting close to you in those dark, cold, noiseless moments in the theater!"""
ดูอย่างชาวยุโรปที่มีผิวตกกระ เสี่ยงต่อการเป็นมะเร็งผิวหนังสูงกว่าคนปกติ,duuM yaangL chaaoM yooH ro:hpL theeF meeM phiuR dtohkL graL siiangL dtaawL gaanM bpenM maH rengM phiuR nangR suungR gwaaL khohnM bpaL gaL dtiL,example sentence,"""Look, for example, at Europeans who have freckles; their chance of getting skin cancer [melanoma] is higher than for an ordinary person."""
ดูอ้ายพวกตุ๊ก ๆ นั่นสิ หาเศษหาเลยกับพวกนักท่องเที่ยวซื่อๆ บื้อๆ พาไปซื้อพวกเพชรพลอยเครื่องประดับ ,duuM aaiF phuaakF dtookH dtookH nanF siL haaR saehtL haaR leeuyM gapL phuaakF nakH thaawngF thiaaoF seuuF seuuF beuuF beuuF phaaM bpaiM seuuH phuaakF phetH phlaawyM khreuuangF bpraL dapL,example sentence,"""See those Tuk-Tuks? That’s what I’m talking about! Scavenging for gullible tourists to take them to buy gems and jewelry."""
ดูกร,duuM gaawnM,interjection,"""Look you!"" — ""Look here!"" — ""Listen to me!"""
ดูจะ,duuM jaL,"verb, adverb, colloquial",to seem; seemingly
ดูชานเบ ,duuM chaanM baehM,"proper noun, geographical","Dushanbe, the capital city of ทาจิกิสถาน  (Tajikistan)"
ดูด ,duutL,"verb, transitive",to suck on an object; [of a cigarette] to smoke
noun,[การดูด] suction,,
verb,to attract or draw an object nearer,,
verb,to absorb,,
ดูดกลืน ,duutL gleuunM,"verb, transitive",to absorb; to suck
ดูดซับ,duutL sapH,verb,absorb
ดูดซึม,duutL seumM,verb,to absorb
ดูดดึง,duutL deungM,verb,haul in; pull in; draw in
ดูดดื่ม,duutL deuumL,"verb, intransitive, phrase, colloquial",to be very impressive; be deeply affected; be absorbed mentally; be absorbed emotionally; deeply appreciate
ดูดนม,duutL nohmM,verb,"to suck milk (by an infant, e.g.)"
ดูดนิ้วโป้ง ,duutL niuH bpo:hngF,verb,to suck (one's) thumb
ดูดเนื้อ,duutL neuuaH,"verb, intransitive, phrase, colloquial, idiom","[colloq. slang] to smoke marijuana (pot, grass, dope, weed)"
ดูดฝุ่น,duutL foonL,verb,"to vacuum (a carpet, e.g.)"
ดูดเลือด,duutL leuuatF,"adjective, phrase, colloquial",blood-sucking
ดูดสิวเสี้ยน,duutL siuR siianF,verb,vacuum pore treatment
ดูถูก ,duuM thuukL,verb,to insult; disparage; condescend to
noun,[การดูถูก] an insult,,
ดูทางหางตา,duuM thaangM haangR dtaaM,verb,to glance; look sideways; look from the corner of the eye
ดูไบ,duuM baiM,"proper noun, loanword, English","Dubai, a city in the United Arab Emirates"
ดูเร็กซ์,duuM rekH,proper noun,Durex®
ดูแล ,duuM laaeM,"verb, transitive, intransitive",to care for; look after; to take care of; watch over; protect; guard; to attend
ดูแลง่าย,duuM laaeM ngaaiF,adjective,(a child or adult who is) easy to take care of
ดูแลตัวเองด้วยนะครับ,duuM laaeM dtuaaM aehngM duayF naH khrapH,example sentence,"""Please take care of yourself."""
,,,
ดูแลตัวเองนะ,duuM laaeM dtuaaM aehngM naH,example sentence,"[polite salutation] ""Take care of yourself."""
ดูแลตัวเองและรักษาสุขภาพด้วยนะครับ,duuM laaeM dtuaaM aehngM laeH rakH saaR sookL khaL phaapF duayF naH khrapH,example sentence,"""Please take good care of yourself and your health."""
ดูแลตัวเองและสุขภาพของคุณดี ด้วยนะครับ,duuM laaeM dtuaaM aehngM laeH sookL khaL phaapF khaawngR khoonM deeM duayF naH khrapH,example sentence,"""Please take good care of yourself and your health."""
ดูแลรักษา,duuM laaeM rakH saaR,verb,to watch and take care of
ดูแลรับผิดชอบ,duuM laaeM rapH phitL chaawpF,verb,to be in charge; supervise; oversee
ดูแลอารักขา,duuM laaeM aaM rakH khaaR,verb,to guard and protect
ดูแลเอาใจใส่,duuM laaeM aoM jaiM saiL,verb,take care of; look after; nurture; raise; sustain; bring up; foster
ดูหมิ่น,duuM minL,,to insult; underestimate; disparage; disdain
ดูหมิ่นดูแคลน,duuM minL duuM khlaaenM,,to insult; underestimate; disparage; disdain; slight; snub; affront; look down upon; scorn; hold in contempt
เด็ก ,dekL,noun,child
"noun, plural, colloquial",[เด็ก ๆ] children,,
noun,[fig.] a young person working in a subservient occupation,,
noun,[เด็กโต] adolescent,,
,[เด็กกว่า] [is] younger than,,
เด็กก็ชอบเล่นตามประสาเด็ก,dekL gaawF chaawpF lenF dtaamM bpraL saaR dekL,example sentence,"""Kids like to play in the way that kids do."" ""Kids like to play like kids."""
เด็กกลุ่มใหญ่กำลังกลุ้มรุมเขาจนเรามองไม่เห็นตัวเขา,dekL gloomL yaiL gamM langM gloomF roomM khaoR johnM raoM maawngM maiF henR dtuaaM khaoR,example sentence,"""A large group of kids crowded around him to such an extent that we could not even see him."""
เด็กกว่า,dekL gwaaL,,[เด็กกว่า] [is] younger than
เด็กก๊อย,dekL gaawyH,noun,motocycle moll; girl who sits behind a young guy on a motorcycle
เด็กกำพร้า ,dekL gamM phraaH,noun,an orphan
เด็กกำลังบอบช้ำซ้ำสองจากความหวังดีของผู้ที่ที่ลงไปให้ความช่วยเหลือ,dekL gamM langM baawpL chaamH samH saawngR jaakL khwaamM wangR deeM khaawngR phuuF theeF theeF lohngM bpaiM haiF khwaamM chuayF leuuaR,example sentence,"""The children are being battered yet again (despite) the best intentions of those who have come to provide them assistance."""
เด็กกิน,dekL ginM,,"""The child eats."""
เด็กกินข้าว,dekL ginM khaaoF,example sentence,"""The child eats rice."""
เด็กกินแอปเปิ้ล,dekL ginM aaepL bpeernF,example sentence,"""The child/children eat/eats an/the apple(s)."""
เด็กเกเรียน,dekL gaehM riianM,noun,truant
เด็กขาย ,dekL khaaiR,noun,barboy (male prostitute)
เด็กขายตัว ,dekL khaaiR dtuaaM,noun,barboy (male or boy prostitute)
เด็กคนนี้ถ้าจะให้ทำงานก็ต้องไขลานกันหน่อยนะ,dekL khohnM neeH thaaF jaL haiF thamM ngaanM gaawF dtawngF khaiR laanM ganM naawyL naH,example sentence,"""If you want this kid to do something, you have to keep reminding him [to do it]."""
เด็กคนนี้ถูกอุ้มจนเคยมือ,dekL khohnM neeH thuukL oomF johnM kheeuyM meuuM,example sentence,"""This child is has been held (in our) arms so that he is accustomed to it now."""
เด็กคนนี้ทำงานขันแข็งดีกว่าเด็กคนอื่น ๆ ,dekL khohnM neeH thamM ngaanM khanR khaengR deeM gwaaL dekL khohnM euunL euunL,example sentence,"""This kid works much more industriously than all the other kids."""
เด็กคนนี้เป็นเลือดเนื้อเชื้อไขของเขาอย่างไม่ต้องสงสัย,dekL khohnM neeH bpenM leuuatF neuuaH cheuuaH khaiR khaawngR khaoR yaangL maiF dtawngF sohngR saiR,example sentence,"""There is no doubt that this child is really his real flesh and blood."""
เด็กคนนี้มีความอบอุ่นทางบ้าน จึงทำให้เขาเป็นเด็กที่ไม่มีปัญหาในการอยู่ร่วมกับผู้อื่นใด,dekL khohnM neeH meeM khwaamM ohpL oonL thaangM baanF jeungM thamM haiF khaoR bpenM dekL theeF maiF meeM bpanM haaR naiM gaanM yuuL ruaamF gapL phuuF euunL daiM,example sentence,"""This child lives in a warm household and thus he has become a child without any problems interacting with others."""
เด็กคนนี้ สั่งให้ทำอะไรไม่ได้เรื่องทุกที,dekL khohnM neeH sangL haiF thamM aL raiM maiF daiF reuuangF thookH theeM,example sentence,"""This kid never does as he's told. [or] This kid never does anything we tell him to do."""
เด็กคนนี้สั่งให้ทำอะไร ๆ ไม่ได้เรื่องทุกที,dekL khohnM neeH sangL haiF thamM aL raiM aL raiM maiF daiF reuuangF thookH theeM,example sentence,"""This kid did never does anything we tell him to do."""
เด็กคนนี้เส้นตื้นมาก แค่เห็นคุณพ่อฉีกกระดาษก็หัวเราะ,dekL khohnM neeH senF dteuunF maakF khaaeF henR khoonM phaawF cheekL graL daatL gaawF huaaR rawH,example sentence,"""The baby is easily amused, just seeing his father tearing some paper makes him laugh."""
เด็กคนนี้หน้าตาจุ๋มจิ๋มน่ารัก ,dekL khohnM neeH naaF dtaaM joomR jimR naaF rakH,example sentence,"""This little girl's face is so cute and amiable."""
เด็กคนนี้อ้วนแก้มยุ้ย น่าหมั่นไส้,dekL khohnM neeH uaanF gaaemF yuyH naaF manL saiF,example sentence,"""This kid is well-fed and has chubby cheeks. He is sooo cute!"""
เด็กคลอดก่อนกำหนดทำให้ต้องประคบประหงมกันเป็นพิเศษ,dekL khlaawtF gaawnL gamM nohtL thamM haiF dtawngF bpraL khohpH bpraL ngohmR ganM bpenM phiH saehtL,example sentence,"""Premature infants require special care."""
เด็กคิดว่าแมวน่ารัก,dekL khitH waaF maaeoM naaF rakH,example sentence,"""The child thinks (that) the cat is cute."""
เด็กคิดว่าแมวอยู่บ้าน,dekL khitH waaF maaeoM yuuL baanF,example sentence,"""The child thinks that the cat is in the house."""
เด็กคิดว่าแมวอยู่บ้านไหม,dekL khitH waaF maaeoM yuuL baanF maiH,example sentence,"""Does the child think that the cat is in the house?"""
เด็กคุณ,dekL khoonM,noun,your child
เด็กง่วงนอน พาเขาขึ้นไปชั้นบน ,dekL nguaangF naawnM phaaM khaoR kheunF bpaiM chanH bohnM,example sentence,"""The child is sleepy, take her upstairs."""
เด็กจะถูกสอนให้กตัญญูรู้คุณต่อพ่อแม่ และญาติผู้ใหญ่ ผู้มีอุปการคุณ,dekL jaL thuukL saawnR haiF gaL dtanM yuuM ruuH khoonM dtaawL phaawF maaeF laeH yaatF phuuF yaiL phuuF meeM oopL gaanM khoonM,example sentence,"""Children will be taught to be grateful to their parents and to their elder relatives, that is, those who provide them support."""
เด็กชาย ,dekL chaaiM,noun,boy; little boy; boy under age fifteen
เด็กชายชอบท่องป่าล่าสัตว์เป็นชีวิตจิตใจ,dekL chaaiM chaawpF thaawngF bpaaL laaF satL bpenM cheeM witH jitL jaiM,example sentence,"""The boy is passionate about hunting in the forest."""
เด็กชายถามคุณพ่อว่า สุนัขหายไปไหน ,dekL chaaiM thaamR khoonM phaawF waaF sooL nakH haaiR bpaiM naiR,example sentence,"""The little boy asked his father where the dog had gone."""
เด็กชายผมหยิกจ้องมองหุ่นยนต์เขม็ง คงแปลกใจที่หุ่นพูดได้,dekL chaaiM phohmR yikL jaawngF maawngM hoonL yohnM khaL mengR khohngM bplaaekL jaiM theeF hoonL phuutF daiF,example sentence,"""The curly-haired boy stared unblinkingly at the robot, amazed that the robot could talk."""
เด็กชายสองคนกำลังหาบน้ำจนหลังโก่ง เดินตุปัดตุเป๋ตรงมาที่บ้าน,dekL chaaiM saawngR khohnM gamM langM haapL naamH johnM langR go:hngL deernM dtooL bpatL dtooL bpehR dtrohngM maaM theeF baanF,example sentence,"""The two young boys are carrying a load of water on a pole; they sway back and forth as they walk straight to the house."""
เด็กชายอ้วนขึ้น,dekL chaaiM uaanF kheunF,example sentence,"""The boy has started to get fat."""
เด็กไซด์ไลน์,dekL saiM laiM,noun,a young Thai person doing ไซด์ไลน์ work
เด็กดี,dekL deeM,"noun, example sentence","good child — ""Good child!"""
เด็กแดง,dekL daaengM,noun,very small infant
เด็กตัวเล็ก,dekL dtuaaM lekH,noun,small child; child small in stature
เด็กต่างจังหวัดบางคนเมื่อเข้ามาเรียนในกรุง ก็หลงระเริงกับแสงสีจนเกือบจะเสียคน,dekL dtaangL jangM watL baangM khohnM meuuaF khaoF maaM riianM naiM groongM gaawF lohngR raH reerngM gapL saaengR seeR johnM geuuapL jaL siiaR khohnM,example sentence,"""Some young persons who come in from the countryside to study in Bangkok, become intoxicated with the bright lights and so almost lose their discipline and morals."""
,,,
เด็กโต,dekL dto:hM,noun,[เด็กโต] adolescent
เด็กถามว่าถึงบ้านหรือยัง,dekL thaamR waaF theungR baanF reuuR yangM,example sentence,"""The child asked whether (we) had arrived home yet, or not."""
เด็กถูกบังคับให้ค้าประเวณี,dekL thuukL bangM khapH haiF khaaH bpraL waehM neeM,noun,children forced into prostitution
เด็กทารก ,dekL thaaM rohkH,noun,baby; infant
เด็กทารกถูกลอยแพไปตามแม่น้ำ,dekL thaaM rohkH thuukL laawyM phaaeM bpaiM dtaamM maaeF naamH,example sentence,"""The infant was set adrift on the river."""
เด็กที่เกิดมาอยู่ในวัดเป็นสิบคน ก็ได้อาศัยข้าวก้นบาตรพระนี่ล่ะประทังชีวิต,dekL theeF geertL maaM yuuL naiM watH bpenM sipL khohnM gaawF daiF aaM saiR khaaoF gohnF baatL phraH neeF laF bpraL thangM cheeM witH,example sentence,"""Ten of their children live in the temple and they sustained themselves on the leftovers from the monks’ meals."""
เด็กที่ซุกซนผิดปกติ ,dekL theeF sookH sohnM phitL bpaL gaL dtiL,noun,a hyperactive child
เด็กที่เป็นไข้เลือดออกจะนอนซมไม่กินน้ำไม่กินอาหาร,dekL theeF bpenM khaiF leuuatF aawkL jaL naawnM sohmM maiF ginM naamH maiF ginM aaM haanR,example sentence,"""Children with hemorrhagic fever lie helplessly; they can neither eat nor drink."""
เด็กที่มีน้ำหนักลดอย่างรวดเร็ว แสดงว่าสุขภาพและโภชนาการไม่ดี,dekL theeF meeM namH nakL lohtH yaangL ruaatF reoM saL daaengM waaF sookL khaL phaapF laeH pho:hM chaH naaM gaanM maiF deeM,example sentence,"""Rapid weight loss in a child indicates either bad health or poor nutrition."""
เด็กที่หัดเดิน ,dekL theeF hatL deernM,noun,toddler; child
เด็กทุกคนในสนามล้วนแต่มอมแมมคลุกฝุ่นไปด้วยกันทั้งนั้น,dekL thookH khohnM naiM saL naamR luaanH dtaaeL maawmM maaemM khlookH foonL bpaiM duayF ganM thangH nanH,example sentence,"""Every single kid in the playground is dirty and covered with dust."""
เด็กไทยผงาด คว้าแชมป์หุ่นยนต์โลก,dekL thaiM phaL ngaatL khwaaH chaaemH hoonL yohnM lo:hkF,example sentence,"""Thai youngsters have become a formidable force as they have captured the world robotic championship."""
เด็กไทยอยู่ในระดับรั้งท้ายเกือบบ๊วย,dekL thaiM yuuL naiM raH dapL rangH thaaiH geuuapL buayH,example sentence,"""Thai kids are in the last level, almost at the bottom."""
เด็กน้อย,dekL naawyH,noun,baby; small child
เด็กน้อยคล้ายผ้าขาวไร้มลทิน,dekL naawyH khlaaiH phaaF khaaoR raiH mohnM thinM,example sentence,"""Young children are like a flawless white cloth."""
เด็กน้อยดูดนมจากขวดเสียงดัง ดูมีความสุขเสียจริง,dekL naawyH duutL nohmM jaakL khuaatL siiangR dangM duuM meeM khwaamM sookL siiaR jingM,example sentence,"""The infant noisily sucked milk from the bottle as if he was really enjoying it."""
เด็กน้อยเดินเตาะแตะไปโน้นแล้ว,dekL naawyH deernM dtawL dtaeL bpaiM no:hnH laaeoH,example sentence,"""The young child totters around already."""
เด็กน้อยน้ำตาคลอเต็มเบ้าเมื่อถูกแม่เอ็ดด้วยเสียงดัง,dekL naawyH namH dtaaM khlaawM dtemM baoF meuuaF thuukL maaeF etL duayF siiangR dangM,example sentence,"""The little kid had tears welling up filling his eye-sockets when he got scolded by his mother in a loud voice."""
เด็กนักเรียน ,dekL nakH riianM,noun,schoolchildren; school children
เด็กนักเรียนควรหาความรู้เพิ่มเติมโดยการอ่านหนังสือนอกเหนือจากที่เรียนในห้องเรียน,dekL nakH riianM khuaanM haaR khwaamM ruuH pheermF dteermM dooyM gaanM aanL nangR seuuR naawkF neuuaR jaakL theeF riianM naiM haawngF riianM,example sentence,"""The children should gain additional knowledge by reading books, in addition to what they learn in the classroom."""
เด็กนักเรียนยืนเป็นแถวหน้ากระดานเพื่อเตรียมเคารพธงชาติ,dekL nakH riianM yeuunM bpenM thaaeoR naaF graL daanM pheuuaF dtriiamM khaoM rohpH thohngM chaatF,example sentence,"""The students stood side-by-side in ranks to get ready to pay homage to the flag."""
เด็กนักเรียนสมองใสมากที่สามารถคิดประดิษฐ์เครื่องแบบนี้ขึ้นมาได้,dekL nakH riianM saL maawngR saiR maakF theeF saaR maatF khitH bpraL ditL khreuuangF baaepL neeH kheunF maaM daiF,example sentence,"""The student must have been very bright to have been able to invent this machine."""
เด็กแนว,dekL naaeoM,"noun, colloquial",popular kid; trendy teen; individualist
เด็กในวันนี้คือผู้ใหญ่ในวันหน้า,dekL naiM wanM neeH kheuuM phuuF yaiL naiM wanM naaF,example sentence,"""Today’s children are tomorrow’s adults."""
เด็กบางคนที่ขมขื่นใจจากชีวิตที่ต้องอยู่อย่างคับแค้นและถูกทารุณจากผู้ใหญ่ที่ตนอาศัยอยู่ด้วย ก็ขอมาอาศัยอยู่ที่สถานสงเคราะห์ด้วยเช่นกัน,dekL baangM khohnM theeF khohmR kheuunL jaiM jaakL cheeM witH theeF dtawngF yuuL yaangL khapH khaaenH laeH thuukL thaaM roonM jaakL phuuF yaiL theeF dtohnM aaM saiR yuuL duayF gaawF khaawR maaM aaM saiR yuuL theeF saL thaanR sohngR khrawH duayF chenF ganM,example sentence,"""Some children who are embittered from having to live under great stress and who are mistreated by the adults with whom they live also ask to come stay [at the foster home]."""
เด็กบางคนยังถ่ายปัสสาวะรดที่นอนอยู่บ้าง,dekL baangM khohnM yangM thaaiL bpatL saaR waH rohtH theeF naawnM yuuL baangF,example sentence,"""A few children still wet the bed sometimes."""
เด็กบ้านนอกจะเรียนกันสบาย ๆ มากกว่าเด็กในกรุงเทพฯ เพราะไม่ต้องตะเกียกตะกายแย่งกันเข้าโรงเรียน,dekL baanF naawkF jaL riianM ganM saL baaiM saL baaiM maakF gwaaL dekL naiM groongM thaehpF phrawH maiF dtawngF dtaL giiakL dtaL gaaiM yaaengF ganM khaoF ro:hngM riianM,example sentence,"""Kids from rural areas study more easily than kids from Bangkok because they are not so [destructively] competitive with each other to get into school."""
เด็กบ้านนอกอาจเซ่อไปบ้างในสายตาของชาวกรุง แต่พวกเขาก็น่ารักดี,dekL baanF naawkF aatL suuhrF bpaiM baangF naiM saaiR dtaaM khaawngR chaaoM groongM dtaaeL phuaakF khaoR gaawF naaF rakH deeM,example sentence,"""Youngsters from rural areas may appear very foolish and naive to city folk, but these kids are really cute."""
เด็กปั้น,dekL bpanF,noun,protégé
เด็กไปตลาดไหม,dekL bpaiM dtaL laatL maiH,example sentence,"""Did the child go to the market?"""
เด็กผู้ชาย,dekL phuuF chaaiM,noun,a young boy
เด็กผู้ชายสองคนเปลือยกายล่อนจ้อน วิ่งออกจากบ้านมาเล่นน้ำฝน,dekL phuuF chaaiM saawngR khohnM bpleuuayM gaaiM laawnF jaawnF wingF aawkL jaakL baanF maaM lenF naamH fohnR,example sentence,"""The two boys got completely naked and ran out of the house to come play in the rain."""
เด็กผู้หญิง ,dekL phuuF yingR,noun,girl
เด็กผู้หญิงจับเอาแมวดำตัวหนึ่งโยนลงไปในน้ำแล้วปล่อยให้มันตะเกียกตะกายปีนตลิ่งหนีไป,dekL phuuF yingR japL aoM maaeoM damM dtuaaM neungL yo:hnM lohngM bpaiM naiM naamH laaeoH bplaawyL haiF manM dtaL giiakL dtaL gaaiM bpeenM dtaL lingL neeR bpaiM,example sentence,"""The girl grabbed the black cat and threw it into the water; then she let it scamper up the river bank and run away."""
เด็กฝาก,dekL faakL,noun,a person who is a protege of someone powerful
เด็ก ๆ มักจะพลาดพลั้ง โดยรู้เท่าไม่ถึงการณ์ เนื่องจากยังอ่อนต่อโลก,dekL makH jaL phlaatF phlangH dooyM ruuH thaoF maiF theungR gaanM neuuangF jaakL yangM aawnL dtaawL lo:hkF,example sentence,"""The cheldren often make mistakes as they are unaware of what they are doing because they are still young and innocent."""
เด็กมันก็เล่นไปตามประสาเด็ก ไม่รู้หรอกว่าอะไรถูกผิด,dekL manM gaawF lenF bpaiM dtaamM bpraL saaR dekL maiF ruuH raawkL waaF aL raiM thuukL phitL,example sentence,"""Children will play as children do; they don’t know what is right and what is wrong."""
เด็กยกกระเป๋า,dekL yohkH graL bpaoR,noun,bellhop; porter; baggage boy
เด็กรับใช้ ,dekL rapH chaiH,noun,houseboy; male servant
เด็กรายนี้มีปัญหาทางด้านอารมณ์,dekL raaiM neeH meeM bpanM haaR thaangM daanF aaM rohmM,example sentence,"""The child in this case is experiencing emotional problems."""
เด็กเล็ก  ,dekL lekH,noun,young child (children)
เด็กเล็กกินข้าว,dekL lekH ginM khaaoF,example sentence,"""The small child eats rice."""
เด็กเล็กเด็กโตที่คลุกคลีอยู่กับธรรมชาติ ย่อมได้เปรียบเด็กที่อยู่ในเมือง,dekL lekH dekL dto:hM theeF khlookH khleeM yuuL gapL thamM maH chaatF yaawmF daiF bpriiapL dekL theeF yuuL naiM meuuangM,example sentence,"""Children who are close to nature are better off than children who live in the city."""
เด็กเลี้ยงแกะ,dekL liiangH gaeL,"phrase, idiom","""The boy who cried wolf"""
เด็กวัด,dekL watH,noun,temple boy
