word,spell,type,meaning
แดดแรกของวันกำลังมาถึงแมกไม้ทางทิศตะวันออกปรากฏประกายสีทองแลบอยู่ด้านหลัง,daaetL raaekF khaawngR wanM gamM langM maaM theungR maaekF maaiH thaangM thitH dtaL wanM aawkL bpraaM gohtL bpraL gaaiM seeR thaawngM laaepF yuuL daanF langR,example sentence,"""Daybreak was on its way; the back areas of woods to the East were beginning to be bathed in golden light."""
แดดออก ,daaetL aawkL,noun,sunshine; sunlight
แด๊ดดี้,daaetH deeF,"noun, loanword, English",[Thai transcription of the foreign loanword] daddy
แดน ,daaenM,noun,border; land boundary; area; region
"noun, proper noun, person","Dan [an English given name, short for ดาเนียล]",,
แดนกระทิงดุ,daaenM graL thingM dooL,"proper noun, phrase, colloquial",[sports journalism] Spain
แดนกังหันลม,daaenM gangM hanR lohmM,"proper noun, phrase, colloquial",[sports journalism] Holland
แดนกิมจิ,daaenM gimM jiL,"proper noun, phrase, colloquial",[sports journalism] South Korea
แดนกีวี,daaenM geeM weeM,"proper noun, phrase",[sports journalism] New Zealand
แดนข้อพิพาท ,daaenM khaawF phiH phaatF,noun,disputed territory
แดนจิงโจ้,daaenM jingM jo:hF,"proper noun, phrase, colloquial",[sports journalism] Australia
แดนซามูไร,daaenM saaM muuM raiM,"proper noun, phrase, colloquial",[sports journalism] Japan
แดนซูชิ,daaenM suuM chiH,noun,[sports journalism] Japan
แดนแซมบา,daaenM saaemM baaM,noun,[sports journalism] Brazil
แดนนาฬิกา,daaenM naaM liH gaaM,noun,[sports journalism] Switzerland
แดนประหาร,daaenM bpraL haanR,noun,kill zone
แดนปลาดิบ,daaenM bplaaM dipL,"proper noun, phrase, colloquial",[sports journalism] Japan
แดนมังกร,daaenM mangM gaawnM,"proper noun, phrase, colloquial",[sports journalism] China
แดนมาคาโรนี,daaenM maaM khaaM ro:hM neeM,"proper noun, phrase, colloquial",[sports journalism] Italy
แดนศักดิ์สิทธิ์และแดนสาธารณ์,daaenM sakL sitL laeH daaenM saaR thaanM,"noun, phrase",the realms of the sacred and the profane
แดนสนธยา,daaenM sohnR thaH yaaM,noun,twilight zone
,,,
แดนอิเหนา,daaenM iL naoR,"proper noun, phrase, colloquial",[sports journalism] Indonesia
แด่น,daenL,"adjective, verb",to reach; to go; to run or ride (with)
แดนโคนม,daaenM kho:hM nohmM,"proper noun, colloquial",[sports journalism] Denmark
แด๊นซ์,daaenH,"noun, loanword, English",[Thai transcription of English word] dance
แดนดี้ไลออน,daaenM deeF laiM aawnM,"noun, loanword, English",[Thai transcription of the foreign loanword] dandelion
แดนนี่,daaenM neeF,"proper noun, loanword, English",Danny [an English given name]
แดเนียล,daaeM niianM,,[alternate spelling of ดาเนียล]
แดเนี่ยลล์,daaeM niianF,"proper noun, loanword, English",Danielle [an English given name]
แดฟโฟดิล,daaefL fo:hM dinM,"noun, loanword, English",[Thai transcription of the foreign loanword] daffodil
noun,[ดอกแดฟโฟดิล] daffodil,,
แดร็กคิวล่า,draekL khiuM laaF,,[alternate spelling of แดรคคิวล่า]
แดรคคิวล่า,draaekL khiuM laaF,"proper noun, person, loanword, English","[Thai transcription of the foreign loanword] Dracula; a 1897 novel by Bram Stoker; the central character in this novel, the archetype of a vampire"
แดร็คคูล่า,draekL khuuM laaF,,[alternate spelling of แดรคคิวล่า]
แดะ,daeL,verb,to move from side to side
verb,to dare (to) pretend; to have the balls (to),,
โด,do:hM,"noun, loanword, Latin","[music] do, the first note of the major diatonic scale"
โด่ ,do:hL,adjective,erect; high; standing vertically; sticking straight up
โดกเดก,do:hkL daehkL,verb,sway; totter; pitch; roll
โด่ง ,do:hngL,"verb, intransitive, adverb",to rise up high; with height
โด่งดัง,do:hngL dangM,"adjective, idiom",[is] famous; well-known; renowned; exalted
โดจินชิ,do:hM jinM chiH,"noun, loanword, Japanese","[Thai transcription of the foreign loanword] ""同人誌"" or ""dōjinshi""; amateur-produced Japanese-style comics"
โดด ,do:htL,adjective,single; solitary; alone; separate
verb,to keep away from working or duties; desert one's post,,
adjective,[โดด ๆ] lone; single,,
verb,"[กระโดด] to jump (into), leap, spring, hop, pounce, bounce, or bound",,
โดดเข้าใส่,do:htL khaoF saiL,verb,throw oneself into
โดดเด้ง,do:htL dengF,adjective,[is] extra-special; excellent; best
โดดเดน,do:htL daehnM,adjective,[is] outstanding
โดดเด่น,do:htL denL,adjective,[is] prominent; notable; striking; distinguished; outstanding
โดดเด่นเป็นสง่า,do:htL denL bpenM saL ngaaL,"adjective, phrase",[is] prominent; outstanding; grand
โดดเดี่ยว ,do:htL diaaoL,adjective,secluded; alone; solitary; to a Thai implies feeling lonely
โดดเดี่ยว,do:htL diaaoL,verb,to isolate
โดดเดี่ยวเดียวดาย,do:htL diaaoL diaaoM daaiM,"adjective, phrase",solitarily; single-handed; alone
โดดเดี่ยวเดียวดาย,do:htL diaaoL diaaoM daaiM,,solitarily; single-handed; alone
โดดประชุม,do:htL bpraL choomM,verb,to skip out on a meeting
โดดร่ม,do:htL rohmF,noun,parachute
โดดร่ม,do:htL rohmF,"verb, colloquial, idiom",to desert (one's post); skip class; play truant
โดดเรียน,do:htL riianM,verb,to skip class; play truant
โดด ๆ,do:htL do:htL,adjective,[โดด ๆ] lone; single
โดโดมา,do:hM do:hM maaM,"proper noun, geographical","Dodoma, the capital city of แทนซาเนีย  (Tanzania)"
โดน ,do:hnM,verb,"to hit against, strike, crash into,"
auxiliary verb,[auxiliary verb indicating the passive voice],,
,[is] struck by; hit; bumped,,
โดนเขาหลอกไม่รู้กี่ครั้งกี่หน เธอก็ไม่รู้จักจำ,do:hnM khaoR laawkL maiF ruuH geeL khrangH geeL hohnR thuuhrM gaawF maiF ruuH jakL jamM,example sentence,"""Even though she has been betrayed by him god knows how many times, she acts as if nothing has ever happened."""
โดนใจ,do:hnM jaiM,adjective,[is] to one's taste; on the same wavelength; to one's liking
โดนใจ,do:hnM jaiM,verb,to catch one's fancy; please
โดนด่า,do:hnM daaL,adjective,[is] told off; sworn at; cursed
โดนตบสลบไสล ,do:hnM dtohpL saL lohpL saL laiR,"verb, phrase, colloquial",[โดนตบสลบไสล] [passive voice form] to be slapped across the face so hard and have a blackout
โดนตี ,do:hnM dteeM,verb,hit; strike; beat
โดนทั้งขึ้นทั้งล่อง,do:hnM thangH kheunF thangH laawngF,example sentence,"""Damned if you do; damned if you don’t."""
โดนประตูหนีบ,do:hnM bpraL dtuuM neepL,example sentence,"""[You] get your [fingers] caught in doors."""
โดนฝ่ามือตบ,do:hnM faaL meuuM dtohpL,"verb, phrase",to receive a slap [with the palm of someone’s hand]
โดนมีดบาด,do:hnM meetF baatL,example sentence,"""[You] get cut with knives."""
โดนแมลงกัด ,do:hnM maH laaengM gatL,noun,insect bite
โดนแมลงต่อย ,do:hnM maH laaengM dtaawyL,noun,insect sting
โดนว่านิดว่าหน่อยทำเป็นน้อยใจ,do:hnM waaF nitH waaF naawyL thamM bpenM naawyH jaiM,example sentence,"""You get criticized even a little bit and you start acting hurt."""
โดนวางยาพิษ,do:hnM waangM yaaM phitH,verb,"[โดนวางยาพิษ] did poison (before, earlier)"
,,,
โดนหางเลข,do:hnM haangR laehkF,adverb,to get caught up in something; to become implicated in
โดนัต ,do:hM natH,"noun, loanword, English","[Thai transcription of the foreign loanword] ""doughnut"" or ""donut"""
โดนัท ,do:hM natH,,[alternate spelling of โดนัต ]
โดนัลด์,do:hM nanM,"proper noun, loanword, English",Donald [an English given name]
โดนัลด์ ทรัมป์,do:hM nanM thaH ramM,proper noun,[Thai transcription of English name] Donald Trump
โดพามีน,do:hM phaaM meenM,"noun, loanword, English",dopamine
โดมินิกัน,do:hM miH niH ganM,"proper noun, loanword, English",Dominican
โดมินิกา ,do:hM miH niH gaaM,"proper noun, geographical",[ประเทศโดมินิกา] Dominica
โดมินิค,do:hM miH nikH,"proper noun, loanword, English",Dominic [a given name]
โดย ,dooyM,preposition,by; via; the method; route; way or mode of attainment
prefix,"[prefix which changes a noun or adjective into an adverb, as in the English suffix] ""-ly""",,
โดยก่อนหน้านี้มนุษย์เชื่อว่ามีปรากฏการณ์ลมฟ้าอากาศอยู่มากมาย,dooyM gaawnL naaF neeH maH nootH cheuuaF waaF meeM bpraaM gohtL gaanM lohmM faaH aaM gaatL yuuL maakF maaiM,example sentence,"""In former times, we believed that there were many [different] weather phenomena."""
โดยกะทันหัน,dooyM gaL thanM hanR,adverb,[โดยกะทันหัน] suddenly; abruptly; immediately
โดยกำเนิด,dooyM gamM neertL,"adjective, adverb, phrase",native
โดยเกษตรกรการใช้เงินกู้ร้อยละ ๓๖ เพื่อลงทุนทางการเกษตร และใช้เงินกู้อีกร้อยละ ๖๔ เพื่อใช้หนี้เก่า ค่าอุปโภคบริโภคในครัวเรือน ค่าเล่าเรียนลูก และค่ารักษาพยาบาล,dooyM gaL saehtL dtraL gaawnM gaanM chaiH ngernM guuF raawyH laH saamR sipL hohkL pheuuaF lohngM thoonM thaangM gaanM gaL saehtL laeH chaiH ngernM guuF eekL raawyH laH hohkL sipL seeL pheuuaF chaiH neeF gaoL khaaF oopL bpaL pho:hkF baawM riH pho:hkF naiM khruaaM reuuanM khaaF laoF riianM luukF laeH khaaF rakH saaR phaH yaaM baanM,example sentence,"""Such that of the money that the farmers borrow 36% goes for agricultural investments and 64% goes to servicing existing debt, household consumption, education costs for their children, and health care costs."""
โดยง่าย,dooyM ngaaiF,adverb,[โดยง่าย] easily
โดยจากการคาดการณ์แนวโน้มอายุขัยเฉลี่ยในอนาคตพบว่า ในช่วงปี ค.ศ. 2050 ประชากรโลกจะมีอายุขัยเฉลี่ยประมาณ 75.6 ปี,dooyM jaakL gaanM khaatF gaanM naaeoM no:hmH aaM yooH khaiR chaL liiaL naiM aL naaM khohtH phohpH waaF naiM chuaangF bpeeM khaawM saawR bpraL chaaM gaawnM lo:hkF jaL meeM aaM yooH khaiR chaL liiaL bpraL maanM bpeeM,example sentence,"""Predictions of average lifespan in the future are that by the year 2050 people will live to an average age of 75.6 years."""
โดยจำนน,dooyM jamM nohnM,adverb,willingly; submissively
โดยเจตนา,dooyM jaehtL dtaL naaM,adverb,[โดยเจตนา] deliberately
โดยฉับพลัน,dooyM chapL phlanM,adverb,suddenly; abruptly; unexpectedly; all of a sudden; immediately; instantly; at once
โดยเฉพาะ,dooyM chaL phawH,adverb,[โดยเฉพาะ] especially; specifically; in particular; particularly
โดยเฉพาะการเข้าถึงรอบรองชนะเลิศ การแข่งขันชิงแชมป์โลกปี ๑๙๙๓ และ ๑๙๙๗,dooyM chaL phawH gaanM khaoF theungR raawpF raawngM chaH naH leertF gaanM khaengL khanR chingM chaaemH lo:hkF bpeeM phanM gaoF raawyH gaoF sipL saamR laeH phanM gaoF raawyH gaoF sipL jetL,example sentence,"""...in particular reaching the semi-final of the World Championship in 1993 and 1997."""
...โดยเฉพาะข้าวเจ้ากับข้าวเหนียวซึ่งเป็นอาหารหลักของคนไทยมากกว่าพืชพรรณอย่างอื่น,dooyM chaL phawH khaaoF jaoF gapL khaaoF niaaoR seungF bpenM aaM haanR lakL khaawngR khohnM thaiM maakF gwaaL pheuutF phanM yaangL euunL,example sentence,"""...in particular, non-glutinous and glutinous rice which constitutes the primary foodstuff of the Thai people [and is] more [important] than another other grain or vegetable."""
โดยเฉพาะคนจนในเมือง,dooyM chaL phawH khohnM johnM naiM meuuangM,example sentence,"""...especially for the urban poor."""
โดยเฉพาะคนเมืองที่ไม่ต้องพึ่งพาราคาพืชผลเกษตร,dooyM chaL phawH khohnM meuuangM theeF maiF dtawngF pheungF phaaM raaM khaaM pheuutF phohnR gaL saehtL,example sentence,"""...especially for city dwellers who are not dependent on the price of agricultural goods."""
...โดยเฉพาะเด็ก ๆ และคนชราที่มีความต้องการอาหารที่ย่อยง่ายกว่าคนในวัยหนุ่ม-สาว เมื่อเปรียบเทียบกับเนื้อสัตว์ชนิดอื่น ๆ,dooyM chaL phawH dekL dekL laeH khohnM chaH raaM theeF meeM khwaamM dtawngF gaanM aaM haanR theeF yaawyF ngaaiF gwaaL khohnM naiM waiM noomL saaoR meuuaF bpriiapL thiiapF gapL neuuaH satL chaH nitH euunL euunL,example sentence,"""especially children and the elderly who need more easily digestible food more than young adults do. [Fish is more easily digestible] than other types of meat."""
โดยเฉพาะตามจังหวะการเต้นของหัวใจ ควรรีบพบและปรึกษาแพทย์,dooyM chaL phawH dtaamM jangM waL gaanM dtenF khaawngR huaaR jaiM khuaanM reepF phohpH laeH bpreukL saaR phaaetF,example sentence,"""Especially in the case of irregular heart beats, you should hurry and consult with a doctor."""
โดยเฉพาะในภาคอุตสาหกรรมการผลิตที่ทำให้ผู้ประกอบการต้องเลือกทำเลการลงทุนตั้งโรงงานในท้องถิ่นที่มีแรงงานจำนวนมาก...,dooyM chaL phawH naiM phaakF ootL saaR haL gamM gaanM phaL litL theeF thamM haiF phuuF bpraL gaawpL gaanM dtawngF leuuakF thamM laehM gaanM lohngM thoonM dtangF ro:hngM ngaanM naiM thaawngH thinL theeF meeM raaengM ngaanM jamM nuaanM maakF,example sentence,"""[This is] especially [true] in the industrial manufacturing segment which has caused businessmen to choose investment [and] to construct factories in areas with plentiful labor."""
โดยเฉพาะในเรื่องนโยบายเศรษฐกิจได้ก่อความเป็นห่วงเป็นใยอย่างเหลือเกินว่าจะทำให้ประเทศวิปริตวินาศ,dooyM chaL phawH naiM reuuangF naH yo:hM baaiM saehtL thaL gitL daiF gaawL khwaamM bpenM huaangL bpenM yaiM yaangL leuuaR geernM waaF jaL thamM haiF bpraL thaehtF wiH bpaL ritL wiH naatF,example sentence,This is especially true in the area of economic policy which has created enormous concern that it will bring the nation to intractable ruin.
โดยเฉพาะประเทศที่เกี่ยวเนื่องกับเหตุการณ์ที่เกิดขึ้น คือประเทศอังกฤษและประเทศพม่า,dooyM chaL phawH bpraL thaehtF theeF giaaoL neuuangF gapL haehtL gaanM theeF geertL kheunF kheuuM bpraL thaehtF angM gritL laeH bpraL thaehtF phaH maaF,example sentence,"""[This is] especially [true] in the countries whose [citizens] are involved in this incident, namely, England and Burma."""
โดยเฉพาะเรื่องอริยสัจ ๔ ซึ่งกล่าวถึงเหตุแห่งทุกข์ น่าจะเป็นเรื่องที่นำไปเปรียบเทียบกับการใช้กับชีวิตประจำวันได้มากที่สุด,dooyM chaL phawH reuuangF aL riH yaH satL seeL seungF glaaoL theungR haehtL haengL thookH naaF jaL bpenM reuuangF theeF namM bpaiM bpriiapL thiiapF gapL gaanM chaiH gapL cheeM witH bpraL jamM wanM daiF maakF theeF sootL,example sentence,"""[Consider] especially the Four Noble Truths which teach us about the Causes of Suffering; [this are principles] which we should be most able to utilize in our daily lives."""
โดยเฉพาะลูกบอลสีสดนี้เป็นลูกฟุตบอลไนกี้ รุ่น ไฮ-วิส,dooyM chaL phawH luukF baawnM seeR sohtL neeH bpenM luukF footH baawnM naiM geeF roonF haiM witH,example sentence,"""Specifically, these brightly colored balls are Nike “Hi-Vis” footballs."""
โดยเฉพาะสินค้าราคาสูงอย่างบ้าน คอนโดฯ หรือรถยนต์,dooyM chaL phawH sinR khaaH raaM khaaM suungR yaangL baanF khaawnM do:hM reuuR rohtH yohnM,example sentence,"""[This is] especially true for major purchases such as homes, condominiums, and cars."""
โดยเฉพาะอย่างยิ่ง,dooyM chaL phawH yaangL yingF,adverb,[โดยเฉพาะอย่างยิ่ง] especially
โดยเฉพาะอย่างยิ่งหากยางรถยนต์ที่ท่านกำลังใช้อยู่เป็นยางเรเดียยล,dooyM chaL phawH yaangL yingF haakL yaangM rohtH yohnM theeF thanF gamM langM chaiH yuuL bpenM yaangM raehM diiaM yohnM,example sentence,[This is] especially true if your car uses radial tires.
โดยเฉลี่ย,dooyM chaL liiaL,adverb,[โดยเฉลี่ย] on the average
โดยเฉลี่ยอัตราการคืนหนังสือร้อยละ สี่สิบ หรือ 16.8 ล้านเล่มต่อปี,dooyM chaL liiaL atL raaM gaanM kheuunM nangR seuuR raawyH laH seeL sipL reuuR laanH lemF dtaawL bpeeM,example sentence,"""On average 40 percent of the books printed are returned, or 16.8 million books per year."""
โดยชอบด้วยกฎหมาย,dooyM chaawpF duayF gohtL maaiR,adverb,legitimately; lawfully
โดยเชิญบุคคลสำคัญระดับโลกเพื่อทำหน้าที่ของสื่อมวลชนในการส่งเสริมชีวิตทางปัญญาและวัฒนธรรม ตั้งแต่เริ่มต้นการบรรยายในปี ค.ศ. 1948 โดยมี Bertrand Russell เป็นผู้บรรยาย,dooyM cheernM bookL khohnM samR khanM raH dapL lo:hkF pheuuaF thamM naaF theeF khaawngR seuuL muaanM chohnM naiM gaanM sohngL seermR cheeM witH thaangM bpanM yaaM laeH watH thaH naH thamM dtangF dtaaeL reermF dtohnF gaanM banM yaaiM naiM bpeeM khaawM saawR dooyM meeM bpenM phuuF banM yaaiM,example sentence,"""...which involves inviting certain important world personages under its journalistic responsibility for promoting the [nation’s] intellectual and cultural life. [The series began] with a 1948 lecture by Bertrand Russell."""
โดยใช้,dooyM chaiH,conjunction,via the use of; by the use of; through the use of
โดยด่วน,dooyM duaanL,adverb,urgently
โดยดี,dooyM deeM,adverb,willlingly
โดยดุษณี,dooyM dootL saL neeM,"adverb, formal, loanword, Sanskrit",[โดยดุษณี] quietly; silently; still
โดยดูจากการหมุนของแถบสีม่วงว่าหมุนเร็วขนาดไหน,dooyM duuM jaakL gaanM moonR khaawngR thaaepL seeR muaangF waaF moonR reoM khaL naatL naiR,example sentence,"""...by looking at whether the purple stripes are turning quickly or not."""
โดยเด็ดขาด,dooyM detL khaatL,adverb,[โดยเด็ดขาด] absolutely; resolutely; firmly; decisively
โดยตนเอง ,dooyM dtohnM aehngM,adjective,[โดยตนเอง] [is] personally; by oneself
โดยตนเอง,dooyM dtohnM aehngM,"adjective, phrase",spontaneous
โดยตรง ,dooyM dtrohngM,"adjective, adverb",[โดยตรง] direct
โดยตรง,dooyM dtrohngM,adverb,[โดยตรง] directly; immediately
โดยตรงเวลา ,dooyM dtrohngM waehM laaM,adverb,on schedule; on time
โดยตลอด,dooyM dtaL laawtL,adverb,throughout; the whole time; continuously
,,,
โดยทวีปเอเซียยังคงเป็นทวีปที่มีสัดส่วนประชากรโลกมากที่สุด,dooyM thaH weepF aehM siiaM yangM khohngM bpenM thaH weepF theeF meeM satL suaanL bpraL chaaM gaawnM lo:hkF maakF theeF sootL,example sentence,"""...with Asia becoming the most populous continent."""
โดยทันที,dooyM thanM theeM,"adjective, phrase",spontaneous
โดยทันที,dooyM thanM theeM,adverb,immediately
โดยทั่วไป ,dooyM thuaaF bpaiM,adverb,[โดยทั่วไป] generally; in an overall manner
โดยทั่วไปคนภาคกลางรับประทานอาหารที่มีรสชาติกลมกล่อมมีรสหวานเล็กน้อย,dooyM thuaaF bpaiM khohnM phaakF glaangM rapH bpraL thaanM aaM haanR theeF meeM rohtH chaatF glohmM glaawmL meeM rohtH waanR lekH naawyH,example sentence,"""In general, persons from the Central portion of Thailand eat food which is delicate and rich and is only slightly sweet."""
โดยทั่วไปจะผ่าตัดใส่ให้กับผู้ป่วยที่มีปัญหาหัวใจเต้นช้ากว่าปกติหรือหยุดเต้นชั่วคราวที่แก้สาเหตุไม่ได้,dooyM thuaaF bpaiM jaL phaaL dtatL saiL haiF gapL phuuF bpuayL theeF meeM bpanM haaR huaaR jaiM dtenF chaaH gwaaL bpaL gaL dtiL reuuR yootL dtenF chuaaF khraaoM theeF gaaeF saaR haehtL maiF daiF,example sentence,"""Generally it is surgically implanted in patients whose hearts beat too slow or stop beating temporarily, because the original cause [of such symptoms] cannot be repaired."""
โดยทั่วไปบุคคลย่อมต้องการกัลยาณมิตรไว้เป็นที่พึ่งและเป็นกำลังใจที่ดี,dooyM thuaaF bpaiM bookL khohnM yaawmF dtawngF gaanM ganM laH yaaM naH mitH waiH bpenM theeF pheungF laeH bpenM gamM langM jaiM theeF deeM,example sentence,"""In general people want to have good friends who they can depend on and who can provide them moral support."""
โดยทั่วไปเมื่อเจ็บไข้ได้ป่วยก็ต้องไปพบแพทย์ประจำตัวก่อนที่จะพบแพทย์คนอื่น,dooyM thuaaF bpaiM meuuaF jepL khaiF daiF bpuayL gaawF dtawngF bpaiM phohpH phaaetF bpraL jamM dtuaaM gaawnL theeF jaL phohpH phaaetF khohnM euunL,example sentence,"""Generally, when you get sick, you should go to see your regular doctor before visiting any other doctor."""
โดยทั่วไปแล้วเรามักจะไม่ค่อยพบงานการกุศลที่มีบริษัทใหญ่ ๆ หนุนหลังเพื่อการสาธารณะนัก,dooyM thuaaF bpaiM laaeoH raoM makH jaL maiF khaawyF phohpH ngaanM gaanM gooL sohnR theeF meeM baawM riH satL yaiL yaiL noonR langR pheuuaF gaanM saaR thaaM raH naH nakH,example sentence,"""Generally, we hardly ever see major corporations sponsoring religious ceremonies for the public at large."""
โดยทางทฤษฎี,dooyM thaangM thritH saL deeM,adverb,in theory
โดยทำนองเดียวกันไม่มีผิด ,dooyM thamM naawngM diaaoM ganM maiF meeM phitL,"adverb, phrase",in exactly the same way
โดยที่ไม่มีวันจะได้มาเฉิดฉายในอวัยวะใด ๆ ของตัวเมือง,dooyM theeF maiF meeM wanM jaL daiF maaM cheertL chaaiR naiM aL waiM yaH waH daiM daiM khaawngR dtuaaM meuuangM,example sentence,"""So that there is nowhere in the city that is lovely and bright [all by itself]."""
โดยธรรมชาติ ,dooyM thamM maH chaatF,adverb,[โดยธรรมชาติ] naturally
โดยธรรมชาติ,dooyM thamM maH chaatF,"adjective, phrase",spontaneous
