word,spell,type,meaning
ถ้าวินิจฉัยว่า ส.ส. และ ส.ว. เหล่านี้เข้าข่ายมีการกระทำต้องห้ามจริง โอกาสที่จะต้องตายหรือหลุดจากตำแหน่งชนิดล้างคอกมีอยู่สูง,thaaF wiH nitH chaiR waaF saawR saawR laeH saawR waawM laoL neeH khaoF khaaiL meeM gaanM graL thamM dtawngF haamF jingM o:hM gaatL theeF jaL dtawngF dtaaiM reuuR lootL jaakL dtamM naengL chaH nitH laangH khaawkF meeM yuuL suungR,example sentence,"""If the Election Commission determines that a Member of the House of Representatives or a Senator falls into the class of persons who truly committed a prohibited action, there is a high probability that he must be terminated from his position as part of a sweeping change."""
ถ้าสมมติว่า,thaaF sohmR mootH waaF,conjunction,"if, assuming that,..."
ถ้าสมมติว่ากรุงเทพมหานครเสียหาย ประเทศก็เสียหายไปทั้งหมดแล้วก็จะมีประโยชน์อะไรที่จะทะนงตัวว่าชนะ เวลาอยู่บนกองสิ่งปรักหักพัง,thaaF sohmR mootH waaF groongM thaehpF maH haaR naH khaawnM siiaR haaiR bpraL thaehtF gaawF siiaR haaiR bpaiM thangH mohtL laaeoH gaawF jaL meeM bpraL yo:htL aL raiM theeF jaL thaH nohngM dtuaaM waaF chaH naH waehM laaM yuuL bohnM gaawngM singL bpaL rakL hakL phangM,example sentence,"""If we assume that Bangkok is destroyed [and] the entire country is ruined, what will we have left and what victory will we have to be proud of when we are standing on a pile or ruins?"""
ถ้าสำเร็จเขาจะก้าวหน้าในหน้าที่การงาน ,thaaF samR retL khaoR jaL gaaoF naaF naiM naaF theeF gaanM ngaanM,example sentence,"""If he was successful, he would be promoted to have greater responsibilities at work."""
ถ้าสิ้นเดือนนี้ยังหาเงินไม่พอจ่ายค่าเทอม ลูกคงต้องเอาสร้อยไปตึ๊ง,thaaF sinF deuuanM neeH yangM haaR ngernM maiF phaawM jaaiL khaaF theermM luukF khohngM dtawngF aoM saawyF bpaiM dteungH,example sentence,"""If at the end of this month you do not have enough money to pay [your] tuition, you should pawn your necklace."""
ถ้าหลุดพ้นจากคุกนี้เมื่อไหร่ ผมก็จะกลับตัวเป็นคนดี ,thaaF lootL phohnH jaakL khookH neeH meuuaF raiL phohmR gaawF jaL glapL dtuaaM bpenM khohnM deeM,example sentence,"""Whenever I get releases from prison, I will change my life to be a good person."""
ถ้าหัวหน้าสนับสนุนเต็มที่อย่างนี้พวกเราก็ทำงานได้สะดวกโยธิน,thaaF huaaR naaF saL napL saL noonR dtemM theeF yaangL neeH phuaakF raoM gaawF thamM ngaanM daiF saL duaakL yo:hM thinM,example sentence,"""If the boss fully supports us like this, we can work efficiently."""
ถ้าหาก,thaaF haakL,conjunction,if
ถ้าหากว่า,thaaF haakL waaF,conjunction,in the event that...
ถ้าหากว่าฉันยังคงหายใจ ถ้าหากว่าเธอยังเชื่อในฉัน,thaaF haakL waaF chanR yangM khohngM haaiR jaiM thaaF haakL waaF thuuhrM yangM cheuuaF naiM chanR,example sentence,"""If I am still alive [and] if you still believe in me..."""
ถ้าหากว่าเราไม่ได้โฟกัสที่ดวงตาและทำให้ตาไม่ชัดนั้น ตัวแบบที่เราถ่ายจะดูเหมือนคนสุขภาพไม่ดี,thaaF haakL waaF raoM maiF daiF fo:hM gatL theeF duaangM dtaaM laeH thamM haiF dtaaM maiF chatH nanH dtuaaM baaepL theeF raoM thaaiL jaL duuM meuuanR khohnM sookL khaL phaapF maiF deeM,example sentence,"If we do not focus on the eyes and do not [thereby] render the eyes clearly, the model whom we are photographing will appear to be in ill health."
ถ้าหากว่าเราร่วมมือกัน และแก้ไขได้ ก็เหมือนกับว่าเราผ่านช่วงเวลาวิกฤตอันนี้ไปแล้ว,thaaF haakL waaF raoM ruaamF meuuM ganM laeH gaaeF khaiR daiF gaawF meuuanR gapL waaF raoM phaanL chuaangF waehM laaM wiH gritL anM neeH bpaiM laaeoH,example sentence,"""If we all work together and solve (our problems), then it will be as if we have passed through this crisis already."""
ถ้าหากว่าสายโซ่อุปทานสะดุด เช่น การขนส่งน้ำมัน ก็จะเกิดผลกระทบสูง และถ้าระบบสายโซ่อุปทานทั้งหมดไม่ทำงาน อารยธรรมปัจจุบันที่เรียกว่าโลกาภิวัตน์ ก็ล่มสลาย,thaaF haakL waaF saaiR so:hF oopL bpaL thaanM saL dootL chenF gaanM khohnR sohngL namH manM gaawF jaL geertL phohnR graL thohpH suungR laeH thaaF raH bohpL saaiR so:hF oopL bpaL thaanM thangH mohtL maiF thamM ngaanM aaM raH yaH thamM bpatL jooL banM theeF riiakF waaF lo:hM gaaM phiH watH gaawF lohmF saL laaiR,example sentence,"""If we encounter a stoppage in our supply chain such as our oil transportation (system), there will be significant repercussions; and, if the entire supply chain ceases to function, our current civilization which we term “globalization” will collapse."""
ถ้าเห็นว่าเป็นโครงการที่ดีสมประโยชน์ชัดเจนแล้ว ก็ควรสนับสนุนโดยเต็มที่,thaaF henR waaF bpenM khro:hngM gaanM theeF deeM sohmR bpraL yo:htL chatH jaehnM laaeoH gaawF khuaanM saL napL saL noonR dooyM dtemM theeF,example sentence,"""If [you] think that the program is clearly beneficial and is advantageous, then [you] should fully support it."""
ถ้าให้ พ.ร.ก. กู้เงินผ่านก็ไม่ต่างจากการตีเช็คเปล่า ให้รัฐบาลนำไปใช้โดยสภาไม่มีโอกาสตรวจสอบ,thaaF haiF phaawM raawM gaawM guuF ngernM phaanL gaawF maiF dtaangL jaakL gaanM dteeM chekH bplaaoL haiF ratH thaL baanM namM bpaiM chaiH dooyM saL phaaM maiF meeM o:hM gaatL dtruaatL saawpL,example sentence,"""If the debt bill passes, it will be no different than giving the government a blank check without giving parliament a chance to validate [what the spending is for]."""
ถ้าอนุญาตผมก็ไป เพราะอยากไปใจจะขาด,thaaF aL nooH yaatF phohmR gaawF bpaiM phrawH yaakL bpaiM jaiM jaL khaatL,example sentence,"""If [you give me] permission, I will go, because I am really dying to go."""
ถ้าอยากกินกันนาน ๆ กรุณาอย่าผลาญเงินแม่กู,thaaF yaakL ginM ganM naanM naanM gaL rooH naaM yaaL phlaanR ngernM maaeF guuM,example sentence,"""If you don't want to end up burning all your bridges, then please stop pissing away all my mother's bloody money."""
ถ้าอยากพูดภาษาไทยได้เก่ง ก็ต้องกล้าพูด ถ้าไม่กล้าก็ไม่มีทางที่จะเก่งได้ เขาเรียกว่า ด้านได้อายอด,thaaF yaakL phuutF phaaM saaR thaiM daiF gengL gaawF dtawngF glaaF phuutF thaaF maiF glaaF gaawF maiF meeM thaangM theeF jaL gengL daiF khaoR riiakF waaF daanF daiF aaiM ohtL,example sentence,"""If [you] wish to speak Thai well, you must be brave enough to speak; if [you] are too shy, there is no way to perfect your language skills. We might say, ‘victory goes to the bold.’."""
ถ้าอย่างนั้น ,thaaF yaangL nanH,phrase,if so; if that's the case; if that's the way
ถ้าอย่างนี้ ,thaaF yaangL neeH,phrase,if so; if that's the case; if that's the way
"ถ้าอะไร ๆเข้าที่เข้าทางแล้วคงจะไม่วุ่นวายอย่างนี้"" เขาคาด ",thaaF aL raiM aL raiM khaoF theeF khaoF thaangM laaeoH khohngM jaL maiF woonF waaiM yaangL neeH khaoR khaatF,example sentence,"""“If everything had gone as planned, things would not have been as confused as this,” he figured."""
ถ้าอากาศร้อนมาจนร่างกายมีอุณหภูมิสูงขึ้น แต่ไม่ถึง ๔๐ องศาเซลเซียส อาจเกิดอาการเพลียแดดได้,thaaF aaM gaatL raawnH maaM johnM raangF gaaiM meeM oonM haL phuumM suungR kheunF dtaaeL maiF theungR seeL sipL ohngM saaR saehnM siiatF aatL geertL aaM gaanM phliiaM daaetL daiF,example sentence,"""If the heat causes our body temperature to rise but not to exceed 40 degrees Celsius, we might suffer from heat exhaustion."""
ถ้าอ้างต่างประเทศก็ไปอยู่ต่างประเทศซะ,thaaF aangF dtaangL bpraL thaehtF gaawF bpaiM yuuL dtaangL bpraL thaehtF saH,example sentence,"""If you [criticize] us based on what foreigners are saying about us, then go live with them."""
ถ้าอาหารที่คนเสิร์ฟนำมาให้ ผิดจากที่คุณสั่ง คุณจะส่งคืน และขอให้ทางร้านทำให้ใหม่ ตามที่คุณสั่ง,thaaF aaM haanR theeF khohnM seerfL namM maaM haiF phitL jaakL theeF khoonM sangL khoonM jaL sohngL kheuunM laeH khaawR haiF thaangM raanH thamM haiF maiL dtaamM theeF khoonM sangL,example sentence,"""If the waiter brings you a dish that you did not order, you should send it back and ask the restaurant to bring you the dish that you did order."""
ถ้าอาหารที่คนเสิร์ฟนำมาให้ ผิดจากที่คุณสั่ง คุณจะหยวน กินก็กิน สงสารคนเสิร์ฟ,thaaF aaM haanR theeF khohnM seerfL namM maaM haiF phitL jaakL theeF khoonM sangL khoonM jaL yuaanR ginM gaawF ginM sohngR saanR khohnM seerfL,example sentence,"""If the waiter brings you a dish that you did not order, you should just accept it and consume what he brought. You should feel sorry for the waiter."""
ถ้าเอาปลาให้เขา เขาจะมีกินแค่วันเดียว แต่ถ้าสอนเขาจับปลา เขาจะมีกินไปตลอดชีวิต,thaaF aoM bplaaM haiF khaoR khaoR jaL meeM ginM khaaeF wanM diaaoM dtaaeL thaaF saawnR khaoR japL bplaaM khaoR jaL meeM ginM bpaiM dtaL laawtL cheeM witH,example sentence,"""If you give a man a fish, he has enough to eat for a day; but if you teach him how to fish, he will have enough to eat his entire life."""
ถากถาง ,thaakL thaangR,verb,to nag
ถาง ,thaangR,verb,to cut or mow grass or undergrowth
ถางทาง,thaangR thaangM,"verb, figurative",to pave the way for (someone)
ถางทางปูพรมแดง,thaangR thaangM bpuuM phrohmM daaengM,phrase,to pave the way and lay a red carpet (for)
ถ่าง ,thaangL,verb,to spread apart; [as the pupils of the eye] to dilate; to distribute with spaces inbetween; to widen
ถาด ,thaatL,noun,platter; tray
classifier,[numerical classifier for items served in a ถาด ],,
ถาดรองแก้ว,thaatL raawngM gaaeoF,noun,coaster; drink mat
ถาดใส่เอกสารเข้า ,thaatL saiL aehkL gaL saanR khaoF,noun,in box
ถาดใส่เอกสารออก ,thaatL saiL aehkL gaL saanR aawkL,noun,out box
ถาดอบ,thaatL ohpL,noun,baking pan; baking tray
ถาดอบคุกกี้ ,thaatL ohpL khookH geeF,noun,cookie sheet
ถาดอบเค้ก,thaatL ohpL khekH,noun,cake pan
ถาโถม,thaaR tho:hmR,verb,to swoop (down); dash; rush in; sweep; pounce down
ถาโถมลมหายใจลงไปติดงอมแงม,thaaR tho:hmR lohmM haaiR jaiM lohngM bpaiM dtitL ngaawmM ngaaemM,"verb, phrase",to become seriously addicted to
ถาน,thaanR,noun,a monk's toilet
ถ่าน ,thaanL,noun,charcoal
noun,"[chemistry] Carbon, C, atomic number 6",,
ถ่านกัมมันต์,thaanL gamM manM,noun,activated carbon
ถ่านไฟ,thaanL faiM,noun,embers (remaining from a fire)
ถ่านไฟเก่า,thaanL faiM gaoL,noun,old flame; former girlfriend or boyfriend
ถ่านไฟฉาย ,thaanL faiM chaaiR,noun,dry battery
ถ่านหิน,thaanL hinR,noun,coal
ถ่านหินเป็นเชื้อเพลิงที่สกปรก เมื่อเทียบกับแก๊สธรรมชาติหรือน้ำมันเตา,thaanL hinR bpenM cheuuaH phleerngM theeF sohkL gaL bprohkL meuuaF thiiapF gapL gaaetH thamM maH chaatF reuuR namH manM dtaoM,example sentence,"""Coal is a dirty fuel when compared with natural gas or fuel oil."""
ถาม ,thaamR,"verb, transitive",to ask (a question); to inquire; to quiz; to interrogate
ถามกับหยาดน้ำตา ที่ไหลมา หน้ากระจกทุกวัน,thaamR gapL yaatL namH dtaaM theeF laiR maaM naaF graL johkL thookH wanM,example sentence,"""I ask [myself that] with flowing tears every day in front of the mirror."""
ถามใครที่มีวิธีเผื่อเราจะพบใคร,thaamR khraiM theeF meeM wiH theeM pheuuaL raoM jaL phohpH khraiM,example sentence,"""I ask anyone who might have a way for me to meet someone."""
ถามตรง ๆ,thaamR dtrohngM dtrohngM,"verb, phrase",to ask directly; ask frankly
ถามตัวเองว่านานเท่าไรแล้วที่ไม่ได้สัมผัสธรรมชาติที่สวยงามแบบนี้ ,thaamR dtuaaM aehngM waaF naanM thaoF raiM laaeoH theeF maiF daiF samR phatL thamM maH chaatF theeF suayR ngaamM baaepL neeH,example sentence,"""[I] asked myself how long had it been since I had been in touch with the beauty of nature like this."""
ถามทุกข์สุข,thaamR thookH sookL,verb,to inquire about (someone's) health
ถามมาหลายรอบ ตอบตัวเองมาหลายครั้งว่า เราเกิดมาทำไม,thaamR maaM laaiR raawpF dtaawpL dtuaaM aehngM maaM laaiR khrangH waaF raoM geertL maaM thamM maiM,example sentence,"""I have asked on many occasions, and have answered my self many time: Why was I born?"""
ถามว่า...,thaamR waaF,phrase,to ask that...
ถามว่าโกรธพ่อหรือเปล่า ,thaamR waaF gro:htL phaawF reuuR bplaaoL,example sentence,"""[I] asked him if he was angry at his father."""
ถามว่าชีวิตในวันนี้เป็นยังไงค่ะ,thaamR waaF cheeM witH naiM wanM neeH bpenM yangM ngaiM khaF,example sentence,"""Ask me, what is my life like today?"""
ถามว่า ทางออกมีไหม ก็มี,thaamR waaF thaangM aawkL meeM maiR gaawF meeM,example sentence,"""One might ask, ‘Is there a solution?’ Answer, ‘Yes, there is.’"""
ถามว่าแมวในกล่องสีอะไร?,thaamR waaF maaeoM naiM glaawngL seeR aL raiM,example sentence,"""Now, may I ask you, what color is the cat in the box?"""
ถ่ามตง,thaamL dtohngM,verb,[slang for ถามตรง ๆ] to ask directly
ถามไถ่,thaamR thaiL,verb,to ask (about/after); inquire after
ถ่าย ,thaaiL,verb,to discharge; to excrete; to void
"verb, transitive, colloquial",to film; to photograph,,
verb,to transfer; to move across,,
ถ่ายซีร็อกส์ ,thaaiL seeM rawkH,noun,"a photocopy made by the distinctive Xerox® process. Xerox is a trademark registered with the Trademark office of Thailand, to Xerox Corporation, United States, for that corporation's distinctive photocopying process and their associated photocopying equipment and materials"
ถ่ายเดียว,thaaiL diaaoM,adverb,exclusively
ถ่ายทอด ,thaaiL thaawtF,verb,to relay; transmit; broadcast; express; convey; show
ถ่ายทอด,thaaiL thaawtF,verb,"to teach, instruct, pass on, impart"
ถ่ายทอดสด,thaaiL thaawtF sohtL,noun,live broadcast
ถ่ายทำ,thaaiL thamM,verb,to make a picture; shoot a movie
ถ่ายเทอากาศ,thaaiL thaehM aaM gaatL,"verb, transitive","[of a room, for example] to ventilate"
ถ่ายน้ำมันเครื่อง,thaaiL namH manM khreuuangF,verb,[ถ่ายน้ำมันเครื่อง] to change motor oil
ถ่ายปัสสาวะ ,thaaiL bpatL saaR waH,"verb, intransitive",to pee; urinate
ถ่ายปัสสาวะรดที่นอน,thaaiL bpatL saaR waH rohtH theeF naawnM,verb,to wet the bed
ถ่ายฝาก,thaaiL faakL,verb,[genetics] to transplant; transfer genetic material
ถ่ายภาพ,thaaiL phaapF,verb,to take a photograph
ถ่ายภาพยนต์,thaaiL phaapF yohnM,"verb, phrase, colloquial",to film; to shoot a film
ถ่ายภาพยนตร์,thaaiL phaapF phaH yohnM,"verb, intransitive",to make a movie; to film
ถ่ายไม่ออก,thaaiL maiF aawkL,adjective,[is] unable to eliminate; constipated
ถ่ายรูป  ,thaaiL ruupF,verb,to photograph; to take a picture
ถ่ายรูปได้ไหม ,thaaiL ruupF daiF maiH,phrase,May I take a picture?
ถ่ายโลหิต,thaaiL lo:hM hitL,"noun, verb, intransitive","blood transfusion, to give or get a blood transfusion"
ถ่ายสำเนา ,thaaiL samR naoM,noun,photocopy
ถ่ายหนัง,thaaiL nangR,"verb, intransitive",to make a movie; to film
ถ่ายออก,thaaiL aawkL,verb,to remove
ถ่ายอุจจาระ ,thaaiL ootL jaaM raH,"verb, intransitive",to have a bowel movement; to defecate
ถ่ายเอกสาร ,thaaiL aehkL gaL saanR,noun,photocopy
ถ่ายเอ็กซ์เรย์,thaaiL ekL raehM,verb,to x-ray
ถ่ายโอนแฟ้มข้อมูล ,thaaiL o:hnM faaemH khaawF muunM,noun,"FTP, the file transfer protocol"
ถ่ายเท,thaaiL thaehM,verb,to circulate; ventilate
verb,to transfer; unload,,
ถาวร ,thaaR waawnM,adjective,[is] durable; permanent; enduring; lasting
ถาวรวัตถุ,thaaR waawnM watH thooL,noun,permanent structures [especially those] built of stones; a lasting monument; an institution
ถ้ำ ,thamF,noun,cave
ถ้ำชา,thamF chaaM,noun,a tea caddy
ถ้ำมอง,thamF maawngM,noun,a peep show
ถิ่น ,thinL,noun,home; hometown; location; domain; domicile; abode; habitation; country; district; region; habitat
proper noun,"Tinh, an ethnic minority group in northern Thailand",,
ถิ่นกำเนิด,thinL gamM neertL,noun,one's birthplace; native land; place of origin
ถิ่นฐาน,thinL thaanR,noun,permanent abode; native place; hometown; residence
ถิ่นที่,thinL theeF,noun,area
ถิ่นทุรกันดาร,thinL thooH raH ganM daanM,noun,remote area
ถี่,theeL,adjective,frequent; in quick order; in rapid succession; repeated in quick succession
"adjective, formal",stingy,,
"adjective, formal",thorough,,
noun,[ความถี่] frequency,,
ถี่ถ้วน,theeL thuaanF,adjective,[is] thoroughly
ถี่ลอดตาช้าง ห่างลอดตาเล็น,theeL laawtF dtaaM chaangH haangL laawtF dtaaM lenM,"example sentence, idiom","""Penny wise and pound foolish."""
ถีบ,theepL,verb,to push off with the foot
ถีบจักรยาน ,theepL jakL graL yaanM,verb,to ride a bicycle
ถีบรถ ,theepL rohtH,verb,to pedal (a vehicle)
ถีบระหัด,theepL raH hatL,verb,to treadle a waterwheel
ถีบหัวส่ง,theepL huaaR sohngL,verb,to expel; drive out
ถี่ยิบ,theeL yipH,adverb,quickly; rapidly; speedily; swiftly
ถึก,theukL,"noun, adjective",young ox; male water buffalo
ถึง ,theungR,"verb, transitive, intransitive",to reach; arrive at; attain; get to
ถึง ,theungR,adverb,[ถึงขนาด] to the extent that
ถึง ,theungR,preposition,about; around
ถึง ,theungR,"adverb, preposition",until; till; up to; towards; as far as; as many/much as; as long as
ถึง ,theungR,"adverb, preposition",even if...; although...
ถึง ,theungR,prefix,[a word placed before a verb to show consequence]
ถึง ,theungR,"verb, transitive, intransitive",[ไปถึง] to arrive; reach (when going)
ถึง ,theungR,"verb, transitive, intransitive","[aspect marker meaning ""reach"" or ""arrive""]"
ถึงก็ช่าง ไม่ถึงก็ช่าง,theungR gaawF changF maiF theungR gaawF changF,example sentence,"""They don’t care if they are late or arrive at all."" ""If we’re not on time, so what?"""
ถึงกระนั้นก็ตาม,theungR graL nanH gaawF dtaamM,conjunction,nevertheless; no matter what; irrespective of what happens
ถึงกัน,theungR ganM,verb,communicate with; get in touch with; be in contact with
ถึงกัน,theungR ganM,adverb,to each other
ถึงกับ,theungR gapL,conjunction,so as; so that; as the result
ถึงกับลงมือเอาเชือกรัดคอให้ตายก็มี,theungR gapL lohngM meuuM aoM cheuuakF ratH khaawM haiF dtaaiM gaawF meeM,example sentence,"""There have been some [societies which have] even garroted them to death."""
ถึงกำหนดจ่าย ,theungR gamM nohtL jaaiL,adjective,[is] due; time to pay
ถึงเกณฑ์,theungR gaehnM,adjective,[is] qualified; [is] passing a criterion
ถึงแก่,theungR gaaeL,"verb, intransitive",to go as far as...; to reach the limit (of...)
ถึงแก่กรรม ,theungR gaaeL gamM,"verb, intransitive, phrase, formal",[formal term for all] to pass away; to die
ถึงแก่พิราลัย ,theungR gaaeL phiH raaM laiM,"verb, intransitive, phrase, formal",[royal use only] to pass away; to die; to go to heaven
ถึงแก่มรณภาพ,theungR gaaeL maawM raH naH phaapF,"noun, verb",[holy language used by monks] death; condition of death; to die
ถึงแก่อนิจกรรม ,theungR gaaeL aL nitH jaL gamM,"verb, intransitive, phrase, formal",[used with those who hold the rank of พระยา] to pass away; to die
ถึงแก่อสัญกรรม ,theungR gaaeL aL sanR yaH gamM,"verb, intransitive, phrase",[used with those who hold the rank of เจ้าพระยา ] to pass away; to die
ถึงแก่น,theungR gaenL,adverb,thoroughly; essentially
ถึงขนาด,theungR khaL naatL,adverb,[ถึงขนาด] to the extent that
ถึงขนาดจะอย่างไรก็แล้วแต่,theungR khaL naatL jaL yaangL raiM gaawF laaeoH dtaaeL,"conjunction, phrase",come what may; no matter what
ถึงขนาดจะอย่างไรก็แล้วแต่ ขอให้ท่านเห็นใจฉันบ้าง,theungR khaL naatL jaL yaangL raiM gaawF laaeoH dtaaeL khaawR haiF thanF henR jaiM chanR baangF,example sentence,"""Come what may, please let him take pity on me."""
ถึงขนาดนี้,theungR khaL naatL neeH,adverb,to such an extent; to this extent; so much
ถึงขนาดแบ่งแยกไปแล้ว ใช่ว่าสงครามจะสงบ ใช่ว่าสันติสุขจะเกิดขึ้นอย่างแท้จริง,theungR khaL naatL baengL yaaekF bpaiM laaeoH chaiF waaF sohngR khraamM jaL saL ngohpL chaiF waaF sanR dtiL sookL jaL geertL kheunF yaangL thaaeH jingM,example sentence,"""Once the division has occurred, it is not as if the wars will cease or that real peace will break out."""
ถึงขั้น,theungR khanF,"adverb, phrase",to the extent that; up to the point that
ถึงเขาจะคุกเข่าลงอ้อนวอนขอร้อง ฉันก็จะไม่ยอมใจอ่อน! ,theungR khaoR jaL khookH khaoL lohngM aawnF waawnM khaawR raawngH chanR gaawF jaL maiF yaawmM jaiM aawnL,example sentence,"""Even if he was on his knees begging, I wouldn't yield!"""
ถึงคราว,theungR khraaoM,verb,reach the time; arrive at the time
ถึงคราว,theungR khraaoM,"verb, figurative",to meet one's end; to perish
ถึงคราวเมื่อลมหนาวมา กลับร้อนใจ,theungR khraaoM meuuaF lohmM naaoR maaM glapL raawnH jaiM,example sentence,"""Eveb when the cold wind blows, I am fervid with worry."""
ถึงจะ,theungR jaL,phrase,only then...; even if...
ถึงจะ,theungR jaL,conjunction,so that
ถึงจะเรียนหนักแต่ก็สนุกกับมัน ,theungR jaL riianM nakL dtaaeL gaawF saL nookL gapL manM,example sentence,"""Even though he studies hard, he enjoys [his studies]."""
