word,spell,type,meaning
เพ็ญสุขภรณ์,phenM sooL khaL phohnM,proper noun,Pensukporn [a Thai given name]
เพฑูรย์,phaehM thuunM,,[alternate spelling of ไพฑูรย์ ]
เพดาน ,phaehM daanM,noun,ceiling
เพดานแข็ง,phaehM daanM khaengR,noun,hard palate
เพดานปาก,phaehM daanM bpaakL,,[เพดานปาก] palate
เพดานโหว่,phaehM daanM wo:hL,noun,cleft palate
เพโดร,phaehM dro:hM,,[alternate spelling of เปโตร]
เพทนา ,phaehtF thaH naaM,noun,feeling; sensation
เพทาย ,phaehM thaaiM,"noun, proper noun, formal",(red) zircon
เพทุบาย,phaehM thooH baaiM,"verb, transitive, intransitive",to pretend; feign; trick; employ a stratagem
เพโทบาย,phaehM tho:hM baaiM,,[alternate spelling of เพทุบาย]
เพนกวิน,phaehnM gwinM,"noun, loanword, English",[นกเพนกวิน] [Thai transcription of the foreign loanword] penguin
เพนซิลวาเนีย,phaehnM sinM waaM niiaM,,[alternate spelling of เพนซิลเวเนีย]
เพนซิลเวเนีย,phaehnM sinM waehM niiaM,"proper noun, geographical",Pennsylvania [state of the United States]
เพนตาคอสตัล,phaehnM dtaaM khaawtF dtanM,adjective,[Thai transcription of the foreign loanword] pentecostal
เพนท์,phaehnM,"verb, loanword, English",[Thai transcription of foreign loan word] paint
เพนท์เฮ้าส์,phaehnM haaoH,"noun, loanword, English",[Thai transcription of foreign loanword] penthouse
เพนนิซิลลิน,phaehnM niH sinM linM,"loanword, English",[Thai transcription of the foreign loanword] penicillin
เพนนี,phaehnM neeM,"proper noun, loanword, English",Penny [an English given name]
เพ่นพ่าน,phenF phaanF,"verb, intransitive",to wander; roam; to walk about; stray; rove
เพนียด ,phaH niiatF,noun,corral; stockade; elephant pen
เพ้ย,pheeuyH,"verb, transitive, loanword, onomatopoeia",to shoo away; to drive (someone or something) away
เพรสซิเด้นท์,phraehtF siH denF,"proper noun, loanword, English",[name of a former hotel in Bangkok] The President
เพรสตัน,phraehtF dtanM,"proper noun, loanword, English",Preston [an English given name]
เพรสไบทีเรียน,phraehtF baiM theeM riianM,"noun, adjective, loanword, English",Presbyterian
เพรา,phraoM,adjective,beautiful; fine
noun,morning-time,,
เพรางาย,phraoM ngaaiM,noun,late morning
เพราะ ,phrawH,conjunction,because; because of; due to; owing to
adjective,[of sound or voice] melodious; tuneful; pleasant; sweet; sonorous; sweet-sounding [see notes],,
...เพราะกลัวกระทบไปถึงรายได้ที่จะได้รับจากบ่อนเหล่านั้น,phrawH gluaaM graL thohpH bpaiM theungR raaiM daiF theeF jaL daiF rapH jaakL baawnL laoL nanH,example sentence,"""...because they are worried [that the crackdown] will affect their profits from these casinos."""
เพราะกว่าจะฝ่าดงรถอันแสนจะแออัดยัดเยียดในยามเช้าไปได้คงกินเวลาร่วมชั่วโมง,phrawH gwaaL jaL faaL dohngM rohtH anM saaenR jaL aaeM atL yatH yiiatF naiM yaamM chaaoH bpaiM daiF khohngM ginM waehM laaM ruaamF chuaaF mo:hngM,example sentence,"""Because, it is likely to take the better part of an hour before we can get through the thick jungle of morning traffic."""
เพราะก่อนกลับ แม่ได้แยกฟันปลอมไว้ในกระเป๋าอีกใบ ซึ่งมันถูกบรรจุอยู่ในกระเป๋าใหญ่อีกที,phrawH gaawnL glapL maaeF daiF yaaekF fanM bplaawmM waiH naiM graL bpaoR eekL baiM seungF manM thuukL banM jooL yuuL naiM graL bpaoR yaiL eekL theeM,example sentence,"""[This is] because before she got back, my mother took her teeth out and put them in another bag which she then put into a larger handbag."""
...เพราะการขาดน้ำจะทำให้การออกกำลังของคุณย่ำแย่และล้าหลังกว่าปกติ,phrawH gaanM khaatL naamH jaL thamM haiF gaanM aawkL gamM langM khaawngR khoonM yamF yaaeF laeH laaH langR gwaaL bpaL gaL dtiL,example sentence,...because the lack of water will cause your exercise to flag and be less effective than it normally would.
เพราะการจับผิดคน ไม่ได้หมายถึงความผิดพลาดเพียงอย่างเดียว...,phrawH gaanM japL phitL khohnM maiF daiF maaiR theungR khwaamM phitL phlaatF phiiangM yaangL diaaoM,example sentence,"""Because, arresting the wrong persons, does not only mean that an error was made in the arrest..."""
เพราะการซื้อที่อยู่อาศัยเป็นเรื่องระยะยาว ๒๐-๓๐ ปี ส่วนเรื่องเศรษฐกิจเป็นเรื่อง ๑-๒ ปี สถานการณ์ก็เปลี่ยน,phrawH gaanM seuuH theeF yuuL aaM saiR bpenM reuuangF raH yaH yaaoM yeeF sipL saamR sipL bpeeM suaanL reuuangF saehtL thaL gitL bpenM reuuangF neungL saawngR bpeeM saL thaanR naH gaanM gaawF bpliianL,example sentence,"""This is because purchasing a home is a long-term matter of 20-30 years, whereas economic [cycles] are one to two years in duration."""
เพราะการทำนาซึ่งทำแต่ปีละครั้งนั้น หากข้าวไม่ให้ผลเต็มที่ มีภัยธรรมชาติน้ำท่วมนาล่ม น้ำน้อยข้าวไม่งาม...,phrawH gaanM thamM naaM seungF thamM dtaaeL bpeeM laH khrangH nanH haakL khaaoF maiF haiF phohnR dtemM theeF meeM phaiM thamM maH chaatF naamH thuaamF naaM lohmF naamH naawyH khaaoF maiF ngaamM,example sentence,"""Because growing rice is a one-year-long cycle, if the rice plants do not produce a full crop, or there is a natural disaster, or if flooding causes the fields to collapse, or if a drought causes the rice plants to under-produce..."""
เพราะการที่ข้าวในบาตรสะอาดนั้น มีผลกับสุขภาพของพระ และทุกคนในวัดที่ได้กินข้าวก้นบาตรต่อจากท่าน,phrawH gaanM theeF khaaoF naiM baatL saL aatL nanH meeM phohnR gapL sookL khaL phaapF khaawngR phraH laeH thookH khohnM naiM watH theeF daiF ginM khaaoF gohnF baatL dtaawL jaakL thanF,example sentence,"""Because, cleanliness of the rice in the bowl affects the health of the monks, as well as everyone in the temple who eats from the same bowl."""
เพราะกำลังส่วนใหญ่ที่หดหายไป ไม่ใช่ไม่มีเงิน แต่เป็นเรื่องความเชื่อมั่น,phrawH gamM langM suaanL yaiL theeF hohtL haaiR bpaiM maiF chaiF maiF meeM ngernM dtaaeL bpenM reuuangF khwaamM cheuuaF manF,example sentence,"""[This is] because the disappearing [purchasing] power is not due to a lack of funds, but is, rather, an issue of confidence."""
เพราะขณะที่รถวิ่งนั้นความดันลมในยางรถยนต์จะเพิ่มขึ้นตามอุณหภูมิที่เพิ่มขึ้น ซึ่งเป็นเรื่องปกติ,phrawH khaL naL theeF rohtH wingF nanH khwaamM danM lohmM naiM yaangM rohtH yohnM jaL pheermF kheunF dtaamM oonM haL phuumM theeF pheermF kheunF seungF bpenM reuuangF bpaL gaL dtiL,example sentence,"This is because while the car is in motion, the air pressure in the tires will increase with the increase in temperature, which is normal."
...เพราะข้าวจะแพง ชาวนาจะต้องน้ำตาเช็ดหัวเข่า,phrawH khaaoF jaL phaaengM chaaoM naaM jaL dtawngF namH dtaaM chetH huaaR khaoL,example sentence,"""...because rice will be expensive and farmers will be heartbroken."""
เพราะเขาได้ดีกรีจากมหาวิทยาลัยชั้นนำเป็นใบเบิกทาง โอกาสจะได้งานและเงินดีจึงมีมาก,phrawH khaoR daiF deekL reeM jaakL maH haaR witH thaH yaaM laiM chanH namM bpenM baiM beerkL thaangM o:hM gaatL jaL daiF ngaanM laeH ngernM deeM jeungM meeM maakF,example sentence,"""Because he earned a degree from a leading university as a ticket to the future, he has an opportunity to get a job and good salary."""
เพราะเขาเป็นขาโจ๋ประจำกลุ่ม คนภายนอกจึงมองว่าเขาเป็นคนกวน ๆ,phrawH khaoR bpenM khaaR jo:hR bpraL jamM gloomL khohnM phaaiM naawkF jeungM maawngM waaF khaoR bpenM khohnM guaanM,example sentence,"""Because he is the gang leader, outsiders see him as a troublemaker."""
เพราะเขาเป็นคนสุรุ่ยสุร่ายจึงต้องมาเสียใจภายหลังที่ไม่มีเงินเก็บเลย,phrawH khaoR bpenM khohnM sooL ruyF sooL raaiF jeungM dtawngF maaM siiaR jaiM phaaiM langR theeF maiF meeM ngernM gepL leeuyM,example sentence,"""Because he was such a wastrel, he felt bad afterward that he had saved nothing."""
เพราะเขาเผลอใจไปกับเธอมากเกิน เขาจึงทำอะไรโดยไม่คำนึงถึงความถูกผิด,phrawH khaoR phluuhrR jaiM bpaiM gapL thuuhrM maakF geernM khaoR jeungM thamM aL raiM dooyM maiF khamM neungM theungR khwaamM thuukL phitL,example sentence,"""Because he has fallen so much in love with her, he does things without even thinking about whether they might be right or wrong."""
เพราะเขาเอวบางร่างเล็กจึงเดินได้คล่อง เมื่อออกเดินก็จ้ำเอา ๆ,phrawH khaoR aayoM baangM raangF lekH jeungM deernM daiF khlaawngF meuuaF aawkL deernM gaawF jamF aoM,example sentence,"""Because he is slight of build, he is able to walk quickly and easily; when he goes out to walk, he marches along at a brisk pace."""
เพราะคงจำกันไม่ได้ว่าใครเป็นใคร จึงตู่ตัวตู่ตนสับสนกันไปหมด,phrawH khohngM jamM ganM maiF daiF waaF khraiM bpenM khraiM jeungM dtuuL dtuaaM dtuuL dtohnM sapL sohnR ganM bpaiM mohtL,example sentence,"""Because they could not remember each other, they got confused as to who was who."""
เพราะคนอายุ ๖๐ ปียังแข็งแรง และทำงานได้อย่างสบาย ๆ,phrawH khohnM aaM yooH hohkL sipL bpeeM yangM khaengR raaengM laeH thamM ngaanM daiF yaangL saL baaiM,example sentence,"""[This is] because a sixty year-old person [can] still be robust, and can work comfortably."""
เพราะความแตกแยกทางการเมืองเลยเถิดถึงระดับที่ทำให้คนไทยอยู่กันร่วมกันยาก ลึกลงไปในต้นเหตุของความขัดแย้งคือการปะทะกันระหว่างเสรีนิยมกับอนุรักษนิยม,phrawH khwaamM dtaaekL yaaekF thaangM gaanM meuuangM leeuyM theertL theungR raH dapL theeF thamM haiF khohnM thaiM yuuL ganM ruaamF ganM yaakF leukH lohngM bpaiM naiM dtohnF haehtL khaawngR khwaamM khatL yaaengH kheuuM gaanM bpaL thaH ganM raH waangL saehR reeM niH yohmM gapL aL nooH rakH niH yohmM,example sentence,"""Extreme political cleavage has risen to a level which creates a situation where Thais can barely stand to live together. Delving deeply into the cause of the conflict, [one finds] a clash between Liberalism and Conservatism."""
เพราะความบริสุทธิ์ของสภาพธรรมชาติในภูเก็ต คงเป็นเพียงภาพในอดีต,phrawH khwaamM baawM riH sootL khaawngR saL phaapF thamM maH chaatF naiM phuuM getL khohngM bpenM phiiangM phaapF naiM aL deetL,example sentence,"""[This is] because the purity of Phuket’s natural environment is now a thing of the past."""
เพราะความรู้อันนี้ไม่จริง ในขณะที่ความรู้ว่าดวงอาทิตย์เป็นศูนย์กลางซึ่งมีโลก (อันมีดวงจันทร์เป็นบริวาร) โคจรไปรอบ ๆ นี่เป็นความรู้ที่จริง,phrawH khwaamM ruuH anM neeH maiF jingM naiM khaL naL theeF khwaamM ruuH waaF duaangM aaM thitH bpenM suunR glaangM seungF meeM lo:hkF anM meeM duaangM janM bpenM baawM riH waanM kho:hM jaawnM bpaiM raawpF raawpF neeF bpenM khwaamM ruuH theeF jingM,example sentence,"[This is] because this [supposed] knowledge does not constitute reality, while the knowledge that the sun is the center of the solar system, around which the earth and its satellite the moon) orbit, is the true reality."
...เพราะความเหี่ยวย่นและกล้ามเนื้อที่เคยอัดแน่นบริเวณนั้นได้ลดน้อยลงไปตามวันวัยของควาย,phrawH khwaamM hiaaoL yohnF laeH glaamF neuuaH theeF kheeuyM atL naaenF baawM riH waehnM nanH daiF lohtH naawyH lohngM bpaiM dtaamM wanM waiM khaawngR khwaaiM,example sentence,"""...due to its wrinkling [skin] and its muscles which used to be taut in those areas have now shrunk as the buffalo has aged."""
เพราะคำพูดลอย ๆ ของเขานั่นเอง จึงทำให้หลายคนคิดมาก,phrawH khamM phuutF laawyM laawyM khaawngR khaoR nanF aehngM jeungM thamM haiF laaiR khohnM khitH maakF,example sentence,"""Precisely because he spoke so indistinctly, many people read far too much into what he said."""
เพราะคุณควรต้องดูดีทั่วเรือนร่างดูดี ซึ่งนั่นหมายความถึงการออกกำลังแบบคาร์ดิโอและการยกน้ำหนัก,phrawH khoonM khuaanM dtawngF duuM deeM thuaaF reuuanM raangF duuM deeM seungF nanF maaiR khwaamM theungR gaanM aawkL gamM langM baaepL khaaM diL o:hM laeH gaanM yohkH namH nakL,example sentence,"...because you should take care of your entire body, this means both cardio-workouts and strength-building exercise."
เพราะคุณเป็นคนโหดเหี้ยม จึงไม่มีใครอยากที่จะยุ่งด้วย,phrawH khoonM bpenM khohnM ho:htL hiiamF jeungM maiF meeM khraiM yaakL theeF jaL yoongF duayF,example sentence,"""Because you are so cruel, no one wants to interact with you."""
...เพราะงานนี้เป็นโอกาสสร้างความสัมพันธ์กับคนในองค์กรไม่ใช่พาครอบครัวมาสังสรรค์สนุกกันเอง,phrawH ngaanM neeH bpenM o:hM gaatL saangF khwaamM samR phanM gapL khohnM naiM ohngM gaawnM maiF chaiF phaaM khraawpF khruaaM maaM sangR sanR saL nookL ganM aehngM,example sentence,"""...because this social affair offers an opportunity to build relations with other people in the organization, not to bring your family along and have a good time with them alone."""
...เพราะงานเลี้ยงสังสรรค์ปีใหม่ ถือเป็นโอกาสอันดีในการพูดคุย สร้างความสนิทสนมกับหัวหน้าและเพื่อนร่วมงานในบรรยากาศที่ผ่อนคลาย,phrawH ngaanM liiangH sangR sanR bpeeM maiL theuuR bpenM o:hM gaatL anM deeM naiM gaanM phuutF khuyM saangF khwaamM saL nitL saL nohmR gapL huaaR naaF laeH pheuuanF ruaamF ngaanM naiM banM yaaM gaatL theeF phaawnL khlaaiM,example sentence,"""...because a New Year’s social affair is a great opportunity to chat with an build relations with your boss and your coworkers in a relaxed atmosphere."""
เพราะเงินที่ต้องใช้เป็นค่าน้ำมันรถลดลง,phrawH ngernM theeF dtawngF chaiH bpenM khaaF namH manM rohtH lohtH lohngM,example sentence,"""[This is because] the money they need to spend to purchase gasoline has been reduced."""
...เพราะจะทำให้คนอื่นคิดในแง่ไม่ดีว่าหลังเลิกงานอาจทำตัวไม่เหมาะสม,phrawH jaL thamM haiF khohnM euunL khitH naiM ngaaeF maiF deeM waaF langR leerkF ngaanM aatL thamM dtuaaM maiF mawL sohmR,example sentence,"""...because [dressing this way] will cause others to think that after the party is over there may be opportunities for inappropriate behavior."""
เพราะฉะนั้น ,phrawH chaL nanH,conjunction,therefore; for the reason that; thus
"เพราะฉะนั้น ""การใช้ภาษาไทยให้ถูกต้องตามหลักไวยากรณ์"" ก็คือ ""การเขียนคำให้ถูกต้องตามที่กำหนดในพจนานุกรม""",phrawH chaL nanH gaanM chaiH phaaM saaR thaiM haiF thuukL dtawngF dtaamM lakL waiM yaaM gaawnM gaawF kheuuM gaanM khiianR khamM haiF thuukL dtawngF dtaamM theeF gamM nohtL naiM phohtH jaL naaM nooH grohmM,example sentence,"""Therefore, “the use of grammatically correct Thai” is “writing words correctly as set forth in the dictionary.”"""
เพราะฉะนั้นคนไทยเรานะคะ ก็จะต้องสมัยก่อนเนี่ย ก็คือ มันแล้วแต่ต้นมะพร้าว บางต้นเนี่ย ก็คือสูง บางต้นก็จะมีขนาดเตี้ยหน่อย,phrawH chaL nanH khohnM thaiM raoM naH khaH gaawF jaL dtawngF saL maiR gaawnL niiaF gaawF kheuuM manM laaeoH dtaaeL dtohnF maH phraaoH baangM dtohnF niiaF gaawF kheuuM suungR baangM dtohnF gaawF jaL meeM khaL naatL dtiiaF naawyL,example sentence,"""Therefore, we Thais we need to... In the past, it depended on the type of tree; some trees were tall; some trees were fairly short."""
"เพราะฉะนั้น ด้านหนึ่งคนชั้นกลางก็รู้สึกว่า ""ชาวนา"" คือผู้มีพระคุณ (ในเชิงวาทกรรม)",phrawH chaL nanH daanF neungL khohnM chanH glaangM gaawF ruuH seukL waaF chaaoM naaM kheuuM phuuF meeM phraH khoonM naiM cheerngM waatF thaH gamM,example sentence,"""Therefore, on the one hand the middle class feels that farmers are [our] benefactors (in a literary sense)."""
"""เพราะฉะนั้น ในแต่ละวันของชีวิต เราต้องให้ความสนใจ กับเรื่องที่ทำให้ตัวเรา และครอบครัวมีความสุข",phrawH chaL nanH naiM dtaaeL laH wanM khaawngR cheeM witH raoM dtawngF haiF khwaamM sohnR jaiM gapL reuuangF theeF thamM haiF dtuaaM raoM laeH khraawpF khruaaM meeM khwaamM sookL,example sentence,"""""Therefore, each and every day of our lives, we need to give due importance to those issues which provide happiness to ourselves and our families."""""
เพราะฉะนี้,phrawH chaL neeH,adverb,hence; wherefore; therefore; consequently; so
เพราะช่วงที่ผมไปเที่ยวนิกโก้ซึ่งเป็นสถานที่ท่องเที่ยวใกล้กรุงโตเกียว ตรงกับวันหยุด ๓ วัน,phrawH chuaangF theeF phohmR bpaiM thiaaoF nikH go:hF seungF bpenM saL thaanR theeF thaawngF thiaaoF glaiF groongM dto:hM giaaoM dtrohngM gapL wanM yootL saamR wanM,example sentence,"""This is because the time I went to visit Nikko, which was the vacation spot closest to Tokyo, was during a three-day holiday in Japan."""
เพราะช่วงเวลาที่คุยกันเป็นช่วงบ่ายของวันทำงาน,phrawH chuaangF waehM laaM theeF khuyM ganM bpenM chuaangF baaiL khaawngR wanM thamM ngaanM,example sentence,"""[This is] because we’re having this discussion during the afternoon of a regular workday."""
เพราะเช่นนั้น,phrawH chenF nanH,adverb,hence in this example; consequently; so
เพราะเช่นนี้,phrawH chenF neeH,adverb,hence in this example; consequently; so
เพราะดังนั้น,phrawH dangM nanH,adverb,as such; hence; wherefore; therefore; consequently; so
เพราะดังนี้,phrawH dangM neeH,adverb,as such; hence; wherefore; therefore; consequently; so
เพราะได้รับสัญญาณเตือนจากนกจาบคาเคราสีน้ำเงินที่เกาะอยู่บนกิ่งไม้มองผมอยู่ตลอด,phrawH daiF rapH sanR yaanM dteuuanM jaakL nohkH jaapL khaaM khraoM seeR namH ngernM theeF gawL yuuL bohnM gingL maaiH maawngM phohmR yuuL dtaL laawtL,example sentence,"""...because they heard warnings from the dark blue red-bearded bee-eaters perched on the branches [of my shelter] which watched me all the time."""
เพราะต้องการปิดโครงการ และต้องการกระแสเงินสดเข้ามาสำรอง,phrawH dtawngF gaanM bpitL khro:hngM gaanM laeH dtawngF gaanM graL saaeR ngernM sohtL khaoF maaM samR raawngM,example sentence,"""[The companies are doing this] because they want to complete the projects and want the additional cash flow [that the projects generate]."""
เพราะถึงตอนนั้นปัจจัยกำหนดราคาน้ำมันดิบในตลาดโลกจะไม่ใช่เรื่องดีมานด์-ซัพพลายอีกต่อไปแล้ว แต่เป็นเรื่องของความรู้สึกล้วน ๆ ครับ,phrawH theungR dtaawnM nanH bpatL jaiM gamM nohtL raaM khaaM namH manM dipL naiM dtaL laatL lo:hkF jaL maiF chaiF reuuangF deeM maanM sapH phlaaiM eekL dtaawL bpaiM laaeoH dtaaeL bpenM reuuangF khaawngR khwaamM ruuH seukL luaanH khrapH,example sentence,"""This is because the factors affecting the world market price of oil will no longer be supply and demand, but will be solely based on emotion."""
เพราะถึงแม้ว่ามันจะเป็นความหวังที่น้อยนิด,phrawH theungR maaeH waaF manM jaL bpenM khwaamM wangR theeF naawyH nitH,example sentence,"""...because even if the hope that we give them is just a tiny amount,..."""
เพราะที่ผ่านมาปัญหาดังกล่าวก็เกิดกับเด็กวัยเรียนมากอยู่แล้ว,phrawH theeF phaanL maaM bpanM haaR dangM glaaoL gaawF geertL gapL dekL waiM riianM maakF yuuL laaeoH,example sentence,[This is] because problems of this type had already occurred in the past.
เพราะที่สุดรัฐจะจัดสรรที่ดินให้กับเกษตรกรมากแค่ไหน ผืนดินเหล่านั้นก็คงถูกเปลี่ยนมือไปสู่นายทุนอยู่วันยังค่ำ,phrawH theeF sootL ratH jaL jatL sanR theeF dinM haiF gapL gaL saehtL dtraL gaawnM maakF khaaeF naiR pheuunR dinM laoL nanH gaawF khohngM thuukL bpliianL meuuM bpaiM suuL naaiM thoonM yuuL wanM yangM khamF,example sentence,"""In the end, no matter how much land the government allocates to farmers, each and every day, this land will change hands and be acquired by financial investors."""
เพราะเธอคนเดียวจึงทำให้เขาแตกกัน,phrawH thuuhrM khohnM diaaoM jeungM thamM haiF khaoR dtaaekL ganM,example sentence,"""It's only because of you that they broke up."" ""You were the only reason that they separated."""
เพราะในชีวิตของชนชั้นกลางเราแทบจะไม่รู้จักชาวนาตัวเป็น ๆ แม้แต่คนเดียว,phrawH naiM cheeM witH khaawngR chohnM chanH glaangM raoM thaaepF jaL maiF ruuH jakL chaaoM naaM dtuaaM bpenM maaeH dtaaeL khohnM diaaoM,example sentence,"""[This is] because in their daily lives people in the middle class do not personally know even one real live farmer."""
