word,spell,type,meaning
พระมหากรุณาธิคุณ,phraH maH haaR grooL naaM thiH khoonM,,royal grace; divine grace
พระยา,phraH yaaM,,[title of ancient Thai civil nobility nobility between พระ  (Phra) and เจ้าพระยา  (Chao Phraya)]
พระยุคลบาท,phraH yooH khaH laH baatL,noun,His Majesty's feet
พระรัตนตรัย,phraH ratH dtaL naH dtraiM,"noun, formal, loanword, Pali",The Triple Gem
proper noun,[คุณพระรัตนตรัย] The Triple Gem,,
พระราชกิจ,phraH raatF gitL,"noun, formal",[royalty] activity
พระราชทาน,phraH raatF chaH thaanM,verb,to give; confer; royally presented by the king
พระราชทานเพลิงศพ,phraH raatF chaH thaanM phleerngM sohpL,noun,cremation ceremony sponsored by the royal family
พระราชทานอภัยโทษ,phraH raatF chaH thaanM aL phaiM yaH tho:htF,verb,to grant a royal pardon
พระราชประสงค์,phraH raatF chaH bpraL sohngR,noun,royal intention
พระราชวงศ์,phraH raatF chaH wohngM,noun,royal family; royalty
พระราชสมภพ,phraH raatF chaH sohmR phohpH,verb,royal birth
พระราชเสาวนีย์,phraH raatF chaH saoR waH neeM,noun,The words of the Queen; A statement by the Queen
พระราชหัตถเลขา,phraH raatF chaH hatL thaL laehM khaaR,noun,royal writing
พระราชอัธยาศัย,phraH raatF chaH atL thaH yaaM saiR,noun,royal command; at the royal pleasure
พระราชานุเคราะห์,phraH raaM chaaM nooH khrawH,noun,assistance from the King
พระราโชวาท,phraH raaM cho:hM waatF,noun,speech by the King
พระวรกาย,phraH waawnM gaaiM,noun,[royal use] body; self
พระศรีรัตนตรัย,phraH seeR ratH nohtH raiM,,[alternate spelling of พระรัตนตรัย]
พระศรีอาริย์,phraH seeR aaM riH,proper noun,"Phra Sri-arn (Phra Sri Arya Maitreya, concerned with divine activity leading to a paradisal state)"
พระสมเด็จ,phraH sohmR detL,noun,votive tablet (usually bearing image of Buddha or venerated monk)
พระสยามเทวาธิราช,phraH saL yaamM thaehM waaM thiH raatF,proper noun,Phra Siam Thewathirat (patron of Thailand)
พระสังฆราช,phraH sangR khaH raatF,proper noun,Buddhist supreme patriarch
proper noun,[สมเด็จพระสังฆราช] title of the Buddhist Supreme Patriach,,
พระหทัย,phraH haL thaiM,"noun, formal",[royalty] heart
พระองค์,phraH ohngM,"proper noun, person, formal, loanword, Khmer","His Magesty; the 3rd Person Pronoun for the Lord Buddha, the King, royalty, divine being, chief deity, the Lord Jesus Christ (พระเยซู), Mother Mary (พระแม่มารี) and other world's religious leaders/founders"
"classifier, Khmer","[numerical classifier for kings, queens and royal family members]",,
พระองค์เจ้า,phraH ohngM jaoF,"noun, proper noun, person, phrase, formal",the king's son born by a lesser concubine
พระองค์ทรงบำเพ็ญพระราชกรณียกิจทั้งปวง,phraH ohngM sohngM bamM phenM phraH raatF chaH gaL raH neeM yaH gitL thangH bpuaangM,example sentence,"""His majesty has performed the entirety of his good works..."""
พระองค์ทรงเป็นปูชนียบุคคลล้ำเลิศของโลก,phraH ohngM sohngM bpenM bpuutL chaH neeM yaH bookL khohnM laamH leertF khaawngR lo:hkF,example sentence,"""His magesty was a superior and venerated person [recognized by] the entire world."""
พระองค์ทรงเป็นมิ่งขวัญ และที่รักเคารพเทิดทูลของคนทั้งชาติ,phraH ohngM sohngM bpenM mingF khwanR laeH theeF rakH khaoM rohpH theertF thuunM khaawngR khohnM thangH chaatF,example sentence,"""His Majesty is the cherished figure [of his people] and is loved and respected by [his subjects] throughout the nation."""
พระองค์ทรงส่งพระราชโอรสไปรับการศึกษาในต่างประเทศ,phraH ohngM sohngM sohngL phraH raatF chaH o:hM rohtH bpaiM rapH gaanM seukL saaR naiM dtaangL bpraL thaehtF,example sentence,"""He [the King] sent his son to school overseas."""
พระอรหันต์,phraH aL raH hanR,noun,a Buddhist saint; an exemplary Buddhist monk
พระอุปัชฌาย์,phraH ooL bpatL chaaM,noun,preceptor; priest who officiates at an ordination ceremony
พรั่งพร้อม,phrangF phraawmH,adverb,in mass; fully equipped; fully provided
พรั่งพรู,phrangF phruuM,verb,to gush; flood; pour; surge
adverb,effusively; gushingly,,
พรั่น,phranF,adjective,[is] afraid; fearful; frightened; daunted; scared
adjective,[พรั่นใจ] [is] afraid; frightened; daunted,,
พรั่นกลัว,phranF gluaaM,verb,to fear; [is] afraid of
พรั่นใจ,phranF jaiM,adjective,[พรั่นใจ] [is] afraid; frightened; daunted
พรั่นพรึง,phranF phreungM,adjective,to fear
พรั่นพรึง,phranF phreungM,adjective,[is] afraid; frightened; scared; terrified
พร่า ,phraaF,"verb, intransitive",to destroy; to kill; to ruin; to lay waste
adjective,[is] blurry; diffuse; indistinct,,
verb,"to ""cook"" beef or seafood by infusing it with lime juice",,
พร่ามัว,phraaF muaaM,adjective,blurred; indistinct
พร่าเลือน,phraaF leuuanM,adjective,[is] blurred; indistinct
พร้า ,phraaH,noun,a big curved knife; a jungle sickle; a scythe
noun,[มีดพร้า] machete,,
พราก,phraakF,"verb, transitive",to separate; to part
พรากจากกัน,phraakF jaakL ganM,adjective,[is] separated; scattered; parted; apart; divided; dissociated
พราง ,phraangM,verb,to hide; to camouflage; to conceal against; to deceive; to make indistinct; to delude
พร่าง,phraangF,"adjective, poetic",[is] brilliant; bright; illuminating; glittering; sparkling
พร่างพราย,phraangF phraaiM,adjective,[is] sparkling; glittering; twinkling; shinning; shimmering
พร่างพราว,phraangF phraaoM,adjective,[is] shining; illuminated; sparkling; brilliant
พราน ,phraanM,noun,hunter; woods person
พรานป่า,phraanM bpaaL,noun,forest ranger
พราย ,phraaiM,noun,a water spirit or ghost
noun,small bubbles in or on a liquid or liquid surface,,
adjective,[is] brilliant; bright; sparkling; dazzling; glittering; shimmering,,
พรายกระซิบ,phraaiM graL sipH,"noun, phrase",a little birdy told me; undisclosed source of information
พรายน้ำ,phraaiM naamH,noun,(air) bubble in water
พรายแสง,phraaiM saaengR,adjective,[is] brilliant; shimmering
พรายแสง,phraaiM saaengR,verb,to glow; glitter; sparkle; shimmer
พราว,phraaoM,adjective,[is] sparkling; glittering
adjective,full of; bristling with,,
พราหมณ์ ,phraamM,"proper noun, Pali",Brahman; an ancient religion
proper noun,a [certain type of] traditional Thai song,,
proper noun,[of the Four Castes in Code of Manu in ancient India's Hindu society] the second of the four castes; Brahmans,,
noun,[ปลาพราหมณ์] [a specific type of fish],,
พราหมณี ,phraamM maH neeM,noun,female Brahmin; Brahmanee; Brahmin woman
พรำ,phramM,adjective,[is] drizzling
"verb, intransitive",to drizzle; sprinkle,,
adverb,"[พรำ ๆ] [of rain] in a drizzle; in continuous, fine drops",,
พรำ ๆ,phramM phramM,adverb,"[พรำ ๆ] [of rain] in a drizzle; in continuous, fine drops"
พร่ำ,phramF,adjective,[is] untiring; tireless; indefatigable; disregarding one’s own weariness
adjective,[is] excessive; without limit,,
adjective,continuously; constantly; always (doing something),,
verb,chatter; be garrulous,,
พร่ำบ่น,phramF bohnL,verb,to rattle on; to babble
พร่ำพลอด,phramF phlaawtF,adjective,[is] occupied with endless whispers of love
พร่ำพลอด,phramF phlaawtF,verb,to flirt with; whisper sweet nothings
พร่ำพูด,phramF phuutF,verb,to speak without stopping; talk incessantly
พร่ำพูด,phramF phuutF,adverb,garrously; speaking incessantly
พร่ำเพรื่อ,phramF phreuuaF,"verb, adverb",ad nauseam; to harp on indiscriminately or indiscreetly and repeatedly
พร่ำเพ้อ,phramF phuuhrH,verb,to talk nonsense
พร่ำสอน,phramF saawnR,verb,(teaching) to drill; to drum into; teach by constant repetition; exhort
พร่ำพลอด,phramF phlaawtF,verb,to talk sweetly; chit chat in a romantic manner
พริก ,phrikH,noun,chili pepper
พริกขี้หนู ,phrikH kheeF nuuR,noun,"small, green, fiery chili pepper; Capsicum minimum"
พริกเขียว ,phrikH khiaaoR,noun,green pepper
พริกชี้ฟ้า ,phrikH cheeH faaH,noun,"[พริกชี้ฟ้า] [a type of] Thai chilli, Capsicum frutescens"
พริกดอง ,phrikH daawngM,noun,Thai-style chili sauce
พริกแดง ,phrikH daaengM,noun,red pepper
พริกไทย ,phrikH thaiM,noun,"black pepper, Piper nigrum"
พริกไทยอ่อน,phrikH thaiM aawnL,noun,green peppercorns
พริกน้ำปลา ,phrikH namH bplaaM,noun,fish sauce with chili
พริกน้ำส้ม,phrikH namH sohmF,noun,peppers in vinegar [a popular Thai condiment]
พริกป่น ,phrikH bpohnL,"noun, formal",chili powder; ground chili; cayenne pepper
พริกเผา  ,phrikH phaoR,noun,dried chili
พริกเหลือง ,phrikH leuuangR,noun,yellow pepper
พริกหยวก ,phrikH yuaakL,noun,bell pepper; sweet pepper
พริ้ง,phringH,"adjective, adverb, colloquial",pretty; beautiful; spiffy
พริ้งเพรา,phringH phraoM,adjective,[is] pretty
พริ้งเพรา,phringH phraoM,adjective,[is] beautiful
พริ้งเพริศ,phringH phreertF,adjective,[is] magnificent; charming
พริ้งพราย,phringH phraaiM,adjective,[is] gracefull
พริตตี้เอ็มซี,phritH dteeF emM seeM,proper noun,Pretty M.C.
พริทอเรีย ,phriH thaawM riiaM,"proper noun, geographical","Pretoria, the capital city of แอฟริกาใต้ (South Africa)"
พรินต์,phrinM,,[alternate spelling of ปริ๊นต์]
พรินเตอร์,phrinM dtuuhrM,"noun, loanword, English",[Thai transcription of the foreign loanword] printer
พริบ ,phripH,"verb, transitive",[of the eye(s)] to wink; to twinkle; to blink
adverb,at once; suddenly; quickly,,
adverb,in unison; all together; with agreement,,
onomatopoeia,[sound of marching troops],,
พริ้ม ,phrimH,adjective,smiling; beautiful; graceful
พริ้ว,phriuH,,[alternate spelling of พลิ้ว]
พริสซิลล่า,phritH sinM laaF,"proper noun, loanword, English",Priscilla [an English given name]
พรีเซนต์,phreeM saehnM,"verb, loanword, English",[Thai transcription of foreign loan word] present
พรีเซ้นต์,phreeM senH,"verb, loanword, English",[Thai transcription of foreign loanword] present; to present
พรีเซ็นเตอร์,phreeM senM dtuuhrM,noun,[Thai transcription of foreign loanword] presenter
พรีเมียร์,phreeM miiaM,noun,[Thai transcription of foreign loanword] premier
พรีเมียร์ ลีก,phreeM miiaM leekF,proper noun,[Thai transcription of foreign loanword] Premier League
พรีเมียร์ลีก,phreeM miiaM leekL,proper noun,[Thai transcription of foreign name] Premier League
พรึง,phreungM,,[combining form with ตะลึง and พรั่น]
พรึงเพริด ,phreungM phreertF,"verb, intransitive",to be surprised; to be pleased
noun,a surprise,,
พรึบ ,phreupH,adverb,altogether; with one accord; in strength; unanimously; in unison
พรืด,phreuutF,adverb,in a mass; all over
พรุ,phrooH,noun,crust of soft earth
พรุก,phrookH,"noun, archaic, ancient",[obsolete form of พรุ่ง ] tomorrow
พรุ่ง ,phroongF,noun,"tomorrow, the next day, the following day"
พรุ่งนี้ ,phroongF neeH,noun,tomorrow
พรุ่งนี้ก็สายเกิน,phroongF neeH gaawF saaiR geernM,example sentence,"""Tomorrow is too late."""
พรุ่งนี้ค่อยว่ากันใหม่,phroongF neeH khaawyF waaF ganM maiL,example sentence,"""Let's talk again tomorrow."""
พรุ่งนี้คุณมาได้ไหมครับ ,phroongF neeH khoonM maaM daiF maiH khrapH,example sentence,"[spoken by male] ""Can you come tomorrow?"""
พรุ่งนี้จะไปสัมมนาต่างจังหวัด ฉันยังไม่ได้จัดกระเป๋าเลย,phroongF neeH jaL bpaiM samR maH naaM dtaangL jangM watL chanR yangM maiF daiF jatL graL bpaoR leeuyM,example sentence,"""Tomorrow I’m going to a seminar upcountry; I haven’t even packed yet."""
พรุ่งนี้จะมีผลไม้มากกว่านี้ ,phroongF neeH jaL meeM phohnR laH maaiH maakF gwaaL neeH,example sentence,"""Tomorrow there will be more fruit."""
พรุ่งนี้ฉันจะไปเที่ยวกับครอบครัวประมาณหนึ่งอาทิตย์,phroongF neeH chanR jaL bpaiM thiaaoF gapL khraawpF khruaaM bpraL maanM neungL aaM thitH,example sentence,"""Tomorrow I am going on vacation with my family for about one week."""
พรุ่งนี้ ฉันจะไปหาคุณ ,phroongF neeH chanR jaL bpaiM haaR khoonM,example sentence,"""I will come and see you tomorrow."""
พรุ่งนี้เช้า ,phroongF neeH chaaoH,noun,tomorrow morning
พรุ่งนี้เช้า ฉันต้องตื่นเจ็ดโมงครึ่ง ,phroongF neeH chaaoH chanR dtawngF dteuunL jetL mo:hngM khreungF,example sentence,"""Tomorrow morning I must get up at 7:30."""
พรุ่งนี้ต้องไปตรวจสุขภาพ คืนนี้งดน้ำและอาหารอย่างเด็ดขาด ห้ามลืม,phroongF neeH dtawngF bpaiM dtruaatL sookL khaL phaapF kheuunM neeH ngohtH naamH laeH aaM haanR yaangL detL khaatL haamF leuumM,example sentence,"""Tomorrow [you] need to go for a medical checkup; [You] can’t drink or eat anything at all. Don’t forget."""
พรุ่งนี้(ตอน)กลางคืน,phroongF neeH dtaawnM glaangM kheuunM,adverb,tomorrow night
พรุ่งนี้เตือนให้ผมทำด้วยนะ,phroongF neeH dteuuanM haiF phohmR thamM duayF naH,example sentence,"""Remind me to do it tommorrow, ok?"""
พรุ่งนี้เป็นวันหยุดใช่ไหมคะ ,phroongF neeH bpenM wanM yootL chaiF maiH khaH,example sentence,"[spoken by female] ""Is tomorrow a holiday?"""
พรุ่งนี้ไปกินข้าวกลางวันด้วยกันมั้ย เราไม่ได้เจอกันนานแล้วนะ,phroongF neeH bpaiM ginM khaaoF glaangM wanM duayF ganM maiH raoM maiF daiF juuhrM ganM naanM laaeoH naH,example sentence,"""Shall we have lunch together tomorrow? It's been a long time since we last met."""
พรุ่งนี้ผมต้องบินไปเชียงใหม่กับเจ้านาย,phroongF neeH phohmR dtawngF binM bpaiM chiiangM maiL gapL jaoF naaiM,example sentence,"""I have to fly to Chiangmai with my boss tomorrow."""
พรุ่งนี้ผมต้องอ่วมกว่านี้แน่ เพราะเจอคู่แข่งที่แข็งแกร่งมาก,phroongF neeH phohmR dtawngF uaamL gwaaL neeH naaeF phrawH juuhrM khuuF khaengL theeF khaengR graengL maakF,example sentence,"""Tomorrow will certainly be worse for me because I am facing a very strong opponent."""
พรุ่งนี้ผมมาไม่ได้ครับ ,phroongF neeH phohmR maaM maiF daiF khrapH,example sentence,"[spoken by male] ""I cannot come tomorrow."""
พรุ่งนี้มีสอบ ข้างบ้านเสือกกินเหล้าเปิดเพลงเสียงดังลั่น กูอ่านหนังสือไม่รู้เรื่องเลย,phroongF neeH meeM saawpL khaangF baanF seuuakL ginM laoF bpeertL phlaehngM siiangR dangM lanF guuM aanL nangR seuuR maiF ruuH reuuangF leeuyM,example sentence,"""Tomorrow I have a test. [The people] next door are making noise, drinking, and listen to loud music. I can't understand what I'm reading."""
พรุน ,phroonM,"adjective, verb, intransitive",riddled (with); perforated (with)
noun,prune; plum,,
พรู ,phruuM,verb,to flock; throng; swarm
พรูดพราด ,phruutF phraatF,onomatopoeia,[the sound of flapping wings]
พฤ.,wanM phaH reuH hatL,"proper noun, abbreviation",[abbreviation for วันพฤหัสบดี] Thursday
พฤกษ์,phreukH,"noun, formal, loanword, Sanskrit",tree; plant; flora
พฤกษ,phreukH saL,"noun, adjective, particle, formal, loanword, Sanskrit",[variant of พฤกษ์] tree; plant; flora; botanical; pertaining to plants
พฤกษศาสตร์ ,phreukH saL saatL,"noun, phrase, formal, loanword, Pali",Botany; plant science; botanical science
พฤกษชาติ,phrikH saL chaatF,noun,tree; plant; vegetable; flora
adjective,[is] botanical,,
พฤกษา,phreukH saaR,"noun, Pali",flowers
พฤกษานานาพันธุ์,phreukH saaR naaM naaM phanM,noun,assorted varieties of flowers
พฤติ,phreuH dtiL,"noun, formal, loanword, Pali",behavior; conduct; livelihood; action; profession; poetry
พฤติการณ์ ,phreuH dtiL gaanM,noun,behavior; conduct; action; demeanor
พฤตินัย ,phreuH dtiL naiM,"noun, phrase, formal, loanword, Pali",factual sense
พฤติกรรม ,phreuH dtiL gamM,noun,behavior; conduct (what one does or what one says)
พฤติกรรมก้าวร้าว,phreuH dtiL gamM gaaoF raaoH,noun,aggressive behavior
พฤติกรรมของนักการเมืองทำให้คนเสื่อมศรัทธา ไม่อยากเลือกตั้งอีก,phreuH dtiL gamM khaawngR nakH gaanM meuuangM thamM haiF khohnM seuuamL satL thaaM maiF yaakL leuuakF dtangF eekL,example sentence,"""The behavior of politicians makes people lose faith in them and decline to vote (for them) anymore."""
พฤติกรรมของผู้หญิงคนนี้น่าหมั่นไส้จริง ๆ,phreuH dtiL gamM khaawngR phuuF yingR khohnM neeH naaF manL saiF jingM,example sentence,"""This girl’s behavior is really irritating."""
พฤติกรรมเบี่ยงเบน,phreuH dtiL gamM biiangL baehnM,noun,deviant behavior
พฤติกรรมรุนแรงต่อต้านสังคมของวัยรุ่น ,phreuH dtiL gamM roonM raaengM dtaawL dtaanF sangR khohmM khaawngR waiM roonF,phrase,severe or violent anti-social behavior in teenagers
พฤติกรรมสงสัย,phreuH dtiL gamM sohngR saiR,noun,suspicious behavior
พฤศจิก ,phreutH saL jikL,"noun, proper noun, formal, loanword, Sanskrit","[ราศีพฤศจิก] Thai Zodiac sign for Scorpio, the eighth sign of the zodiac"
พฤศจิกายน ,phreutH saL jiL gaaM yohnM,noun,November
พฤษภ ,phreuH sohpL,"noun, proper noun, formal, loanword, Pali","[ราศีพฤษภ] Thai Zodiac sign for Taurus, the second sign of the zodiac"
พฤษภา,phritH phaaM,,May
พฤษภาทมิฬ,phritH phaaM thaH minM,proper noun,"Dark Day May, 1992 [incident in Thai history]"
พฤษภาคม ,phreutH saL phaaM khohmM,noun,May
พฤหัสบดี ,phreuH hatL saL baawM deeM,"noun, formal","[formal, general] Jupiter"
"noun, formal",[ดาวพระพฤหัสบดี] [formal] the planet Jupiter,,
"noun, formal",[วันพฤหัสบดี] [formal] Thursday,,
พฤหัสบดี,phaH reuH hatL saL baawM deeM,,[alternate pronunciation of พฤหัสบดี ]
พฤหัสฯ ,phaH reuH hatL,"proper noun, colloquial","[colloquial, general] Jupiter"
"noun, colloquial",[ดาวพระพฤหัสฯ] [colloquial] the planet Jupiter,,
"noun, colloquial",[วันพฤหัสฯ] [colloquial] Thursday,,
พล ,phohnM,"noun, loanword, Pali",power; force; strength; violence; military force
"noun, loanword, Pali",troops; soldiers; forces; plebes,,
"noun, proper noun, person, loanword, Pali",low member of military or police force,,
"noun, proper noun, person, loanword, Pali",general; General [military rank],,
"adjective, loanword, Pali",mediocre; indifferent; ordinary,,
พล,phohnM laH,,[alternate pronunciation of พล ]
พล,phaH laH,,[alternate pronunciation of พล ]
พลการ ,phaH laH gaanM,"noun, adjective",violent; destructive; violence
พลการ,phaH laH gaanM,noun,"force, strength"
พลจัตวา ,phohnM jatL dtaL waaM,noun,one-star general
พลซุ่มยิง,phohnM soomF yingM,noun,sniper
พลตรี ,phohnM dtreeM,noun,Major General; two-star general
พลตำรวจ ,phohnM dtamM ruaatL,noun,policeman; police private
พลตำรวจตรี ,phohnM dtamM ruaatL dtreeM,noun,Police Major General
พลตำรวจโท ,phohnM dtamM ruaatL tho:hM,noun,Police Lieutenant General; 2nd-ranking police officer
พลตำรวจเอก ,phohnM dtamM ruaatL aehkL,noun,Police General; highest-ranking police officer
พลทหาร ,phohnM thaH haanR,noun,"Enlisted soldier; low member of Army, Navy, or Air Force"
พลทหารเดินเท้า,phohnM thaH haanR deernM thaaoH,noun,infantry
พลโท ,phohnM tho:hM,noun,Lieutenant General; three-star general
พลพรรค,phohnM laH phakH,noun,partisan; friends; company; party; gang; associate; followers
พลพาย,phohnM laH phaaiM,noun,rower; oarsman
พลเมือง ,phohnM laH meuuangM,noun,a citizen; an inhabitant; people; population
พลเมืองของชาติกลายเป็นง่อยเปลี้ยเสียขากลายเป็นคนป่วยที่ ไม่สามารถช่วยเหลือตัวเองได้,phohnM laH meuuangM khaawngR chaatF glaaiM bpenM ngaawyF bpliiaF siiaR khaaR glaaiM bpenM khohnM bpuayL theeF maiF saaR maatF chuayF leuuaR dtuaaM aehngM daiF,example sentence,"""The people of the nation have become crippled; they are ill; they are unable to help themselves."""
พลเมืองชั้นสอง,phohnM laH meuuangM chanH saawngR,noun,second class citizen
พลเมืองสหภาพยุโรป,phohnM laH meuuangM saL haL phaapF yooH ro:hpL,noun,citizen of Europe
พลแม่นปืน,phohnM maaenF bpeuunM,noun,sharpshooter
พลรบ ,phohnM rohpH,noun,combatants
พลร่ม ,phohnM rohmF,noun,"parachute soldier, a paratrooper"
พลร่ม ,phohnM rohmF,"noun, figurative, colloquial",unregistered voters brought in to vote
พลเรือตรี ,phohnM reuuaM dtreeM,noun,Rear Admiral
พลเรือโท ,phohnM reuuaM tho:hM,noun,Vice Admiral
พลเรือเอก ,phohnM reuuaM aehkL,noun,Admiral; highest-ranking naval officer
พลเรือน ,phohnM laH reuuanM,noun,civilians
พลโลก ,phohnM laH lo:hkF,"noun, plural",citizens of the world
พลศาสตร์,phohnM laH saatL,noun,[the science of] dynamics
พลศึกษา ,phaH laH seukL saaR,noun,physical education; gymnastics
พลอากาศตรี ,phohnM aaM gaatL dtreeM,noun,Air Vice Marshal; Air Force officer of third highest rank
พลอากาศโท ,phohnM aaM gaatL tho:hM,noun,Air Marshal; Air Force officer of second-highest rank
พลอากาศเอก ,phohnM aaM gaatL aehkL,noun,Air Force officer of the highest rank
พลเอก ,phohnM aehkL,noun,"General, Army or Police; four star general"
พล.,phitH saL nooH lo:hkF,"proper noun, abbreviation",[abbreviation for พิษณุโลก ] PLK
พล.ต.,phohnM dtreeM,"noun, abbreviation",[abbreviation for พลตรี]
พล.ต.ต.,phohnM dtamM ruaatL dtreeM,"proper noun, abbreviation",[abbreviation for พลตำรวจตรี] Police Major General
พล.ต.ท.,phohnM dtaawM thaawM,,[abbreviation for การจัดการ] Pol. Lt. Gen
พล.ต.อ.,phohnM dtamM ruaatL aehkL,"proper noun, abbreviation",[abbreviation for พลตำรวจเอก] Police General
พล.ท.,phohnM tho:hM,"noun, abbreviation",[abbreviation for พลโท]
พล.อ.,phohnM aehkL,"noun, abbreviation",[abbreviation for พลเอก]
