word,frequency
น้ำเสาวรส,3
คคา,3
โซเดียมต่ำ,2
วิตามินซีสูง,2
มีวิตามินเอ,2
น้ำกระเจี๊ยบ,1
มาผิดนิดหน่อย,1
ป้อมแท้,1
มะขามป้อมแท้,1
หญ้าหวาน,1
ได้หอมหวาน,1
สูงน้ำลิ้นจี่,1
รี่รวม,1
มีวิตามินเอสูงน้ำ,1
ผลิตภัณฑ์โครงการหลวง,1
หอมหวาน,1
แก้ร้อนในน้ำกระเจี๊ยบ,1
มะขามป้อม,1
น้ำฝรั่ง,1
จะคุ้น,1
ยมสูงน้ำลิ้นจี่,1
ใยอาหารสูงน้ำมะตูม,1
มาบ้างแล้ว,1
อันนี้ทำรูปมาผิดนิดหน่อย,1
น้ำชุ่ม,1
ช้อนสุด,1
หอมเสาวรส,1
ช่วยระบบขับถ่าย,1
สุขภาพสุด,1
ไก่กา,1
ได้ที่,1
มะม่วงนำ,1
น้ำชาเขียว,1
ยมน้ำ,1
ผสมสารสกัดจากหญ้าหวาน,1
สูงน้ำ,1
รสชาติแบบมะขามป้อมแท้,1
ผสมน้ำผึ้ง,1
แยมกลีบกุหลาบ,1
น้ำมะขามป้อม,1
ล้นช้อนสุด,1
มากก,1
สูงสุด,1
เพิ่มโปรตีน,1
น้ำมะม่วง,1
วิตามินซีสูงสุด,1
เลือดน้ำชาเขียว,1
ทำรูปมาผิดนิดหน่อย,1
มะม่วงผสมเสาวรส,1
กันน้ำเสาวรส,1
เมียบริสุทธิ์,1
สูตรปกติ,1
จากหญ้าหวาน,1
มีวิตามินซีสูง,1
หอมอ่อนๆ,1
สารสกัดจากหญ้าหวาน,1
ร้อนในน้ำกระเจี๊ยบ,1
น้ำเห็ด,1
สูตรปกติอีก,1
อาหารสูงน้ำมะตูม,1
โครงการหลวง,1
สูตรโซเดียมต่ำ,1
กลีบกุหลาบ,1
ส่วนรสชาติต่างกันนิดหน่อย,1
รสออกมะม่วงนำ,1
หมูกระป๋อง,1
รูปมาผิดนิดหน่อย,1
ผสมเสาวรส,1
ยมน้ำฝรั่ง,1
น้ำมัน,1
โจ๊กหมูกระป๋อง,1
รสชาติต่างกันนิดหน่อย,1
วิตามินซีสูงสูตร,1
สูงสูตร,1
จากน้ำมัน,1
สูงน้ำมะตูม,1
น้ำมะตูม,1
แบบมะขามป้อมแท้,1
ออกมะม่วงนำ,1
วิตามินเอสูงน้ำ,1
น้ำลิ้นจี่,1
ยมน้ำมะม่วง,1
ขับเสมหะ,1
รสธรรมชาติ,1
เมียบด,1
คุณค่าจากน้ำมัน,1
